brand_raw,raw_text,url,size_hint_inch,price_hint_eur,price_local,currency,price_eur,platform,country,scraped_at,asin,elkjop_sku,model_year,filter_year,source_brand,fx_rate_date
Samsung,"Samsung Crystal UHD 4K U7099F 43 Zoll (108 cm) LED, Optimiert für Fussball und Gaming, Prozessor 4K, AI Upscaling, SmartThings, Knox Security, Smart TV, 2025",https://www.amazon.de/dp/B0F5BR3WSK,43.0,259.0,259.0,EUR,259.0,Amazon,DE,2026-07-22T06:48:25Z,B0F5BR3WSK,,,,,
Samsung,"Samsung QLED Q7F2 4K 55 Zoll (138 cm) UHD Fernseher, Q4 AI Prozessor, Quantum Dot für Reale Farben, 4K Upscaling, Knox Security, Gaming Hub, Kostenlose Inhalte, Samsung Vision AI Smart TV",https://www.amazon.de/dp/B0F62T33BJ,55.0,389.0,389.0,EUR,389.0,Amazon,DE,2026-07-22T06:48:25Z,B0F62T33BJ,,,,,
Samsung,Samsung 50 Zoll Mini LED M1EH 4K Samsung Vision AI Smart TV (2026),https://www.amazon.de/dp/B0H5P9P2GX,50.0,629.1,629.1,EUR,629.1,Amazon,DE,2026-07-22T06:48:25Z,B0H5P9P2GX,,,,,
Samsung,"Samsung Crystal UHD U8079F 4K 50 Zoll (125 cm) LED Fernseher, Crystal Prozessor 4K, MetalStream Design, SmartThings, AI Upscaling, Gaming Hub, Knox Security, Kostenlose Inhalte, Smart TV",https://www.amazon.de/dp/B0F62WYBXV,50.0,348.99,348.99,EUR,348.99,Amazon,DE,2026-07-22T06:48:25Z,B0F62WYBXV,,,,,
Samsung,"Samsung QLED Q7F 4K Smart TV 43 Zoll (108 cm) mit AI-Vision, 100% Farbvolumen mit Quantum Dot, HDR10+, Q4 AI Prozessor, One UI Tizen, Wi-Fi, Bluetooth 5.3 und Motion Xcelerator",https://www.amazon.de/dp/B0FFSRHM9L,43.0,262.22,262.22,EUR,262.22,Amazon,DE,2026-07-22T06:48:25Z,B0FFSRHM9L,,,,,
Samsung,"Samsung Crystal UHD U8079F 4K 55 Zoll (138 cm) LED Fernseher, Crystal Prozessor 4K, MetalStream Design, SmartThings, AI Upscaling, Gaming Hub, Knox Security, Kostenlose Inhalte, Smart TV",https://www.amazon.de/dp/B0F62VWJX3,55.0,363.44,363.44,EUR,363.44,Amazon,DE,2026-07-22T06:48:25Z,B0F62VWJX3,,,,,
Samsung,"Samsung Crystal UHD 4K U7099F 65 Zoll (163 cm) LED, Optimiert für Fussball und Gaming, Prozessor, AI Upscaling, SmartThings, Knox Security, Smart TV, 2025",https://www.amazon.de/dp/B0F5BSYQGZ,65.0,,,,,Amazon,DE,2026-07-22T06:48:25Z,B0F5BSYQGZ,,,,,
Samsung,"Samsung QLED Q8F 4K 65 Zoll (163 cm) UHD, Q4 AI Prozessor, Quantum Dot, AirSlim Design, Upscaling, Gaming Hub, Smart TV, 2025",https://www.amazon.de/dp/B0FCXFKMPZ,65.0,689.99,689.99,EUR,689.99,Amazon,DE,2026-07-22T06:48:25Z,B0FCXFKMPZ,,,,,
Samsung,"Samsung RU7099 108 cm (43 Zoll) LED Fernseher (Ultra HD, HDR, Triple Tuner, Smart TV) [Modelljahr 2019]",https://www.amazon.de/dp/B07WL6ZX97,43.0,289.99,289.99,EUR,289.99,Amazon,DE,2026-07-22T06:48:25Z,B07WL6ZX97,,,,,
Samsung,"Samsung QLED 4K Q7FA 65 Zoll (163 cm) UHD, Q4 AI Prozessor, Quantum Dot, Upscaling, Gaming Hub, Knox Security, Smart TV, 2025",https://www.amazon.de/dp/B0F5BX12JR,65.0,579.99,579.99,EUR,579.99,Amazon,DE,2026-07-22T06:48:25Z,B0F5BX12JR,,,,,
Samsung,"Samsung QLED 4K Q60D 43 Zoll Fernseher mit Quantum Prozessor Lite, 100% Farbvolumen, Upscaling, Tizen OS, Smart TV, 43Q60D [2024]",https://www.amazon.de/dp/B0D5BNFMHF,43.0,320.24,320.24,EUR,320.24,Amazon,DE,2026-07-22T06:48:25Z,B0D5BNFMHF,,,,,
Samsung,"Samsung Neo QLED 4K QN70F 55 Zoll (138 cm) Mini LED Fernseher, Optimiert für Fussball, NQ4 AI Gen2 Prozessor, Quantum Matrix Technology Slim, Motion Xcelerator, Samsung Vision AI Smart TV",https://www.amazon.de/dp/B0DF6PGDMT,55.0,593.92,593.92,EUR,593.92,Amazon,DE,2026-07-22T06:48:25Z,B0DF6PGDMT,,,,,
Samsung,"Samsung OLED 4K S90F 55 Zoll (138 cm), UHD Fernseher, Optimiert für Fussball und Gaming, NQ4 AI Gen3 Prozessor, OLED HDR+, 4K Upscaling Pro, Dolby Atmos, Motion Xcelerator, Samsung Vision AI Smart TV",https://www.amazon.de/dp/B0F62WB7N6,55.0,939.0,939.0,EUR,939.0,Amazon,DE,2026-07-22T06:48:25Z,B0F62WB7N6,,,,,
Samsung,"Samsung Full HD F6009F 32 Zoll (81 cm) LED Flachbildfernseher, PurColor-Technologie, HDR, Object Tracking Sound Lite, Knox Security, One UI Tizen, Smart TV, Unbegrenzt kostenlose Inhalte",https://www.amazon.de/dp/B0DFVXK726,32.0,276.9,276.9,EUR,276.9,Amazon,DE,2026-07-22T06:48:25Z,B0DFVXK726,,,,,
Samsung,"Samsung Neo QLED 4K QN85F 65 Zoll (163 cm) Mini LED Fernseher, Optimiert für Fussball, NQ4 AI Gen2 Prozessor, Quantum Matrix Plus, Dolby Atmos, Knox Security, Samsung Vision AI Smart TV",https://www.amazon.de/dp/B0DFVGG5PZ,65.0,999.0,999.0,EUR,999.0,Amazon,DE,2026-07-22T06:48:25Z,B0DFVGG5PZ,,,,,
Samsung,"Samsung QLED 4K Q6FA 75 Zoll (189 cm) UHD Fernseher, 100% Farbvolumen für satte Farben, Quantum HDR, 4K Upscaling, Knox Security, Kostenlos 900 Sender TV Plus, Samsung Vision AI Smart TV",https://www.amazon.de/dp/B0FKTKVZ2J,75.0,699.0,699.0,EUR,699.0,Amazon,DE,2026-07-22T06:48:25Z,B0FKTKVZ2J,,,,,
Samsung,"Samsung Neo QLED 4K QN70F 55 Zoll (140 cm) 4K Fernseher TV mit Neural Quantum AI Gen2 Prozessor, Quantum-Matrix-Technologie Slim, Upscaling, Smart TV, 55QN70F [2025]",https://www.amazon.de/dp/B0FC33TCJX,55.0,505.0,505.0,EUR,505.0,Amazon,DE,2026-07-22T06:48:25Z,B0FC33TCJX,,,,,
Samsung,"Samsung QLED Q7F 4K Smart TV 55 Zoll (138 cm) mit AI-Vision, 100% Farbvolumen mit Quantum Dot, HDR10+, Q4 AI Prozessor, One UI Tizen, Wi-Fi, Bluetooth 5.3 und Motion...[Länderversion Ungarisch]",https://www.amazon.de/dp/B0FM8SY9ZK,55.0,373.33,373.33,EUR,373.33,Amazon,DE,2026-07-22T06:48:25Z,B0FM8SY9ZK,,,,,
Samsung,"Samsung QLED 4K Q6FA 55 Zoll (138 cm) UHD Fernseher, Optimiert für Fussball, 100% Farbvolumen, Quantum HDR, 4K Upscaling, 900 Sender TV Plus, Vision AI Smart TV, 2025",https://www.amazon.de/dp/B0GJTMPY2F,55.0,474.99,474.99,EUR,474.99,Amazon,DE,2026-07-22T06:48:25Z,B0GJTMPY2F,,,,,
Samsung,"Samsung Crystal UHD DU7170 50 Zoll Fernseher, 127 cm (50DU7170), PurColor, Crystal Prozessor 4K, Q-Symphony, Smart TV [2024]",https://www.amazon.de/dp/B0D5DJF9QQ,50.0,297.21,297.21,EUR,297.21,Amazon,DE,2026-07-22T06:48:25Z,B0D5DJF9QQ,,,,,
Samsung,"Samsung Crystal UHD 4K U80F 55 Zoll (138 cm) LED Fernseher, Crystal Prozessor 4K, MetalStream Design, SmartThings, Knox Security, Gaming Hub, AI Upscaling, Kostenlos...[Länderversion Ungarisch]",https://www.amazon.de/dp/B0FLJYHB8D,55.0,355.0,355.0,EUR,355.0,Amazon,DE,2026-07-22T06:48:25Z,B0FLJYHB8D,,,,,
Samsung,"Samsung QLED Q7F4 4K 65 Zoll UHD Fernseher, Q4 AI Prozessor, Quantum Dot Für Reale Farben, Upscaling, Knox Security, Adaptive Sound, Samsung Vision Smart TV, 65Q7F (2025), 165 Cm",https://www.amazon.de/dp/B0FFB4LJ94,65.0,516.66,516.66,EUR,516.66,Amazon,DE,2026-07-22T06:48:25Z,B0FFB4LJ94,,,,,
Samsung,"Samsung Neo QLED 4K QN70F 65 Zoll (165 cm) 4K Fernseher TV mit Neural Quantum AI Gen2 Prozessor, Quantum-Matrix-Technologie Slim, Upscaling, Smart TV, 65QN70F [2025]",https://www.amazon.de/dp/B0FC32BSZ1,65.0,655.56,655.56,EUR,655.56,Amazon,DE,2026-07-22T06:48:25Z,B0FC32BSZ1,,,,,
Samsung,"Samsung OLED 4K S90F 42 Zoll (107 cm), UHD Fernseher, NQ4 AI Gen3 Prozessor, OLED HDR+, 4K Upscaling Pro, Dolby Atmos, Gaming Hub, Motion Xcelerator 144Hz, Samsung Vision AI Smart TV, 42S90F",https://www.amazon.de/dp/B0FNRXK2HX,42.0,699.0,699.0,EUR,699.0,Amazon,DE,2026-07-22T06:48:25Z,B0FNRXK2HX,,,,,
Samsung,"Samsung Neo QLED 4K QN90F 55 Zoll (138 cm) Mini LED Fernseher, Antireflexion, NQ4 AI Gen3 Prozessor, Neo Quantum HDR+, 4K Upscaling Pro, Dolby Atmos, Knox Security, Samsung Vision AI Smart TV",https://www.amazon.de/dp/B0DFVV8V7N,55.0,979.99,979.99,EUR,979.99,Amazon,DE,2026-07-22T06:48:25Z,B0DFVV8V7N,,,,,
Samsung,"Samsung OLED 4K S85F 65 Zoll (163 cm) UHD Fernseher, NQ4 AI Gen2 Prozessor,4K Upscaling, OLED HDR, Farben Pantone validiert, Dolby Atmos, Gaming-Hub, Knox Security, Samsung Vision AI Smart TV",https://www.amazon.de/dp/B0DF8SM66W,65.0,999.0,999.0,EUR,999.0,Amazon,DE,2026-07-22T06:48:25Z,B0DF8SM66W,,,,,
Samsung,"Samsung QLED Q7F 4K Smart TV 50 Zoll (125 cm) mit AI-Vision, 100% Farbvolumen mit Quantum Dot, HDR10+, Q4 AI Prozessor, One UI Tizen, Wi-Fi, Bluetooth 5.3 und Motion...[Länderversion Ungarisch]",https://www.amazon.de/dp/B0FFSVPJ7Y,50.0,315.45,315.45,EUR,315.45,Amazon,DE,2026-07-22T06:48:25Z,B0FFSVPJ7Y,,,,,
Samsung,"Samsung Full HD TV 24F6000 24 Zoll (61cm) Fernseher, Smart-TV inkl WLAN, HDR 10+, Triple Tuner, UE24F6000FU [2025] [Länderversion Niederländisch]",https://www.amazon.de/dp/B0FV3GPLK5,24.0,203.68,203.68,EUR,203.68,Amazon,DE,2026-07-22T06:48:25Z,B0FV3GPLK5,,,,,
Samsung,"Samsung Crystal UHD 4K DU9079 Fernseher 98 Zoll (249 cm), AI mit Gaming-Hub, Fussball-optimiertes Heimkino, Smart TV mit Alexa, Knox Security, 3D Surround Sound & Q-Symphony, KI TV",https://www.amazon.de/dp/B0CZS4X2S8,98.0,1398.99,1398.99,EUR,1398.99,Amazon,DE,2026-07-22T06:48:25Z,B0CZS4X2S8,,,,,
Samsung,"Samsung Neo QLED 4K QN70F 85 Zoll (214 cm) Mini LED Fernseher, NQ4 AI Gen2 Prozessor, Quantum Matrix Technology Slim, Motion Xcelerator 144Hz, AirSlim Design, Samsung Vision AI Smart TV",https://www.amazon.de/dp/B0DFVWLJSG,85.0,1599.0,1599.0,EUR,1599.0,Amazon,DE,2026-07-22T06:48:25Z,B0DFVWLJSG,,,,,
Samsung,"Samsung Crystal UHD DU7170 43 Zoll Fernseher, 109 cm (43DU7170), PurColor, Crystal Prozessor 4K, Q-Symphony, Smart TV [2024]",https://www.amazon.de/dp/B0D5RHK9TS,43.0,268.82,268.82,EUR,268.82,Amazon,DE,2026-07-22T06:48:25Z,B0D5RHK9TS,,,,,
Samsung,"Samsung Crystal UHD 4K U80F 50 Zoll (125 cm) LED Fernseher, Crystal Prozessor 4K, MetalStream Design, SmartThings, Knox Security, Gaming Hub, AI Upscaling, Koste... [Ungarische Version]",https://www.amazon.de/dp/B0FMF8VJB1,50.0,293.99,293.99,EUR,293.99,Amazon,DE,2026-07-22T06:48:25Z,B0FMF8VJB1,,,,,
Samsung,"Samsung The Frame LS03F 4K QLED 65 Zoll (163 cm) UHD, NQ4 AI Gen2 Prozessor, Art Mode, Artful Picture Quality, One Connect Kabel, Smart TV, 2025",https://www.amazon.de/dp/B0F62T7RFM,65.0,899.0,899.0,EUR,899.0,Amazon,DE,2026-07-22T06:48:25Z,B0F62T7RFM,,,,,
Samsung,"Samsung Crystal UHD 4K DU8070 Fernseher 65 Zoll, (165 cm) Samsung TV mit Dynamic Crystal Color, 4K Upscaling, AirSlim Design, Smart TV, 65DU8070U [2024]",https://www.amazon.de/dp/B0D54HY1LC,65.0,599.0,599.0,EUR,599.0,Amazon,DE,2026-07-22T06:48:25Z,B0D54HY1LC,,,,,
Samsung,"Samsung Neo QLED 4K QN70F 75 Zoll (191 cm) 4K Fernseher TV mit Neural Quantum AI Gen2 Prozessor, Quantum-Matrix-Technologie Slim, Upscaling, Smart TV, 75QN70F [2025]",https://www.amazon.de/dp/B0FC35H3ND,75.0,916.94,916.94,EUR,916.94,Amazon,DE,2026-07-22T06:48:25Z,B0FC35H3ND,,,,,
Samsung,"Samsung QLED Q8F 4K Smart TV 55 Zoll (138 cm) mit AI-Vision, 100% Farbvolumen mit Quantum Dot, HDR10+, Q4 AI Prozessor, One UI Tizen, Wi-Fi, Bluetooth 5.3 und Motion...[Länderversion Ungarisch]",https://www.amazon.de/dp/B0FM989471,55.0,424.18,424.18,EUR,424.18,Amazon,DE,2026-07-22T06:48:25Z,B0FM989471,,,,,
Samsung,"Samsung QLED Q8F 4K Smart TV 50 Zoll (125 cm) mit AI-Vision, 100% Farbvolumen mit Quantum Dot, HDR10+, Q4 AI Prozessor, One UI Tizen, Wi-Fi, Bluetooth 5.3 und Motion...[Länderversion Ungarisch]",https://www.amazon.de/dp/B0FMF6NL7V,50.0,405.42,405.42,EUR,405.42,Amazon,DE,2026-07-22T06:48:25Z,B0FMF6NL7V,,,,,
Samsung,Samsung F6002F Smart TV 27 Zoll Full HD LED DVB-T2/S2/C HD HDR WiFi Bluetooth VESA 2025 [Ungarische Version],https://www.amazon.de/dp/B0FTFSJDYQ,27.0,243.64,243.64,EUR,243.64,Amazon,DE,2026-07-22T06:48:25Z,B0FTFSJDYQ,,,,,
Samsung,"Samsung Neo QLED QN70H 4K 43 Zoll (108 cm) Fernseher, Quantum-Mini-LED für ultrafeine Kontraste, 4K AI Gen2 Prozessor, Motion Xcelerator 144 Hz, AI Companion, Dynamic Sound Pack, Gaming Hub, Smart TV",https://www.amazon.de/dp/B0H3KJH64R,43.0,489.0,489.0,EUR,489.0,Amazon,DE,2026-07-22T06:48:25Z,B0H3KJH64R,,,,,
Samsung,"Samsung QLED Q7F 4K Smart TV 65 Zoll (163 cm) mit AI-Vision, 100% Farbvolumen mit Quantum Dot, HDR10+, Q4 AI Prozessor, One UI Tizen, Wi-Fi, Bluetooth 5.3 und Motion...[Länderversion Ungarisch]",https://www.amazon.de/dp/B0FMRZZJ9Z,65.0,490.69,490.69,EUR,490.69,Amazon,DE,2026-07-22T06:48:25Z,B0FMRZZJ9Z,,,,,
Samsung,"Samsung Neo QLED 4K QN80F Mini LED TV, NQ4 AI Gen2 Processor, Quantum Matrix Technology Slim, Motion Xcelerator 144hz, Airslim Design, 163 Cm, 65 Inch",https://www.amazon.de/dp/B0FMY8JRPW,65.0,709.51,709.51,EUR,709.51,Amazon,DE,2026-07-22T06:48:25Z,B0FMY8JRPW,,,,,
Samsung,"Samsung Series 4 UE32T4302AE 81,3 cm (32"") HD Smart TV WiFi Noir",https://www.amazon.de/dp/B0C277D7N8,32.0,203.01,203.01,EUR,203.01,Amazon,DE,2026-07-22T06:48:25Z,B0C277D7N8,,,,,
Samsung,"Samsung Neo QLED 4K QN80F 55 Zoll (138 cm) Mini LED Fernseher, NQ4 AI Gen2 Prozessor, Quantum Matrix Technology Core, 4K Upscaling, Dolby Atmos, Knox Security, Samsung Vision AI Smart TV",https://www.amazon.de/dp/B0DFVNKP7B,55.0,663.92,663.92,EUR,663.92,Amazon,DE,2026-07-22T06:48:25Z,B0DFVNKP7B,,,,,
Samsung,"Samsung QLED Q8F 4K Smart TV 75 Zoll (189 cm) mit AI-Vision, 100% Farbvolumen mit Quantum Dot, HDR10+, Q4 AI Prozessor, One UI Tizen, Wi-Fi, Bluetooth 5.3 und Motion...[Länderversion Ungarisch]",https://www.amazon.de/dp/B0FHXMLHHK,75.0,669.0,669.0,EUR,669.0,Amazon,DE,2026-07-22T06:48:25Z,B0FHXMLHHK,,,,,
Samsung,"Samsung Crystal UHD TV 4K DU7179 Fernseher 65 Zoll (163 cm), Fernseher mit PurColor, 4K Upscaling, Gaming Hub, Crystal Prozessor, Tizen OS, Smart TV, Alexa, 3D Surround Sound & Q-Symphony",https://www.amazon.de/dp/B0CZS61764,65.0,589.0,589.0,EUR,589.0,Amazon,DE,2026-07-22T06:48:25Z,B0CZS61764,,,,,
Samsung,"Samsung QLED FullHD The Frame 32 Zoll Fernseher (GQ32LS03CBUXZG, Deutsches Modell), mattes Display, austauschbare Rahmen, Art Mode, Smart TV [2023]",https://www.amazon.de/dp/B0BXTB8N28,32.0,362.17,362.17,EUR,362.17,Amazon,DE,2026-07-22T06:48:25Z,B0BXTB8N28,,,,,
Samsung,"Samsung QLED 4K Q60A TV 43 Zoll (GQ43Q60AAUXZG), Quantum HDR, Quantum Prozessor Lite 4K, 100% Farbvolumen [2021]",https://www.amazon.de/dp/B092R8T45C,43.0,339.8,339.8,EUR,339.8,Amazon,DE,2026-07-22T06:48:25Z,B092R8T45C,,,,,
Samsung,"Samsung Crystal UHD 4K U80F 43 Zoll (108 cm) LED Fernseher, Crystal Prozessor 4K, MetalStream Design, SmartThings, Knox Security, Gaming Hub, AI Upscaling, Kostenlos...[Länderversion Ungarisch]",https://www.amazon.de/dp/B0FLDQF3Y7,43.0,,,,,Amazon,DE,2026-07-22T06:48:25Z,B0FLDQF3Y7,,,,,
Samsung,"Samsung TU7079 108 cm (43 Zoll) LED Fernseher (Ultra HD, HDR 10+, Triple Tuner, Smart TV) [Modelljahr 2020]",https://www.amazon.de/dp/B085L8SQ9N,43.0,274.58,274.58,EUR,274.58,Amazon,DE,2026-07-22T06:48:25Z,B085L8SQ9N,,,,,
Xiaomi,"Xiaomi TV F 65, 65 Zoll (165 cm), 4K UHD, Smart TV, Fire OS8, Triple Tuner DVB-C/S/S2/T/T2,HDR10, MEMC, 60Hz mit 120Hz Game Boost Mode,Sprachsteuerung mit Alexa,2GB+32GB, Kompatibel mit Apple AirPlay",https://www.amazon.de/dp/B0F457MQCQ,65.0,399.0,399.0,EUR,399.0,Amazon,DE,2026-07-22T06:48:25Z,B0F457MQCQ,,,,,
Samsung,LED-Fernseher SAMSUNG 43AU7020 43 Zoll (108 cm) Crystal UHD 4K 3840 x 2160 HDR Smart TV Gaming HUB 3 x HDMI,https://www.amazon.de/dp/B0CZ47SPT3,43.0,271.31,271.31,EUR,271.31,Amazon,DE,2026-07-22T06:48:25Z,B0CZ47SPT3,,,,,
Samsung,"Samsung OLED 4K S90F 55 Zoll (140 cm), UHD Fernseher, NQ4 AI Gen3 Prozessor, OLED HDR+, 4K Upscaling Pro, Dolby Atmos, Gaming Hub, Motion Xcelerator 144Hz, Samsung Vision AI Smart TV, 55S90F",https://www.amazon.de/dp/B0FC3M6PW1,55.0,855.0,855.0,EUR,855.0,Amazon,DE,2026-07-22T06:48:25Z,B0FC3M6PW1,,,,,
Samsung,"Samsung Neo QLED 4K QN90F 43 Zoll (109 cm) 4K Fernseher, TV mit Neural Quantum AI Gen3 Prozessor, Quantum-Matrix-Technologie Plus, AI Upscaling Pro, Smart TV, 43QN90F [2025]",https://www.amazon.de/dp/B0FC2FF8W6,43.0,649.09,649.09,EUR,649.09,Amazon,DE,2026-07-22T06:48:25Z,B0FC2FF8W6,,,,,
Samsung,"Samsung 32 Zoll Full HD F6005 4K Smart TV, mehr Kontrast mit HDR, Sound mit OTS Lite, über 500 TV-Plus-Kanäle und Ihre Knox Security geschützten Daten [Länderversion Spanisch]",https://www.amazon.de/dp/B0F22716RJ,32.0,260.0,260.0,EUR,260.0,Amazon,DE,2026-07-22T06:48:25Z,B0F22716RJ,,,,,
Samsung,"Samsung QLED Q8F 4K Smart TV 65 Zoll (163 cm) mit AI-Vision, 100% Farbvolumen mit Quantum Dot, HDR10+, Q4 AI Prozessor, One UI Tizen, Wi-Fi, Bluetooth 5.3 und Motion...[Länderversion Ungarisch]",https://www.amazon.de/dp/B0FMS1KLC8,65.0,572.0,572.0,EUR,572.0,Amazon,DE,2026-07-22T06:48:25Z,B0FMS1KLC8,,,,,
Samsung,"Samsung Crystal UHD DU7170 55 Zoll Fernseher, 140 cm (55DU7170), PurColor, Crystal Prozessor 4K, Q-Symphony, Smart TV [2024]",https://www.amazon.de/dp/B0D4ZLKNRF,55.0,346.5,346.5,EUR,346.5,Amazon,DE,2026-07-22T06:48:25Z,B0D4ZLKNRF,,,,,
Samsung,"Samsung QLED Q7F4 4K 75 Zoll (191 cm) UHD Fernseher, Q4 AI Prozessor, Quantum Dot für Reale Farben, 4K Upscaling, Knox Security, Adaptive Sound, Samsung Vision AI Smart TV, 75Q7F (2025)",https://www.amazon.de/dp/B0FFB5LGJ6,75.0,659.0,659.0,EUR,659.0,Amazon,DE,2026-07-22T06:48:25Z,B0FFB5LGJ6,,,,,
Samsung,"Samsung Crystal U7099H 4K 50 Zoll (125 cm), UHD Fernseher, AI Companion für Deine Fragen, 4K Upscaling, Dynamik Sound Pack für Premium-Sounderlebnis, Gaming Hub, kostenlos 900 Sender, Smart AI TV",https://www.amazon.de/dp/B0GXZJW37V,50.0,459.0,459.0,EUR,459.0,Amazon,DE,2026-07-22T06:48:25Z,B0GXZJW37V,,,,,
Samsung,"Samsung QLED Q7F4 4K 50 Zoll (127 cm) UHD Fernseher, Q4 AI Prozessor, Quantum Dot für Reale Farben, 4K Upscaling, Knox Security, Adaptive Sound, Samsung Vis... [Niederländische Version]",https://www.amazon.de/dp/B0FFB4S5MB,50.0,322.61,322.61,EUR,322.61,Amazon,DE,2026-07-22T06:48:25Z,B0FFB4S5MB,,,,,
Samsung,"Samsung Mini LED M70H 4K 43 Zoll (108 cm) UHD Fernseher, Mini LED Prozessor 4K, AI Companion für Fragen, Pure Spectrum Color, Dynamic SoundPack, MetalStream Design, Gaming Hub, Knox Security, Smart TV",https://www.amazon.de/dp/B0H2J5QPY6,43.0,376.96,376.96,EUR,376.96,Amazon,DE,2026-07-22T06:48:25Z,B0H2J5QPY6,,,,,
Hisense,"Hisense 43E6NT 108cm (43 Zoll) Fernseher, 4K UHD Smart TV, Precision Colour, HDR, Dolby Vision, 60Hz, Triple Tuner DVB-C/S/S2/T/T2, WiFi, HDMI 2.1, Bluetooth, Alexa Built-in, Schwarz, [2024]",https://www.amazon.de/dp/B0CZWNDNXW,43.0,,,,,Amazon,DE,2026-07-22T06:48:25Z,B0CZWNDNXW,,,,,
Samsung,"Samsung Mini LED M70H 4K 43 Zoll (108 cm), UHD Fernseher, Mini LED HDR für beeindruckende Details, Motion Xcelerator 144Hz, Dynamik Sound Pack, AI Companion für Fragen, kostenlos 900 Sender, Smart TV",https://www.amazon.de/dp/B0GXZPJ971,43.0,429.0,429.0,EUR,429.0,Amazon,DE,2026-07-22T06:48:25Z,B0GXZPJ971,,,,,
Samsung,"SAMSUNG TV 43 Zoll QLED Q8F 4K Smart TV mit AI-Vision, 100% Farbvolumen mit Quantum Dot, authentischem Quantum Dot und Motion Xcelerator [Länderversion Spanisch]",https://www.amazon.de/dp/B0F2296XMW,43.0,349.9,349.9,EUR,349.9,Amazon,DE,2026-07-22T06:48:25Z,B0F2296XMW,,,,,
Samsung,"Samsung Crystal UHD 4K TV 43 Zoll (GU43AU7179UXZG, Deutsches Modell), HDR, Q-Symphony, rahmenloses Design, Smart TV [2021]",https://www.amazon.de/dp/B092R9P5S5,43.0,274.58,274.58,EUR,274.58,Amazon,DE,2026-07-22T06:48:25Z,B092R9P5S5,,,,,
Samsung,"Samsung QE32Q5FAAUXZT Smart-TV, 32 Zoll Full HD QLED DVB-T2 CI+ HbbTV Energieeffizienzklasse F",https://www.amazon.de/dp/B0H4MHNH14,32.0,312.0,312.0,EUR,312.0,Amazon,DE,2026-07-22T06:48:25Z,B0H4MHNH14,,,,,
Samsung,"Samsung Neo QLED 4K QN90F 50 Zoll (127 cm) 4K Fernseher, TV mit Neural Quantum AI Gen3 Prozessor, Quantum-Matrix-Technologie Plus, AI Upscaling Pro, Smart TV, 50QN90F [2025]",https://www.amazon.de/dp/B0FC2DKRLN,50.0,694.5,694.5,EUR,694.5,Amazon,DE,2026-07-22T06:48:25Z,B0FC2DKRLN,,,,,
Philips,"Philips 32PHS6000 HD LED Smart TV - 32 Zoll Display mit Pixel Plus, Titan OS Plattform Und Dolby Digital Sound - Funktioniert Mit Alexa Und Google Sprachassistent, 2025",https://www.amazon.de/dp/B0F2N4N53N,32.0,,,,,Amazon,DE,2026-07-22T06:48:25Z,B0F2N4N53N,,,,,
Samsung,"Samsung Series 7 UE43CU7092U Crystal UHD Smart TV 109,2 cm (43"""")",https://www.amazon.de/dp/B0CYTDD425,43.0,274.35,274.35,EUR,274.35,Amazon,DE,2026-07-22T06:48:25Z,B0CYTDD425,,,,,
Samsung,"Samsung OLED TV 4K S90D 55 Zoll (138 cm), Fernseher mit NQ AI Gen2 Prozessor, OLED HDR+, 4K AI Bildverbesserung, Gaming Hub bis 144Hz, Dolby Atmos Sound, OTS Lite, Knox Security, Smart KI TV",https://www.amazon.de/dp/B0D6RZGC3P,55.0,965.0,965.0,EUR,965.0,Amazon,DE,2026-07-22T06:48:25Z,B0D6RZGC3P,,,,,
Samsung,Samsung QE32LS03C QLED-Fernseher 32 Zoll The Frame,https://www.amazon.de/dp/B0BWFPKGMZ,32.0,367.13,367.13,EUR,367.13,Amazon,DE,2026-07-22T06:48:25Z,B0BWFPKGMZ,,,,,
Samsung,"Samsung Neo QLED 4K QN70F 55 Zoll (138 cm) Mini LED Fernseher, NQ4 AI Gen2 Prozessor, Quantum Matrix Technology Slim, Motion Xcelerator 144Hz, AirSlim Design, Samsun...[Länderversion Ungarisch]",https://www.amazon.de/dp/B0FM8TDCTT,55.0,549.9,549.9,EUR,549.9,Amazon,DE,2026-07-22T06:48:25Z,B0FM8TDCTT,,,,,
Samsung,"Samsung UE65F8000 165cm (65 Zoll) 3D LED-Backlight-Fernseher (Full HD, 1000Hz CMR, DVB-T/C/S2, CI+, Smart TV, HbbTV, Sprachsteuerung) schwarz",https://www.amazon.de/dp/B00DYQIU5O,65.0,400.0,400.0,EUR,400.0,Amazon,DE,2026-07-22T06:48:25Z,B00DYQIU5O,,,,,
Samsung,"Samsung QLED Q70D 55 Zoll Fernseher TV Mit Quantum Prozessor 4K, Farbvolumen,ai Upscaling, Tizen OS, Smart TV, 55q70d, [2024], 140 Cm",https://www.amazon.de/dp/B0D54K972K,55.0,588.9,588.9,EUR,588.9,Amazon,DE,2026-07-22T06:48:25Z,B0D54K972K,,,,,
Samsung,"Samsung Neo QLED 4K QN80F 55 Zoll (138 cm) Mini LED Fernseher, NQ4 AI Gen2 Prozessor, Quantum Matrix Technology Slim, Motion Xcelerator 144Hz, AirSlim Design, Samsun...[Länderversion Ungarisch]",https://www.amazon.de/dp/B0FMY7DGWK,55.0,509.0,509.0,EUR,509.0,Amazon,DE,2026-07-22T06:48:25Z,B0FMY7DGWK,,,,,
Samsung,"Cello CTRAV-32TZF 32"" Smart er LED 12V Traveller TV/DVD mit Tizen OS von Samsung, Pitch Perfect Lautsprecher, Gaming Hub, Bluetooth, ideal für Wohnmobile, Triple-Tuner",https://www.amazon.de/dp/B0GHRDVM33,32.0,319.99,319.99,EUR,319.99,Amazon,DE,2026-07-22T06:48:25Z,B0GHRDVM33,,,,,
Samsung,"Samsung OLED 4K S91F 77 Zoll (195 cm), UHD Fernseher, NQ4 AI Gen3 Prozessor, OLED HDR+, 4K Upscaling Pro, Dolby Atmos, Gaming Hub, Motion Xcelerator 144Hz, Samsung Vision AI Smart TV",https://www.amazon.de/dp/B0FVY8PMKN,77.0,1874.99,1874.99,EUR,1874.99,Amazon,DE,2026-07-22T06:48:25Z,B0FVY8PMKN,,,,,
Samsung,"Samsung QLED 4K Q64D Fernseher 65 Zoll, Quantum Prozessor Lite, 100% Farbvolumen, Upscaling, Motion Xcelerator, Smart TV, GQ65Q64DAUXZG, Deutsches Modell, 2024",https://www.amazon.de/dp/B0D1GTWJK9,65.0,,,,,Amazon,DE,2026-07-22T06:48:25Z,B0D1GTWJK9,,,,,
Samsung,"Samsung TV 43 Zoll (108 cm) QLED Q7F 4K Smart TV mit AI-Vision, 100% Farbvolumen mit Quantum Dot, HDR10+, Q4 AI Prozessor, One UI Tizen, Wi-Fi, Bluetooth 5.3 und Mot...[Länderversion Ungarisch]",https://www.amazon.de/dp/B0FM3ZTMKS,43.0,264.82,264.82,EUR,264.82,Amazon,DE,2026-07-22T06:48:25Z,B0FM3ZTMKS,,,,,
Samsung,"Samsung Neo QLED 4K QN90D Fernseher 50 Zoll, Neural Quantum 4K AI Gen2 Prozessor, Mini LED TV, AI Upscaling, Smart TV, Dolby Atmos, Gaming Hub, GQ50QN90DATXZG, Deutsches Modell",https://www.amazon.de/dp/B0CZS1XHGV,50.0,989.0,989.0,EUR,989.0,Amazon,DE,2026-07-22T06:48:25Z,B0CZS1XHGV,,,,,
LG,"LG 43UA75006LA TV 43 Zoll (109 cm) 4K UHD AI TV (α7 Gen8 4K AI Prozessor, webOS 25, 60Hz) [Modelljahr 2025]",https://www.amazon.de/dp/B0F2GHSMX5,43.0,239.0,239.0,EUR,239.0,Amazon,DE,2026-07-22T06:48:25Z,B0F2GHSMX5,,,,,
Samsung,Samsung 55 Zoll OLED S82H 4K Samsung Vision AI Smart TV (2026),https://www.amazon.de/dp/B0H5DBLBS2,55.0,1799.0,1799.0,EUR,1799.0,Amazon,DE,2026-07-22T06:48:25Z,B0H5DBLBS2,,,,,
Samsung,"Samsung Neo QLED 4K QN70F 85 Zoll (216 cm) 4K Fernseher TV mit Neural Quantum AI Gen2 Prozessor, Quantum-Matrix-Technologie Slim, Upscaling, Smart TV, 85QN70F [2025]",https://www.amazon.de/dp/B0FC33PRPD,85.0,1439.0,1439.0,EUR,1439.0,Amazon,DE,2026-07-22T06:48:25Z,B0FC33PRPD,,,,,
Samsung,"Samsung OLED S95F 77 Zoll (195 cm) 4K, NQ4 AI Gen3 Prozessor, OLED HDR Pro, Gaming Hub, Motion Xcelerator 165Hz, Upscaling, Dolby Atmos, Smart TV, 2025",https://www.amazon.de/dp/B0F62WKPXD,77.0,,,,,Amazon,DE,2026-07-22T06:48:25Z,B0F62WKPXD,,,,,
Samsung,"Samsung The Frame LS03F 4K QLED 65 Zoll (165 cm) UHD Fernseher, Modern Frame Design, NQ4 AI Gen2 Prozessor, Art Mode, Artful Picture Quality, One Connect Box, Vision Smart TV, 65LS03FA (2025)",https://www.amazon.de/dp/B0FFBJCVSW,65.0,839.01,839.01,EUR,839.01,Amazon,DE,2026-07-22T06:48:25Z,B0FFBJCVSW,,,,,
Samsung,"Samsung OLED S90H 4K 65 Zoll (163 cm), UHD Fernseher, Antireflexion mit Glare Free, OLED HDR+, Ultimate Gaming Pack (NVIDIA G-SYNC & AMD FreeSync Pro) mit 165Hz, HDMI 2.1, Dolby Atmos, Smart AI TV",https://www.amazon.de/dp/B0GXZLZD3H,65.0,3199.0,3199.0,EUR,3199.0,Amazon,DE,2026-07-22T06:48:25Z,B0GXZLZD3H,,,,,
Samsung,"Samsung TV TU50DU7105 50 Zoll (50 Zoll), Crystal UHD 4K, Smart TV, 2024",https://www.amazon.de/dp/B0D2LH5YTD,50.0,300.27,300.27,EUR,300.27,Amazon,DE,2026-07-22T06:48:25Z,B0D2LH5YTD,,,,,
Samsung,"Samsung Mini LED M80H 4K 55 Zoll (138 cm), UHD Fernseher, Mini LED HDR für beeindruckende Details, Motion Xcelerator 144Hz, AI Fußballmodus, Dynamik Sound Pack, AI Companion für deine Fragen, Smart TV",https://www.amazon.de/dp/B0GXZHZD2Z,55.0,718.74,718.74,EUR,718.74,Amazon,DE,2026-07-22T06:48:25Z,B0GXZHZD2Z,,,,,
Samsung,"Samsung 43-Inch Class QLED Q7F2 Series Samsung Vision AI Smart TV (2025 Model, 43Q7F2)",https://www.amazon.de/dp/B0F63QCT2T,43.0,264.82,264.82,EUR,264.82,Amazon,DE,2026-07-22T06:48:25Z,B0F63QCT2T,,,,,
Samsung,"Samsung TV 43U7022F 4K Ultra HD 43' LED HDR, Model 2025",https://www.amazon.de/dp/B0F7RL94YS,43.0,259.95,259.95,EUR,259.95,Amazon,DE,2026-07-22T06:48:25Z,B0F7RL94YS,,,,,
Samsung,"Samsung Neo QLED 4K QN80F 50 Zoll (125 cm) Mini LED Fernseher, NQ4 AI Gen2 Prozessor, Quantum Matrix Technology Slim, Motion Xcelerator 144Hz, AirSlim Design, Sa... [Ungarische Version]",https://www.amazon.de/dp/B0FHXFNNCD,50.0,474.65,474.65,EUR,474.65,Amazon,DE,2026-07-22T06:48:25Z,B0FHXFNNCD,,,,,
Samsung,"Samsung The Frame LS03F 4K QLED 55 Zoll (138 cm) UHD Fernseher, Modern Frame Design, NQ4 AI Gen2 Prozessor, Art Mode, Artful Picture Quality, One Connect Kabel, Sams...[Länderversion Ungarisch]",https://www.amazon.de/dp/B0FM8QJ5TD,55.0,710.08,710.08,EUR,710.08,Amazon,DE,2026-07-22T06:48:25Z,B0FM8QJ5TD,,,,,
