brand_raw,raw_text,url,size_hint_inch,price_hint_eur,price_local,currency,price_eur,platform,country,scraped_at,asin,elkjop_sku,model_year,filter_year,source_brand,fx_rate_date
Samsung,"Samsung Smart TV 43'' U7000F Crystal UHD 4K TV, Crystal Processor 4K, Object Tracking Sound Lite, Endless Free Content, Gaming Hub, Knox Security, Metal Stream Design [2025]",https://www.amazon.co.uk/dp/B0F6TQGCC8,43.0,254.73,219.0,GBP,254.73,Amazon,GB,2026-07-09T06:12:00Z,B0F6TQGCC8,,,,,2026-07-01
Samsung,"Samsung Smart TV 43-Inch U7020H Crystal UHD 4K TV, HDR10+, Motion Xcelerator, Dynamic Sound Pack, Gaming Hub, Knox Security, Vision AI Companion [2026]",https://www.amazon.co.uk/dp/B0GWJMJMKV,43.0,312.89,269.0,GBP,312.89,Amazon,GB,2026-07-09T06:12:00Z,B0GWJMJMKV,,,,,2026-07-01
Samsung,"Samsung 77 inch OLED S90F 4K Smart TV with AI Vision, Motion Xcelerator 144Hz and Pantone Certified Colors",https://www.amazon.co.uk/dp/B0F2FK87YM,77.0,,,,,Amazon,GB,2026-07-09T06:12:00Z,B0F2FK87YM,,,,,
Samsung,"Samsung Smart TV 50-Inch U7020H Crystal UHD 4K TV, HDR10+, Motion Xcelerator, Dynamic Sound Pack, Gaming Hub, Knox Security, Vision AI Companion [2026]",https://www.amazon.co.uk/dp/B0GWJK91S6,50.0,371.05,319.0,GBP,371.05,Amazon,GB,2026-07-09T06:12:00Z,B0GWJK91S6,,,,,2026-07-01
Samsung,"Samsung Smart TV 43'' U8000F Crystal UHD 4K TV, Crystal Processor 4K, Motion Xcelerator, Gaming Hub, Knox Security, Metal Stream Design [2025]",https://www.amazon.co.uk/dp/B0F6VX56W8,43.0,254.73,219.0,GBP,254.73,Amazon,GB,2026-07-09T06:12:00Z,B0F6VX56W8,,,,,2026-07-01
Samsung,"Samsung Smart TV 55-Inch U7020H Crystal UHD 4K TV, HDR10+, Motion Xcelerator, Dynamic Sound Pack, Gaming Hub, Knox Security, Vision AI Companion [2026]",https://www.amazon.co.uk/dp/B0GWJGV816,55.0,429.2,369.0,GBP,429.2,Amazon,GB,2026-07-09T06:12:00Z,B0GWJGV816,,,,,2026-07-01
Samsung,Samsung 55 Inch QLED Q7F2 AI Smart TV,https://www.amazon.co.uk/dp/B0F6NMYGZ5,55.0,405.94,349.0,GBP,405.94,Amazon,GB,2026-07-09T06:12:00Z,B0F6NMYGZ5,,,,,2026-07-01
Samsung,"Samsung 50"" QLED Q7FA 4K, Q4 AI Processor, 100% Colour Volume with Quantum Dot, Knox Security, Endless Free Content, Samsung Vision AI Smart TV, 2025",https://www.amazon.co.uk/dp/B0F6W2N6H1,50.0,,,,,Amazon,GB,2026-07-09T06:12:00Z,B0F6W2N6H1,,,,,
Samsung,"Samsung 55"" S90F, NQ4 AI Gen3 Processor, 4K AI Upscaling Pro, OLED HDR+, Motion Xcelerator 144Hz, Samsung Vision AI, 2025",https://www.amazon.co.uk/dp/B0F6VNBGQC,55.0,870.04,748.0,GBP,870.04,Amazon,GB,2026-07-09T06:12:00Z,B0F6VNBGQC,,,,,2026-07-01
Samsung,"Samsung Smart TV 50"" Q7F2 QLED 4K TV, Real QLED Certified, Q4 AI Processor, 100% Colour Volume with Quantum Dot, Knox Security, Endless Free Content, Samsung Vision AI [2025]",https://www.amazon.co.uk/dp/B0F6NSJWL9,50.0,423.26,363.89,GBP,423.26,Amazon,GB,2026-07-09T06:12:00Z,B0F6NSJWL9,,,,,2026-07-01
Samsung,Samsung 50 Inch Crystal UHD U8020F Smart TV,https://www.amazon.co.uk/dp/B0F6VTVCW6,50.0,336.15,289.0,GBP,336.15,Amazon,GB,2026-07-09T06:12:00Z,B0F6VTVCW6,,,,,2026-07-01
Samsung,Samsung OLED 48 Inch S93F AI Smart TV,https://www.amazon.co.uk/dp/B0F6TQK1NP,48.0,929.36,799.0,GBP,929.36,Amazon,GB,2026-07-09T06:12:00Z,B0F6TQK1NP,,,,,2026-07-01
Samsung,"Samsung Smart TV Q5F 32-Inch, QLED Full HD, Quantum Dot Colour, HDR, Contrast Enhancer, Tizen OS, Gaming Hub, Slim Look Design, [2026]",https://www.amazon.co.uk/dp/B0GYZ8D9HC,32.0,382.68,329.0,GBP,382.68,Amazon,GB,2026-07-09T06:12:00Z,B0GYZ8D9HC,,,,,2026-07-01
Samsung,"Samsung Smart TV 55-Inch S84F 4K OLED Television for Live Football & Home Cinema, OLED HDR, 4K AI Upscaling, Motion Xcelerator 120Hz Gaming TV, Dolby Atmos, Vision AI [2025] [Energy Class G]",https://www.amazon.co.uk/dp/B0G96NWP4X,55.0,872.36,749.99,GBP,872.36,Amazon,GB,2026-07-09T06:12:00Z,B0G96NWP4X,,,,,2026-07-01
Samsung,"Samsung Smart TV 43-Inch U8000H Crystal UHD 4K TV, HDR10+, Motion Xcelerator, Dynamic Sound Pack, Gaming Hub, Knox Security, Vision AI Companion [2026]",https://www.amazon.co.uk/dp/B0GYZQ5XDK,43.0,324.52,279.0,GBP,324.52,Amazon,GB,2026-07-09T06:12:00Z,B0GYZQ5XDK,,,,,2026-07-01
Samsung,"Samsung Smart TV 55-Inch S83H 4K OLED, Premium 120Hz Gaming TV with AI Upscaling, OLED HDR, Vision AI Companion, Object Tracking Sound Lite & Alexa Built-in [2026]",https://www.amazon.co.uk/dp/B0GYZKRK7N,55.0,1627.26,1399.0,GBP,1627.26,Amazon,GB,2026-07-09T06:12:00Z,B0GYZKRK7N,,,,,2026-07-01
LG,LG 43LR60006LA 43-Inch FHD Smart TV (alpha 5 AI Processor Gen6,https://www.amazon.co.uk/dp/B0FR5HDG5Q,43.0,208.2,179.0,GBP,208.2,Amazon,GB,2026-07-09T06:12:00Z,B0FR5HDG5Q,,,,,2026-07-01
Samsung,"Samsung 65"" QLED Q7FA 4K, Q4 AI Processor, 100% Colour Volume with Quantum Dot, Knox Security, Endless Free Content, Samsung Vision AI Smart TV, 2025",https://www.amazon.co.uk/dp/B0F6VXNQ6C,65.0,626.94,539.0,GBP,626.94,Amazon,GB,2026-07-09T06:12:00Z,B0F6VXNQ6C,,,,,2026-07-01
LG,"LG 43QNED70A6A 43-Inch 4K UHD Smart TV (α7 AI Processor, Amazon Alexa, 60Hz) [Model 2025]",https://www.amazon.co.uk/dp/B0FDR8BQMX,43.0,289.63,249.0,GBP,289.63,Amazon,GB,2026-07-09T06:12:00Z,B0FDR8BQMX,,,,,2026-07-01
Samsung,"Samsung 32 Inch, 720p, T4300 LED HDR Smart TV With Contrast Enhancer, Ultra Clean View & Purcolour Image Technology Built-In, HDMI, USB, Easy To Set Up, App Connectivity",https://www.amazon.co.uk/dp/B089RR148Y,32.0,219.84,189.0,GBP,219.84,Amazon,GB,2026-07-09T06:12:00Z,B089RR148Y,,,,,2026-07-01
Hisense,"Hisense 43"" 43A6QTUK 4K Ultra HD Smart TV AI TV - 4K UHD, Hi-View AI Engine, Precision Colour, AI Smooth Motion, Sports Mode with Freely, Disney +, YouTube, Netflix",https://www.amazon.co.uk/dp/B0F7WPP5YQ,43.0,231.47,199.0,GBP,231.47,Amazon,GB,2026-07-09T06:12:00Z,B0F7WPP5YQ,,,,,2026-07-01
TCL,"TCL 32SF560-UK 32"" Full HD QLED Direct LED Smart TV with Fire TV, Alexa Voice Control, Vivid Colour & Enhanced Brightness",https://www.amazon.co.uk/dp/B0F9PP6BKT,32.0,160.52,138.0,GBP,160.52,Amazon,GB,2026-07-09T06:12:00Z,B0F9PP6BKT,,,,,2026-07-01
Samsung,"TV - Smart TV, 24"" Screen Size, HD Ready Resolution, Apple AirPlay, Samsung Tizen OS & Gaming Hub, Versatile Connectivity, Black, Perfect For Streaming, Gaming & Entertainment - 24HDS1008",https://www.amazon.co.uk/dp/B0F6YYDN1Q,24.0,133.74,114.98,GBP,133.74,Amazon,GB,2026-07-09T06:12:00Z,B0F6YYDN1Q,,,,,2026-07-01
Samsung,"Samsung UE32T4300AEX 32"" Smart HD Ready TV, 2023",https://www.amazon.co.uk/dp/B0BYR6BBVR,32.0,219.84,189.0,GBP,219.84,Amazon,GB,2026-07-09T06:12:00Z,B0BYR6BBVR,,,,,2026-07-01
Samsung,"Samsung Smart TV 43-Inch QN70H Neo QLED 4K Quantum Mini LED, HDR 10+, Motion Xcelerator, Adpative Sound+, Gaming Hub, Knox Security, Voice Control with AI(VAC), Alexa Built-in [2026]",https://www.amazon.co.uk/dp/B0GYZ7Z8B5,43.0,638.57,549.0,GBP,638.57,Amazon,GB,2026-07-09T06:12:00Z,B0GYZ7Z8B5,,,,,2026-07-01
Samsung,"Samsung 85"" 4K QN70F, NQ4 AI Gen2 Processor, 4K AI Upscaling, Quantum Matrix Technology Slim, OTS Lite, Samsung Vision AI,...",https://www.amazon.co.uk/dp/B0DF8WWNKF,85.0,1685.41,1449.0,GBP,1685.41,Amazon,GB,2026-07-09T06:12:00Z,B0DF8WWNKF,,,,,2026-07-01
Samsung,"Samsung Smart TV 55'' U8000F Crystal UHD 4K TV, Crystal Processor 4K, Motion Xcelerator, Gaming Hub, Knox Security, Metal Stream Design [2025]",https://www.amazon.co.uk/dp/B0F6VX1G23,55.0,,,,,Amazon,GB,2026-07-09T06:12:00Z,B0F6VX1G23,,,,,
Samsung,"Samsung Tv 65"" Led Ultra HD 4k Smart Dvb/t2/s2 65u8072",https://www.amazon.co.uk/dp/B0FMS3F365,65.0,,,,,Amazon,GB,2026-07-09T06:12:00Z,B0FMS3F365,,,,,
Samsung,"Samsung AU7100 50 Inch (2021) â€“ Crystal 4K Smart TV With HDR10+ Image Quality, Adaptive Sound, Motion Xcelerator Picture, Samsung Q-Symphony Audio And Gaming Mode - UE50AU7100KXXU",https://www.amazon.co.uk/dp/B08Y6Z944Q,50.0,,,,,Amazon,GB,2026-07-09T06:12:00Z,B08Y6Z944Q,,,,,
Samsung,Samsung 32 Inch HD H5000 Smart TV,https://www.amazon.co.uk/dp/B0F6VMCYRW,32.0,,,,,Amazon,GB,2026-07-09T06:12:00Z,B0F6VMCYRW,,,,,
Samsung,"Samsung 32-Inch Class Full HD F6000 Smart TV (2025 Model) HDR, Object Tracking Sound Lite, Knox Security, One UI Tizen, Sm...",https://www.amazon.co.uk/dp/B0DXN3T1GD,32.0,,,,,Amazon,GB,2026-07-09T06:12:00Z,B0DXN3T1GD,,,,,
Samsung,"Samsung 50"" 4K QN90F, NQ4 AI Gen3 Processor, 4K AI Upscaling Pro, Neo Quantum HDR+, Glare Free, Samsung Vision AI, 2025",https://www.amazon.co.uk/dp/B0DFVV7WT1,50.0,,,,,Amazon,GB,2026-07-09T06:12:00Z,B0DFVV7WT1,,,,,
Samsung,"Samsung QLED Q7F 4K 55"" Smart TV with AI Vision, 100% Color Volume with Quantum Dot, HDR10+, Q4 AI Processor, One UI Tizen, Wi-Fi, Bluetooth 5.3 and Motion Xcelerator",https://www.amazon.co.uk/dp/B0FM8SY9ZK,55.0,,,,,Amazon,GB,2026-07-09T06:12:00Z,B0FM8SY9ZK,,,,,
Xiaomi,"XIAOMI TV F 32, 32 Inch (81 cm), HD, Smart TV, Fire TV, Dolby Audio™, DTS Virtual:X, DTS-HD, Alexa Voice Control, Works with Apple AirPlay",https://www.amazon.co.uk/dp/B0FCXRJ6V5,32.0,138.42,119.0,GBP,138.42,Amazon,GB,2026-07-09T06:12:00Z,B0FCXRJ6V5,,,,,2026-07-01
Samsung,"Samsung Smart TV 50-Inch Mini LED M72H 4K, UHD TV, Mini LED HDR, Motion Xcelerator 144Hz, Dynamic Sound Pack, AI Companion for questions [2026]",https://www.amazon.co.uk/dp/B0GYZH5DGQ,50.0,522.26,449.0,GBP,522.26,Amazon,GB,2026-07-09T06:12:00Z,B0GYZH5DGQ,,,,,2026-07-01
Samsung,"Samsung Smart TV 32-Inch LS03C The Frame Television for Live Football & Home Cinema, With Object Tracking Sound Lite, Tizen OS & Gaming Hub, QLED Technology, Matte Display [2025]",https://www.amazon.co.uk/dp/B0C2VJ1QR5,32.0,375.7,323.0,GBP,375.7,Amazon,GB,2026-07-09T06:12:00Z,B0C2VJ1QR5,,,,,2026-07-01
Samsung,"Samsung QES90F 42"" 4K Ultra HD OLED HDR Smart TV - QE42S90F",https://www.amazon.co.uk/dp/B0FNRXK2HX,42.0,789.78,679.0,GBP,789.78,Amazon,GB,2026-07-09T06:12:00Z,B0FNRXK2HX,,,,,2026-07-01
Samsung,"Samsung 65"" S95F, NQ4 AI Gen3 Processor, 4K AI Upscaling,OLED HDR Pro, Motion Xcelerator 165Hz, Samsung Vision AI, 2025",https://www.amazon.co.uk/dp/B0F6VKMXKQ,65.0,2204.18,1895.0,GBP,2204.18,Amazon,GB,2026-07-09T06:12:00Z,B0F6VKMXKQ,,,,,2026-07-01
Samsung,"Samsung 65"" Q7F5 Vision AI 4K Smart TV, Q4 AI Processor, Bixby Voice Assistant, Quantum HDR, Object Tracking Sound Lite, One UI Tizen, 2025",https://www.amazon.co.uk/dp/B0F6VKL1P2,65.0,696.73,599.0,GBP,696.73,Amazon,GB,2026-07-09T06:12:00Z,B0F6VKL1P2,,,,,2026-07-01
Samsung,"Samsung 55QN70F Neo QLED Smart TV, Mini LED, 138 cm, 4K Ultra HD (2025)",https://www.amazon.co.uk/dp/B0F9X28L93,55.0,638.57,549.0,GBP,638.57,Amazon,GB,2026-07-09T06:12:00Z,B0F9X28L93,,,,,2026-07-01
Samsung,"Samsung 65"" The Frame LS03FA, NQ4 AI Gen2 Processor, QLED, Matte Display, Modern Frame Design & Art Mode, Samsung Vision A...",https://www.amazon.co.uk/dp/B0F5WWJ6H5,65.0,1046.81,899.97,GBP,1046.81,Amazon,GB,2026-07-09T06:12:00Z,B0F5WWJ6H5,,,,,2026-07-01
Samsung,Samsung 55 Inch Neo QLED 4K with Mini LED QN93F Glare Free AI Smart TV,https://www.amazon.co.uk/dp/B0DFVVM8NV,55.0,,,,,Amazon,GB,2026-07-09T06:12:00Z,B0DFVVM8NV,,,,,
Samsung,Samsung T5300 32 Inch Full HD HDR Smart LED TV,https://www.amazon.co.uk/dp/B09HR4STPF,32.0,243.1,209.0,GBP,243.1,Amazon,GB,2026-07-09T06:12:00Z,B09HR4STPF,,,,,2026-07-01
Samsung,"Samsung 65"" 4K QN80F, NQ4 AI Gen2 Processor, 4K AI Upscaling, Quantum Matrix Technology Core, OTS Lite, Samsung Vision AI,...",https://www.amazon.co.uk/dp/B0DF6NZRWD,65.0,1050.32,902.99,GBP,1050.32,Amazon,GB,2026-07-09T06:12:00Z,B0DF6NZRWD,,,,,2026-07-01
Samsung,"Samsung 98"" 4K Ultra HD Smart TV",https://www.amazon.co.uk/dp/B0D1YJ8BGQ,98.0,1627.26,1399.0,GBP,1627.26,Amazon,GB,2026-07-09T06:12:00Z,B0D1YJ8BGQ,,,,,2026-07-01
Samsung,"Samsung Neo QLED 4K QN70F 65"" Mini LED TV, NQ4 AI Gen2 Processor, Quantum Matrix Technology Slim, Motion Xcelerator 144Hz, AirSlim, Samsung Vision AI Smart TV",https://www.amazon.co.uk/dp/B0FHXPNHGR,65.0,871.2,749.0,GBP,871.2,Amazon,GB,2026-07-09T06:12:00Z,B0FHXPNHGR,,,,,2026-07-01
Samsung,"Samsung 43"" Q8F, Q4 Ai Processor, Quantum HDR+, Motion Xcelerator, Air Slim Design, Samsung Vision AI, 2025",https://www.amazon.co.uk/dp/B0F6VKLHR6,43.0,464.1,399.0,GBP,464.1,Amazon,GB,2026-07-09T06:12:00Z,B0F6VKLHR6,,,,,2026-07-01
Samsung,"Samsung QE77S91FAEXXU 77"" S91F 4K OLED HDR+ WIFI & Bluetooth enabled Motion Xcelerator 144Hz 4 HDMI, 2 USB, Vision AI Smart TV - Alexa Voice Assistant",https://www.amazon.co.uk/dp/B0GH1RR8CB,77.0,1976.2,1699.0,GBP,1976.2,Amazon,GB,2026-07-09T06:12:00Z,B0GH1RR8CB,,,,,2026-07-01
Samsung,"Samsung QLED Q7F 4K 50"" Smart TV with AI Vision, 100% Color Volume with Quantum Dot, HDR10+, Q4 AI Processor, One UI Tizen, Wi-Fi, Bluetooth 5.3 and Motion Xcelerator",https://www.amazon.co.uk/dp/B0FFSVPJ7Y,50.0,428.04,368.0,GBP,428.04,Amazon,GB,2026-07-09T06:12:00Z,B0FFSVPJ7Y,,,,,2026-07-01
Samsung,"Samsung 75"" Neo QLED QN1EF 4K, NQ4 AI Processor, Quantum Matrix Technology, Vision AI Smart TV, 2025",https://www.amazon.co.uk/dp/B0F6VKGXV8,75.0,1336.47,1149.0,GBP,1336.47,Amazon,GB,2026-07-09T06:12:00Z,B0F6VKGXV8,,,,,2026-07-01
Samsung,"Samsung 55"" 4K QN85F, NQ4 AI Gen2 Processor, 4K AI Upscaling, Neo Quantum HDR+, Glare Free, Samsung Vision AI, 2025",https://www.amazon.co.uk/dp/B0F6VD73DY,55.0,929.36,799.0,GBP,929.36,Amazon,GB,2026-07-09T06:12:00Z,B0F6VD73DY,,,,,2026-07-01
Samsung,Samsung QE32LS03C 32-inch QLED TV The Frame,https://www.amazon.co.uk/dp/B0BWFPKGMZ,32.0,371.05,319.0,GBP,371.05,Amazon,GB,2026-07-09T06:12:00Z,B0BWFPKGMZ,,,,,2026-07-01
Samsung,"Samsung DU7110 55"" Crystal UHD SmartTV, With Crystal Processor 4K, PurColour, Object Tracking Sound Lite, Gaming Hub, Smart TV powered by Tizen, UE55DU7110KXXU, English Model (2024)",https://www.amazon.co.uk/dp/B0CYC4YY4F,55.0,475.73,409.0,GBP,475.73,Amazon,GB,2026-07-09T06:12:00Z,B0CYC4YY4F,,,,,2026-07-01
Samsung,"Samsung 50"" TU7000 HDR Smart 4K TV with Tizen OS",https://www.amazon.co.uk/dp/B085RXVRVY,50.0,324.52,279.0,GBP,324.52,Amazon,GB,2026-07-09T06:12:00Z,B085RXVRVY,,,,,2026-07-01
Samsung,"Samsung Neo QLED 4K QN70F 55"" Mini LED TV NQ4 AI Gen2 Quantum Matrix Technology Slim, Motion Xcelerator 144Hz, AirSlim, Samsung Vision, AI Smart TV",https://www.amazon.co.uk/dp/B0FM8TDCTT,55.0,638.57,549.0,GBP,638.57,Amazon,GB,2026-07-09T06:12:00Z,B0FM8TDCTT,,,,,2026-07-01
Samsung,"Samsung QE83S91FAEXXU 83"" S91F 4K OLED HDR+ WIFI & Bluetooth enabled Motion Xcelerator 144Hz 4 HDMI, 2 USB, Vision AI Smart TV - Alexa Voice Assistant",https://www.amazon.co.uk/dp/B0GH17C5JS,83.0,2674.1,2299.0,GBP,2674.1,Amazon,GB,2026-07-09T06:12:00Z,B0GH17C5JS,,,,,2026-07-01
Samsung,Samsung QE43Q7F QLED 4k TV (QE43Q7FAAUXXH),https://www.amazon.co.uk/dp/B0FM3ZTMKS,43.0,277.99,239.0,GBP,277.99,Amazon,GB,2026-07-09T06:12:00Z,B0FM3ZTMKS,,,,,2026-07-01
Samsung,"Samsung Smart TV 27-Inch The Movingstyle QHD Portable Television for Live Football & Home Cinema, Touch Screen, Built-in Battery, 120Hz Gaming TV, HDR10+, Dolby Atmos [2025]",https://www.amazon.co.uk/dp/B0G98STGYR,27.0,1161.99,999.0,GBP,1161.99,Amazon,GB,2026-07-09T06:12:00Z,B0G98STGYR,,,,,2026-07-01
Samsung,Samsung 75 Inch Neo QLED 4K with Mini LED QN73F AI Smart TV,https://www.amazon.co.uk/dp/B0DF8ZYD27,75.0,1394.62,1199.0,GBP,1394.62,Amazon,GB,2026-07-09T06:12:00Z,B0DF8ZYD27,,,,,2026-07-01
Samsung,"Samsung Smart TV 65-Inch LS03HA The Frame, 4K QLED, Glare-Free, HDR 10+, Motion Xcelerator 144Hz, Dolby Atmos, Gaming Hub, FreeSync Premium, Art Mode, Voice Control with AI(VAC), Alexa Built-in [2026]",https://www.amazon.co.uk/dp/B0GYZKDCW5,65.0,2092.52,1799.0,GBP,2092.52,Amazon,GB,2026-07-09T06:12:00Z,B0GYZKDCW5,,,,,2026-07-01
Samsung,Samsung 75 Inch Neo QLED 8K with Mini LED QN900F Glare Free AI Smart TV,https://www.amazon.co.uk/dp/B0F6VRPG67,75.0,2557.78,2199.0,GBP,2557.78,Amazon,GB,2026-07-09T06:12:00Z,B0F6VRPG67,,,,,2026-07-01
Samsung,Samsung QN32LS03CBFXZA 32 Inch The Frame QLED Smart TV with Art Mode and 2 Year Amber Protection Plan (2023),https://www.amazon.co.uk/dp/B0D4SSM4V1,32.0,382.68,329.0,GBP,382.68,Amazon,GB,2026-07-09T06:12:00Z,B0D4SSM4V1,,,,,2026-07-01
Samsung,Samsung Series 7 UE50TU7020W 50 Inch 4K Ultra HD Smart TV WiFi Black,https://www.amazon.co.uk/dp/B08LC17NSL,50.0,324.52,279.0,GBP,324.52,Amazon,GB,2026-07-09T06:12:00Z,B08LC17NSL,,,,,2026-07-01
Samsung,Samsung The Frame 43 Inch 4K TV - TQ43LS03FAUXXC,https://www.amazon.co.uk/dp/B0F229Y3KG,43.0,696.73,599.0,GBP,696.73,Amazon,GB,2026-07-09T06:12:00Z,B0F229Y3KG,,,,,2026-07-01
Samsung,"Samsung Smart TV 55-Inch S95H OLED 4K, Glare-Free, HDR 10+, Motion Xcelerator 165Hz, Dolby Atmos, Gaming Hub, FreeSync Premium Pro, G-Sync, Voice Control with AI(VAC), Alexa Built-in [2026]",https://www.amazon.co.uk/dp/B0GYZ7VDN9,55.0,2557.78,2199.0,GBP,2557.78,Amazon,GB,2026-07-09T06:12:00Z,B0GYZ7VDN9,,,,,2026-07-01
Samsung,"Samsung 75"" The Frame Pro LS03WF, NQ4 AI Gen3 Processor, NEO QLED, Matte Display, Modern Frame Design & Art Mode, Samsung Vision AI, 2025",https://www.amazon.co.uk/dp/B0F6VXNKY6,75.0,1859.89,1599.0,GBP,1859.89,Amazon,GB,2026-07-09T06:12:00Z,B0F6VXNKY6,,,,,2026-07-01
Samsung,Samsung TV The Frame 55 Inch (2025) 4K Smart TV - TQ55LS03FAUXXC,https://www.amazon.co.uk/dp/B0F2295TXB,55.0,929.36,799.0,GBP,929.36,Amazon,GB,2026-07-09T06:12:00Z,B0F2295TXB,,,,,2026-07-01
Samsung,"Samsung QLED TV 2023 98Q80C 98"" Smart TV, Direct Full Array, Quantum HDR 1500, 60W with Dolby Atmos, 4K QLED Processor and Motion Xcelerator Turbo+",https://www.amazon.co.uk/dp/B0BVG8GYC8,98.0,7190.86,6182.2,GBP,7190.86,Amazon,GB,2026-07-09T06:12:00Z,B0BVG8GYC8,,,,,2026-07-01
LG,"LG OLED55B56LA 55-Inch OLED 4K UHD Smart TV, B5 Series, (α8 AI Processor, Dolby Atmos, Freeview Play and Amazon Alexa, 120Hz) [Model 2025]",https://www.amazon.co.uk/dp/B0F14R653N,55.0,1045.68,899.0,GBP,1045.68,Amazon,GB,2026-07-09T06:12:00Z,B0F14R653N,,,,,2026-07-01
Samsung,SAMSUNG TQ48S90FAEXXC,https://www.amazon.co.uk/dp/B0FLDWT7ZF,48.0,917.73,789.0,GBP,917.73,Amazon,GB,2026-07-09T06:12:00Z,B0FLDWT7ZF,,,,,2026-07-01
Hisense,"Hisense 43"" 43E78QTUK QLED Smart AI TV - 4K Direct Lit Viewing, Quantum Dot Colour, Hi-View AI Engine, Dolby Vision, Dolby Atmos with Freely, Disney +, YouTube, Netflix",https://www.amazon.co.uk/dp/B0F7WM1171,43.0,301.26,259.0,GBP,301.26,Amazon,GB,2026-07-09T06:12:00Z,B0F7WM1171,,,,,2026-07-01
LG,"LG 32LQ63806LC 32inch LED Full HD Smart TV, Model 2024",https://www.amazon.co.uk/dp/B0D17VJPSD,32.0,241.97,208.03,GBP,241.97,Amazon,GB,2026-07-09T06:12:00Z,B0D17VJPSD,,,,,2026-07-01
Samsung,Samsung The Frame 43 Inch (VG-SCFA43TKBXC) in Modern Teak,https://www.amazon.co.uk/dp/B096BMLRCP,43.0,109.79,94.39,GBP,109.79,Amazon,GB,2026-07-09T06:12:00Z,B096BMLRCP,,,,,2026-07-01
Hisense,"Hisense 43"" 43E6QTUK 4K Ultra HD Smart TV AI TV - 4K UHD, Hi-View AI Engine, Precision Colour, AI Smooth Motion, Sports Mode with Freely, Disney +, YouTube, Netflix",https://www.amazon.co.uk/dp/B0F7WLZN2T,43.0,266.36,229.0,GBP,266.36,Amazon,GB,2026-07-09T06:12:00Z,B0F7WLZN2T,,,,,2026-07-01
Hisense,"Hisense 40"" 40A4QTUK FHD LED TV with Freely - Direct Lit LED, Dolby Audio, Natural Colour Enhancer, Games Mode, Sports Mode with Freely, Disney +, YouTube, Netflix",https://www.amazon.co.uk/dp/B0F7WFJB57,40.0,219.84,189.0,GBP,219.84,Amazon,GB,2026-07-09T06:12:00Z,B0F7WFJB57,,,,,2026-07-01
Samsung,Samsung QN50LS03DA 50 inch The Frame QLED 4K Smart TV (2024 Model) Bundle with Redeemable DIRECTV Gemini Air Streaming Device and 1 YR CPS Enhanced Protection Pack,https://www.amazon.co.uk/dp/B0D62V4YP9,50.0,813.05,699.0,GBP,813.05,Amazon,GB,2026-07-09T06:12:00Z,B0D62V4YP9,,,,,2026-07-01
Samsung,"Samsung LT24E310EX 23"" HD ready Black LED TV - LED TVs (HD ready, A, 16:9, Mega Contrast, Black, 1366 x 768 pixels)",https://www.amazon.co.uk/dp/B00ZC8J56U,23.0,875.86,753.0,GBP,875.86,Amazon,GB,2026-07-09T06:12:00Z,B00ZC8J56U,,,,,2026-07-01
Samsung,Samsung T28E310 28 -inch LCD 50 Hz TV,https://www.amazon.co.uk/dp/B013DUSOZG,28.0,1394.62,1199.0,GBP,1394.62,Amazon,GB,2026-07-09T06:12:00Z,B013DUSOZG,,,,,2026-07-01
Samsung,"Samsung HG32CF800EU HCF8000 Series - 32"" LED-backlit LCD TV - QLED - Full HD - for hotel/hospitality",https://www.amazon.co.uk/dp/B0FVLL714C,32.0,401.7,345.35,GBP,401.7,Amazon,GB,2026-07-09T06:12:00Z,B0FVLL714C,,,,,2026-07-01
Samsung,"Samsung HG55AU800EE HAU8000 Series - 55"" LED-backlit LCD TV - Crystal UHD - 4K - for hotel/hospitality",https://www.amazon.co.uk/dp/B0CF2FR2TC,55.0,,,,,Amazon,GB,2026-07-09T06:12:00Z,B0CF2FR2TC,,,,,
Samsung,"Samsung Smart TV 65-Inch U7000H Crystal UHD 4K TV, HDR10+, Motion Xcelerator, Dynamic Sound Pack, Gaming Hub, Knox Security, Vision AI Companion [2026]",https://www.amazon.co.uk/dp/B0GZ342L5C,65.0,568.78,489.0,GBP,568.78,Amazon,GB,2026-07-09T06:12:00Z,B0GZ342L5C,,,,,2026-07-01
Samsung,Samsung QE32Q50A 32-inch QLED TV,https://www.amazon.co.uk/dp/B0BWFMYZQG,32.0,,,,,Amazon,GB,2026-07-09T06:12:00Z,B0BWFMYZQG,,,,,
Samsung,Samsung TV LED 55U8072 138 cm Smart 4K Ultra HD 50Hz Model 2025 UE55U8072FUXXH [Country Version Hungarian],https://www.amazon.co.uk/dp/B0FF1THHJ9,55.0,417.57,359.0,GBP,417.57,Amazon,GB,2026-07-09T06:12:00Z,B0FF1THHJ9,,,,,2026-07-01
Samsung,"Samsung TV 75"" QN95D Neo QLED 4K Mini LED TV, Infinity One Design, Dolby Atmos, Quantum Matrix Technology, Motion Xcelerator 144Hz, Object Tracking Sound+",https://www.amazon.co.uk/dp/B0CYBMWVG9,75.0,2092.52,1799.0,GBP,2092.52,Amazon,GB,2026-07-09T06:12:00Z,B0CYBMWVG9,,,,,2026-07-01
Samsung,"Samsung The Terrace 2023 55LST7 55"" Primer QLED Outdoor Smart TV, Water and Dust Resistant, Anti-Glare Screen with 2000 nits, Adaptive Image and Smart TV Powered by Tizen",https://www.amazon.co.uk/dp/B0BS4BDSM1,55.0,5029.59,4324.09,GBP,5029.59,Amazon,GB,2026-07-09T06:12:00Z,B0BS4BDSM1,,,,,2026-07-01
Samsung,"Samsung Smart TV 65 Inch U8020H Crystal UHD 4K TV, HDR10+, Motion Xcelerator, Dynamic Sound Pack, Gaming Hub, Knox Security, Vision AI Companion [2026]",https://www.amazon.co.uk/dp/B0GYYY97KL,65.0,615.31,529.0,GBP,615.31,Amazon,GB,2026-07-09T06:12:00Z,B0GYYY97KL,,,,,2026-07-01
Samsung,"Samsung TV QLED 50"" Q60D 2024, 4K, Smart TV",https://www.amazon.co.uk/dp/B0CS3J3B7V,50.0,893.76,768.39,GBP,893.76,Amazon,GB,2026-07-09T06:12:00Z,B0CS3J3B7V,,,,,2026-07-01
Samsung,Samsung The Frame 50 Inch (2025) 4K Smart TV - TQ50LS03FAUXXC [Spanish version],https://www.amazon.co.uk/dp/B0F225B9KJ,50.0,786.29,676.0,GBP,786.29,Amazon,GB,2026-07-09T06:12:00Z,B0F225B9KJ,,,,,2026-07-01
Samsung,SAMSUNG UE32T4302AE - 32 inch (81 cm) - LED - 2020,https://www.amazon.co.uk/dp/B08HDKTK7R,32.0,215.18,185.0,GBP,215.18,Amazon,GB,2026-07-09T06:12:00Z,B08HDKTK7R,,,,,2026-07-01
Samsung,"Samsung Smart TV 100-Inch QN80H Neo QLED 4K, Quantum Mini LED, NQ HDR+, Motion Xcelerator 144Hz, Dolby Atmos & OTS Lite, Gaming Hub, FreeSync Premium Pro, Knox Security, Vision AI, Alexa [2026]",https://www.amazon.co.uk/dp/B0GYZ7TPPL,100.0,4651.46,3999.0,GBP,4651.46,Amazon,GB,2026-07-09T06:12:00Z,B0GYZ7TPPL,,,,,2026-07-01
Samsung,Samsung UE65CU8000 65 Inch Crystal UHD 4K HDR Smart TV,https://www.amazon.co.uk/dp/B0BW9T5ZTL,65.0,,,,,Amazon,GB,2026-07-09T06:12:00Z,B0BW9T5ZTL,,,,,
Samsung,"Smart TV Samsung UE65NU7105 65"" Ultra HD 4K HDR10+ WIFI Negro",https://www.amazon.co.uk/dp/B07C12Z7CX,65.0,2743.88,2359.0,GBP,2743.88,Amazon,GB,2026-07-09T06:12:00Z,B07C12Z7CX,,,,,2026-07-01
Samsung,"Samsung The Terrace 65 inch TV 4K Smart TV, Quantum Matrix Technology Slim Outdoor TV, Anti-Glare Screen, Water and Dust R...",https://www.amazon.co.uk/dp/B0F2FJX2XH,65.0,5762.96,4954.59,GBP,5762.96,Amazon,GB,2026-07-09T06:12:00Z,B0F2FJX2XH,,,,,2026-07-01
Samsung,"SAMSUNG 65 inch OLED S85F 4K Smart TV with AI Vision, Pantone TV Plus Certified Colors",https://www.amazon.co.uk/dp/B0F2FNVQ73,65.0,1923.73,1653.89,GBP,1923.73,Amazon,GB,2026-07-09T06:12:00Z,B0F2FNVQ73,,,,,2026-07-01
Samsung,Samsung TV 65 Inch (2025) Neo QLED 4K UHD - TQ65QN90FATXXC [Spanish version],https://www.amazon.co.uk/dp/B0F222XVF4,65.0,1961.34,1686.22,GBP,1961.34,Amazon,GB,2026-07-09T06:12:00Z,B0F222XVF4,,,,,2026-07-01
Samsung,Samsung QE55Q60T 138cm 4K QLED TV,https://www.amazon.co.uk/dp/B087YTKGHQ,49.0,1743.57,1499.0,GBP,1743.57,Amazon,GB,2026-07-09T06:12:00Z,B087YTKGHQ,,,,,2026-07-01
Samsung,"Samsung TV QN80F (2025) 100"" Neo QLED 4K UHD 100Hz [Country Version French, Spanish, Portuguese]...[Country Version French, Spanish, Portuguese]",https://www.amazon.co.uk/dp/B0F22834RH,100.0,4754.39,4087.49,GBP,4754.39,Amazon,GB,2026-07-09T06:12:00Z,B0F22834RH,,,,,2026-07-01
Samsung,"Samsung QN88D 55"" Neo QLED 4K, Quantum Matrix Technology, Dolby Atmos, NQ4 AI Gen2 Processor, Neo Quantum HDR, Motion Xcelerator 120Hz, QE55QN88DBTXXU, English Model (2024)",https://www.amazon.co.uk/dp/B0CYBTHTX2,55.0,929.36,799.0,GBP,929.36,Amazon,GB,2026-07-09T06:12:00Z,B0CYBTHTX2,,,,,2026-07-01
Samsung,"Samsung 50 Inch Neo QLED QN90F 4K Mini LED Smart TV with AI Vision, Glare Free Screen and Quantum Matrix Technology Plus",https://www.amazon.co.uk/dp/B0F2241BR4,50.0,1564.56,1345.1,GBP,1564.56,Amazon,GB,2026-07-09T06:12:00Z,B0F2241BR4,,,,,2026-07-01
Samsung,"Samsung Neo QLED 8K 2024 65QN800D 65"" Smart TV with 8K Resolution, More Speakers Than Ever With Dolby Atmos and Q-Symphony, the Best Smart TV and No Cables with Slim One Connect",https://www.amazon.co.uk/dp/B0CSDKRHRN,65.0,3300.56,2837.59,GBP,3300.56,Amazon,GB,2026-07-09T06:12:00Z,B0CSDKRHRN,,,,,2026-07-01
Samsung,"Samsung TV QLED 65"" Q60D 2024, 4K, Smart TV",https://www.amazon.co.uk/dp/B0CS6Z8RTB,65.0,,,,,Amazon,GB,2026-07-09T06:12:00Z,B0CS6Z8RTB,,,,,
Samsung,SAMSUNG QN43LS03DAFXZA 43 Inch The Frame 4K Smart Quantum HDR TV with 6 Year Amber Protection Plan (2024),https://www.amazon.co.uk/dp/B0D7P2GPD6,43.0,696.73,599.0,GBP,696.73,Amazon,GB,2026-07-09T06:12:00Z,B0D7P2GPD6,,,,,2026-07-01
Samsung,"Samsung The Serif Green 55-inch QLED TQ55LS01DB TV, Certified Non-Reflective Screen, 360° Design TV, Ambient Mode+, Smart TV, OTS Lite Technologies, Detachable Legs Included",https://www.amazon.co.uk/dp/B0FMQRHVMT,55.0,1490.0,1281.0,GBP,1490.0,Amazon,GB,2026-07-09T06:12:00Z,B0FMQRHVMT,,,,,2026-07-01
Samsung,Samsung S95d 65´´ 4k Oled Tv Europe PAL,https://www.amazon.co.uk/dp/B0CSDJJTCS,65.0,3300.56,2837.59,GBP,3300.56,Amazon,GB,2026-07-09T06:12:00Z,B0CSDJJTCS,,,,,2026-07-01
