brand_raw,raw_text,url,size_hint_inch,price_hint_eur,price_local,currency,price_eur,platform,country,scraped_at,asin,elkjop_sku,model_year,filter_year,source_brand,fx_rate_date
TCL,"TCL 55T6C 55"" QLED TV 4K HDR, FireTV (SmartTV con Dolby Vision e Atmos, HDR10+, Premi e Chiedi ad Alexa)",https://www.amazon.it/dp/B0FC61MRTV,55.0,,,,,Amazon,IT,2026-07-23T06:46:44Z,B0FC61MRTV,,,,,
TCL,"TCL 85Q6C 85"" QD-Mini LED TV, 4K HDR Premium 1000nits, Google TV (Dolby Vision IQ e Atmos, sistema audio Onkyo 2.1, Motion...",https://www.amazon.it/dp/B0FQNVF8DP,85.0,,,,,Amazon,IT,2026-07-23T06:46:44Z,B0FQNVF8DP,,,,,
TCL,"TCL 85T6C 85"" QLED TV 4K HDR, Fire TV (Dolby Vision e Atmos, HDR10+, Premi e Chiedi ad Alexa)",https://www.amazon.it/dp/B0FC5P7QFK,85.0,,,,,Amazon,IT,2026-07-23T06:46:44Z,B0FC5P7QFK,,,,,
TCL,"Bundle of TCL 98Q7C 98” QLED TV 4K QD-Mini LED, HDR Premium 2000, Google TV + TCL Sound Bar S55H Nero 40W",https://www.amazon.it/dp/B0FC5DXGS7,98.0,,,,,Amazon,IT,2026-07-23T06:46:44Z,B0FC5DXGS7,,,,,
TCL,"TCL 98Q6C 98"" QD-Mini LED SMART TV, 4K HDR Premium 1000nits, con tecnologia Google TV (Dolby Vision IQ e Atmos, sistema au...",https://www.amazon.it/dp/B0FQNV7V5W,98.0,,,,,Amazon,IT,2026-07-23T06:46:44Z,B0FQNV7V5W,,,,,
LG,"Cello Smart TV 32 pollici: TV LED senza cornice e intuitiva – Con LG WebOS, Netflix integrato, Apple+, Bluetooth, Prime Vi...",https://www.amazon.it/dp/B0CF9VT914,32.0,188.52,188.52,EUR,188.52,Amazon,IT,2026-07-23T06:46:44Z,B0CF9VT914,,,,,
TCL,"TCL 55T69C 55” QLED 60HZ 4K HDR, Google TV, Smart TV (Dolby Vision & Atmos, Motion clarity, compatibile con Google Assista...",https://www.amazon.it/dp/B0F8QFPB14,55.0,,,,,Amazon,IT,2026-07-23T06:46:44Z,B0F8QFPB14,,,,,
TCL,"TCL 32S5L - Tv 32 Pollici Smart Tv Full HD DVB-T2 H.264, H.265 Nero Classe Energetica F",https://www.amazon.it/dp/B0H2JF9P45,32.0,,,,,Amazon,IT,2026-07-23T06:46:44Z,B0H2JF9P45,,,,,
TCL,"TCL 75C7L - Smart Tv 75 Pollici 4K LED DVB-T2 H.264, H.265 Wifi Nero Classe Energetica E",https://www.amazon.it/dp/B0GVSSJFDT,75.0,,,,,Amazon,IT,2026-07-23T06:46:44Z,B0GVSSJFDT,,,,,
TCL,"TCL 50CF630, 50"" (126 cm) Fire TV QLED (4K Ultra HD, HDR 10+, Dolby Vision & Atmos, Smart TV, Game Master, Motion Clarity ...",https://www.amazon.it/dp/B0BBGW3RJV,50.0,,,,,Amazon,IT,2026-07-23T06:46:44Z,B0BBGW3RJV,,,,,
TCL,For Toshiba 32 Pollici TV 32L2306C L32F3305B L32F3302B L32F3320-3D TV LCD Retroilluminazione for TCL TOT 32B2500-3X7 006-P...,https://www.amazon.it/dp/B0BYSRRQNT,32.0,32.72,32.72,EUR,32.72,Amazon,IT,2026-07-23T06:46:44Z,B0BYSRRQNT,,,,,
TCL,BAVALU for Toshiba 32 Pollici TV 32L2306C L32F3305B L32F3302B L32F3320-3D TV LCD Retroilluminazione TCL Tot 32B2500-3X7 00...,https://www.amazon.it/dp/B0BNNQ6TYT,32.0,29.41,29.41,EUR,29.41,Amazon,IT,2026-07-23T06:46:44Z,B0BNNQ6TYT,,,,,
TCL,"HYRAM 6 V. PORTATO Retroilluminazione Strip 5 Lampada for TCL 32S5300 32S6500 32S6400 Mi 32 ""TV LCD L32M5-AZ TCL32D05-ZC22...",https://www.amazon.it/dp/B0CJ6XLTTW,32.0,,,,,Amazon,IT,2026-07-23T06:46:44Z,B0CJ6XLTTW,,,,,
TCL,BAVALU Striscia di retroilluminazione TV LCD da 65 Pollici JL.D65081330-365AS-M-V03 for TCL 65A730U D65A620U 65UD6326 65p6...,https://www.amazon.it/dp/B0BR5PV7N2,65.0,38.24,38.24,EUR,38.24,Amazon,IT,2026-07-23T06:46:44Z,B0BR5PV7N2,,,,,
TCL,"TUCANSBP Striscia di retroilluminazione a LED 8 Lampada Compatibile for TCL 65 ""TV for JL.D65081330-365AS-M_V03 65U5850C D...",https://www.amazon.it/dp/B0D1QC3XHK,65.0,,,,,Amazon,IT,2026-07-23T06:46:44Z,B0D1QC3XHK,,,,,
TCL,BAVALU Striscia di retroilluminazione a LED for TCL 32'' TV 32F6B TCL32D05-ZC22AG-11 12 16 5S1P 4C-LB320T-ZC3 TC320M04 L32...,https://www.amazon.it/dp/B0C2DC8K9G,32.0,26.61,26.61,EUR,26.61,Amazon,IT,2026-07-23T06:46:44Z,B0C2DC8K9G,,,,,
TCL,"TUCANSBP Striscia di retroilluminazione a LED 8 Lampada Compatibile for TCL 65 ""TV for JL.D65081330-365AS-M_V03 65U5850C D...",https://www.amazon.it/dp/B0D1QCYKGB,65.0,,,,,Amazon,IT,2026-07-23T06:46:44Z,B0D1QCYKGB,,,,,
TCL,"PureBowlic Base per TV TCL da 28-65 pollici, facile da installare, piedini di ricambio per kit di viti, staffa di montaggi...",https://www.amazon.it/dp/B0H6NFZPNW,65.0,,,,,Amazon,IT,2026-07-23T06:46:44Z,B0H6NFZPNW,,,,,
Hisense,"Hisense Smart TV 32"" HD Ready 32E4ST, 60Hz, DTS Virtual X, VIDAA OS con 1000+ APP, Game Mode, Wifi, AirPlay2, Works with A...",https://www.amazon.it/dp/B0GM1HFTNL,32.0,130.33,130.33,EUR,130.33,Amazon,IT,2026-07-23T06:46:44Z,B0GM1HFTNL,,,,,
Hisense,"Hisense Smart TV QLED 32"" Full HD Dèco TV 32S5Q, 60Hz, Audio Dolby Atmos, HDR10, VIDAA OS con 1000+ APP, Wifi, Game Mode, ...",https://www.amazon.it/dp/B0FSLMYL4W,32.0,149.18,149.18,EUR,149.18,Amazon,IT,2026-07-23T06:46:44Z,B0FSLMYL4W,,,,,
Hisense,"Hisense TV 32"" QLED Full HD 2025 32E53QT, Smart TV VIDAA U8, HDR10, Airplay2, Game Mode, Dolby Atmos, Works with Alexa, Tu...",https://www.amazon.it/dp/B0F1VV9V34,32.0,163.11,163.11,EUR,163.11,Amazon,IT,2026-07-23T06:46:44Z,B0F1VV9V34,,,,,
Hisense,"Hisense TV 32"" HD Ready 2025 32E43QT, Smart TV VIDAA U8, Airplay2, Game Mode, Works with Alexa, Tuner DVB-T2/S2 HEVC 10, l...",https://www.amazon.it/dp/B0F1WMZSQ6,32.0,122.13,122.13,EUR,122.13,Amazon,IT,2026-07-23T06:46:44Z,B0F1WMZSQ6,,,,,
Hisense,"Hisense Smart TV QLED 32"" FHD 32E5ST, 60Hz, Audio Dolby Atmos, VIDAA OS con 1000+ APP, HDR10, Game Mode, Works with Alexa,...",https://www.amazon.it/dp/B0GM1T3HF5,32.0,174.85,174.85,EUR,174.85,Amazon,IT,2026-07-23T06:46:44Z,B0GM1T3HF5,,,,,
Hisense,"Hisense Smart TV MiniLED 144Hz 55"" 4K TV 55U79SE, Dolby Atmos 2.1 By Devialet, Dolby Vision IQ, HDR10+, Native 144Hz Game ...",https://www.amazon.it/dp/B0GM1RLZ5R,55.0,,,,,Amazon,IT,2026-07-23T06:46:44Z,B0GM1RLZ5R,,,,,
Hisense,"Hisense 43"" QLED UHD 43E78HQ, Smart TV VIDAA 5.0, HDR Dolby Vision, VA, Controlli vocali Alexa, Tuner DVB-T2/S2 HEVC 10, l...",https://www.amazon.it/dp/B0B12RV1RK,43.0,,,,,Amazon,IT,2026-07-23T06:46:44Z,B0B12RV1RK,,,,,
Hisense,"Hisense 43A69K - TV Smart 43 Pollici, 4K, DVB-T2, H.265, Nero",https://www.amazon.it/dp/B0CHBCWQZ6,43.0,499.0,499.0,EUR,499.0,Amazon,IT,2026-07-23T06:46:44Z,B0CHBCWQZ6,,,,,
Hisense,"Hisense 43A79KQ 43"" QLED UltraHD 4K HDR10+",https://www.amazon.it/dp/B0CJG3128Z,43.0,,,,,Amazon,IT,2026-07-23T06:46:44Z,B0CJG3128Z,,,,,
Xiaomi,"XIAOMI TV F 55, 55 pollici (140 cm), 4K UHD, Smart TV, Fire TV, HDR10, MEMC, 60Hz con modalità Game Boost a 120 Hz, contro...",https://www.amazon.it/dp/B0FCY8TGFF,55.0,520.54,520.54,EUR,520.54,Amazon,IT,2026-07-23T06:46:44Z,B0FCY8TGFF,,,,,
Hisense,"Hisense TV 75"" QLED 4K 144Hz 2025 75E7Q PRO, Smart TV VIDAA U8, Dolby Vision IQ, HDR 10+ Adaptive, 144hz Game Mode PRO, Do...",https://www.amazon.it/dp/B0F1N63F97,75.0,,,,,Amazon,IT,2026-07-23T06:46:44Z,B0F1N63F97,,,,,
Hisense,"Hisense 43A79Q - TV 43 Pollici, Smart TV, QLED 4K, HEVC, DVB-T2, Classe energetica E",https://www.amazon.it/dp/B0FJMSFYQY,43.0,424.52,424.52,EUR,424.52,Amazon,IT,2026-07-23T06:46:44Z,B0FJMSFYQY,,,,,
Hisense,"Hisense 43E79NQ - Smart TV 43 Pollici (108 cm), QLED, 4K, DVB-T2 HEVC",https://www.amazon.it/dp/B0DJT3L51S,43.0,,,,,Amazon,IT,2026-07-23T06:46:44Z,B0DJT3L51S,,,,,
Hisense,"Hisense 55A86Q55 - TV 55 Pollici, Smart TV, DVB-T2, HEVC, 4K, ULED, Nero, Classe energetica G",https://www.amazon.it/dp/B0G1ZDM9JQ,55.0,,,,,Amazon,IT,2026-07-23T06:46:44Z,B0G1ZDM9JQ,,,,,
Samsung,"KELUNIS HD Clear Anti Luce Blu 32-75 Pollici Proteggi Schermo TV per Sharp Sony Samsung Hisense LG,52"" (1161 * 661)",https://www.amazon.it/dp/B09M6RL7S3,75.0,109.11,109.11,EUR,109.11,Amazon,IT,2026-07-23T06:46:44Z,B09M6RL7S3,,,,,
Samsung,"KELUNIS HD Clear Anti Luce Blu 32-75 Pollici Proteggi Schermo TV per Sharp Sony Samsung Hisense LG,48"" (1056 * 596)",https://www.amazon.it/dp/B09M6RZ9Z5,75.0,95.11,95.11,EUR,95.11,Amazon,IT,2026-07-23T06:46:44Z,B09M6RZ9Z5,,,,,
Sony,"Sony BRAVIA KD-32W800 - Smart TV 32 pollici, HD Ready LED, HDR, Android TV, KD32W800PAEP [Classe di efficienza energetica F]",https://www.amazon.it/dp/B0BNW6941F,32.0,216.39,216.39,EUR,216.39,Amazon,IT,2026-07-23T06:46:44Z,B0BNW6941F,,,,,
Panasonic,"Panasonic TB-32S40AEZC, Serie S40 32 pollici Smart TV LED HD, TiVo, Controllo Vocale Google e Alexa, Game Mode, Media Play...",https://www.amazon.it/dp/B0H2MPMR8R,32.0,146.72,146.72,EUR,146.72,Amazon,IT,2026-07-23T06:46:44Z,B0H2MPMR8R,,,,,
Sony,"Sony BRAVIA 8 OLED 55 Pollici 4K HDR, Google Smart TV (2024) BRAVIA Theatre Bar 8",https://www.amazon.it/dp/B0D428GVB1,55.0,,,,,Amazon,IT,2026-07-23T06:46:44Z,B0D428GVB1,,,,,
Sony,"Sony BRAVIA 8 OLED 55 Pollici 4K HDR, Google Smart TV (2024) BRAVIA Theatre Bar 9",https://www.amazon.it/dp/B0D426XDYC,55.0,,,,,Amazon,IT,2026-07-23T06:46:44Z,B0D426XDYC,,,,,
Sony,"Sony BRAVIA XR BRAVIA K-55XR8A 139,7 cm (55"") 4K Ultra HD Smart TV Wi-Fi Nero",https://www.amazon.it/dp/B0H3WJG8M1,55.0,,,,,Amazon,IT,2026-07-23T06:46:44Z,B0H3WJG8M1,,,,,
Sony,"Sony FW-65EZ20L affichage de messages Écran plat de signalisation numérique 165,1 cm (65"") LED Wifi 350 cd/m² 4K",https://www.amazon.it/dp/B0CW6CK9B6,65.0,,,,,Amazon,IT,2026-07-23T06:46:44Z,B0CW6CK9B6,,,,,
Sony,Sony XR-75X95K – 75 Pollici- BRAVIA XR - Mini LED – 4K Ultra HD – High Dynamic Range (HDR) – Smart TV (Google TV) – Black ...,https://www.amazon.it/dp/B09ZPV3HLD,75.0,,,,,Amazon,IT,2026-07-23T06:46:44Z,B09ZPV3HLD,,,,,
Sony,"SONY FW-50EZ20L affichage de messages Panneau plat de signalisation numérique 127 cm (50"") LED Wifi 350 cd/m² 4K",https://www.amazon.it/dp/B0CXL3XFHN,50.0,,,,,Amazon,IT,2026-07-23T06:46:44Z,B0CXL3XFHN,,,,,
Sony,Sony Su-Wl450 -Staffa Per Il Montaggio a Parete Tv Sony da 32 a 85 Pollici,https://www.amazon.it/dp/B00IZEIZB4,85.0,40.98,40.98,EUR,40.98,Amazon,IT,2026-07-23T06:46:44Z,B00IZEIZB4,,,,,
Sony,"SONY FW-75BZ40L affichage de messages Panneau plat de signalisation numérique 190,5 cm (75"") LCD Wifi 700 cd/m² 4K Ult",https://www.amazon.it/dp/B0C9YPPB7J,75.0,,,,,Amazon,IT,2026-07-23T06:46:44Z,B0C9YPPB7J,,,,,
Sony,"SONY FW-75BZ35L affichage de messages Panneau plat de signalisation numérique 190,5 cm (75"") LCD Wifi 550 cd/m² 4K Ult",https://www.amazon.it/dp/B0C9YP1N7N,75.0,,,,,Amazon,IT,2026-07-23T06:46:44Z,B0C9YP1N7N,,,,,
Sony,"SONY FW-75BZ30L affichage de messages Panneau plat de signalisation numérique 190,5 cm (75"") LCD Wifi 440 cd/m² 4K Ult",https://www.amazon.it/dp/B0C9YPHGXV,75.0,,,,,Amazon,IT,2026-07-23T06:46:44Z,B0C9YPHGXV,,,,,
Sony,"SONY FW-65BZ30L affichage de messages Panneau plat de signalisation numérique 165,1 cm (65"") LCD Wifi 440 cd/m² 4K Ult",https://www.amazon.it/dp/B0C9YQDK3B,65.0,,,,,Amazon,IT,2026-07-23T06:46:44Z,B0C9YQDK3B,,,,,
Sony,"SONY FW-55BZ30L affichage de messages Panneau plat de signalisation numérique 139,7 cm (55"") LCD Wifi 440 cd/m² 4K Ult",https://www.amazon.it/dp/B0C9YPDMQC,55.0,,,,,Amazon,IT,2026-07-23T06:46:44Z,B0C9YPDMQC,,,,,
Sony,"SONY FW-55BZ35L affichage de messages Panneau plat de signalisation numérique 139,7 cm (55"") LCD Wifi 550 cd/m² 4K Ult",https://www.amazon.it/dp/B0C9YP4XD8,55.0,,,,,Amazon,IT,2026-07-23T06:46:44Z,B0C9YP4XD8,,,,,
Sony,"SONY FW-85BZ30L affichage de messages Panneau plat de signalisation numérique 2,16 m (85"") LCD Wifi 440 cd/m² 4K Ultra",https://www.amazon.it/dp/B0CD2MRG4S,85.0,,,,,Amazon,IT,2026-07-23T06:46:44Z,B0CD2MRG4S,,,,,
Sony,BAVALU Retroilluminazione TV LED for SONY 40 pollici KLV-40R470A KLV-40R450A KDL-40R473A SVG400A81 REV3 121114 S400H1LCD-1...,https://www.amazon.it/dp/B0C3996TZS,40.0,29.54,29.54,EUR,29.54,Amazon,IT,2026-07-23T06:46:44Z,B0C3996TZS,,,,,
Sony,"Scheda logica T650HVN12.3 CTRL BD 65T37-C04 TV 65 pollici, compatibile con Sony, KDL-65W850C Prodotto Scheda T-con Scheda ...",https://www.amazon.it/dp/B0FMKKS1NC,65.0,,,,,Amazon,IT,2026-07-23T06:46:44Z,B0FMKKS1NC,,,,,
Sony,"Scheda T-CON, compatibile con Sony, scheda logica TV KD-75X7800F da 75 pollici 18Y-S75HU11A2H2A6AV0.2(LMY750)",https://www.amazon.it/dp/B0FMKLWCFX,75.0,,,,,Amazon,IT,2026-07-23T06:46:44Z,B0FMKLWCFX,,,,,
Sony,"Scheda logica T420HVN06.2 42T34-C00, compatibile con SONY, scheda di riparazione TV 42'' KDL-42W700B KDL-42W705B",https://www.amazon.it/dp/B0FMKMRLV5,42.0,,,,,Amazon,IT,2026-07-23T06:46:44Z,B0FMKMRLV5,,,,,
Sony,BAVALU 10 Pezzi/Lotto for Sony Utilizzare 40 Pollici TV RETROILLUMINAZIONE for LED Bar SUG400A81_REV3_121114 for Sony KDL-...,https://www.amazon.it/dp/B0BRNKVGNN,40.0,202.67,202.67,EUR,202.67,Amazon,IT,2026-07-23T06:46:44Z,B0BRNKVGNN,,,,,
Sony,"Scheda T-con 6870C-0738A, compatibile con Sony, TV 43'' 49'' 55'' Scheda logica V17_43UHD_TM120_1.0 Accessori(49 inch with...",https://www.amazon.it/dp/B0FMPC86QG,43.0,,,,,Amazon,IT,2026-07-23T06:46:44Z,B0FMPC86QG,,,,,
Sony,"Scheda T-CON, compatibile con Sony, scheda logica TV KD-75X7800F da 75 pollici 18Y-S75HU11A2H2A6AV0.2(LMC750)",https://www.amazon.it/dp/B0FMKLV3ZV,75.0,,,,,Amazon,IT,2026-07-23T06:46:44Z,B0FMKLV3ZV,,,,,
Sony,"Scheda T-con 6870C-0738A, compatibile con Sony, TV 43'' 49'' 55'' Scheda logica V17_43UHD_TM120_1.0 Accessori(43 inch with...",https://www.amazon.it/dp/B0FMPBR1TF,43.0,,,,,Amazon,IT,2026-07-23T06:46:44Z,B0FMPBR1TF,,,,,
Sony,BAVALU Retroilluminazione a LED for Sony TV da 55 Pollici KD-55X8507C YLS_HRN55_7020_REV2 YLS_HAN55_7020_REV2 15521N SYV55...,https://www.amazon.it/dp/B0BTTGP3FY,55.0,35.15,35.15,EUR,35.15,Amazon,IT,2026-07-23T06:46:44Z,B0BTTGP3FY,,,,,
Sony,BAVALU 10 Pezzi/Lotto for Sony Utilizzare 40 Pollici TV RETROILLUMINAZIONE for LED Bar SUG400A81_REV3_121114 for Sony KDL-...,https://www.amazon.it/dp/B0BRNMFBCJ,40.0,111.03,111.03,EUR,111.03,Amazon,IT,2026-07-23T06:46:44Z,B0BRNMFBCJ,,,,,
Sony,"6870C-0738A, compatibile con Sony, scheda T-con 6870C 0738A for TV da 43'', 49'' e 55'', scheda logica V17_43UHD_TM120_1....",https://www.amazon.it/dp/B0FGJQB5B5,43.0,,,,,Amazon,IT,2026-07-23T06:46:44Z,B0FGJQB5B5,,,,,
Sony,BAVALU 10 Pezzi/Lotto for Sony Utilizzare 40 Pollici TV RETROILLUMINAZIONE for LED Bar SUG400A81_REV3_121114 for Sony KDL-...,https://www.amazon.it/dp/B0BRNLH8YQ,40.0,73.14,73.14,EUR,73.14,Amazon,IT,2026-07-23T06:46:44Z,B0BRNLH8YQ,,,,,
Sony,BAVALU Striscia di retroilluminazione a LED for TV Sony da 49 Pollici KD-49XD7005 LC490EQY-SJA3 KD-49XD7005 KD-49XD7066 JD...,https://www.amazon.it/dp/B0BRJP8C3N,49.0,52.47,52.47,EUR,52.47,Amazon,IT,2026-07-23T06:46:44Z,B0BRJP8C3N,,,,,
Sony,BAVALU Retroilluminazione a LED 10pcs 5leds for Sony 40'' 2013SONY40A 2013SONY40B 3228 05 REV1.0 KDL-40R455 KDL-40W600B KD...,https://www.amazon.it/dp/B0C4HMSBQK,40.0,31.97,31.97,EUR,31.97,Amazon,IT,2026-07-23T06:46:44Z,B0C4HMSBQK,,,,,
Sony,BAVALU 10 Pezzi/Lotto for Sony Utilizzare 40 Pollici TV RETROILLUMINAZIONE for LED Bar SUG400A81_REV3_121114 for Sony KDL-...,https://www.amazon.it/dp/B0BRNLZKQP,40.0,55.59,55.59,EUR,55.59,Amazon,IT,2026-07-23T06:46:44Z,B0BRNLZKQP,,,,,
Sony,BAVALU 10 Pezzi/Lotto for Sony Utilizzare 40 Pollici TV RETROILLUMINAZIONE for LED Bar SUG400A81_REV3_121114 for Sony KDL-...,https://www.amazon.it/dp/B0BRNMTBQC,40.0,36.5,36.5,EUR,36.5,Amazon,IT,2026-07-23T06:46:44Z,B0BRNMTBQC,,,,,
Sony,BAVALU 10 pezzi/lotto for SONY Utilizzare 40 Pollici TV RETROILLUMINAZIONE for LED BAR SUG400A81_REV3_121114 for SONY KDL-...,https://www.amazon.it/dp/B0BY9DPRP2,40.0,28.5,28.5,EUR,28.5,Amazon,IT,2026-07-23T06:46:44Z,B0BY9DPRP2,,,,,
Samsung,"KELUNIS HD Clear Anti Luce Blu 32-75 Pollici Proteggi Schermo TV per Sharp Sony Samsung Hisense LG,49"" (1075 * 604)",https://www.amazon.it/dp/B09M6R19R9,75.0,97.11,97.11,EUR,97.11,Amazon,IT,2026-07-23T06:46:44Z,B09M6R19R9,,,,,
Samsung,"Samsung UE55RU7172 TV 55"" 4K UHD Smart TV BLUETOOT LAN DLNA DVT2 DVBS2 HDR10+",https://www.amazon.it/dp/B07S8WVHQC,55.0,,,,,Amazon,IT,2026-07-23T06:46:44Z,B07S8WVHQC,,,,,
Samsung,"Samsung Business TV Serie 'BEFX-H da 55"", UHD 3840x2160 con Funzionalità HDR10+, Tizen, HDMI, USB, Bluetooth, WiFi, Access...",https://www.amazon.it/dp/B0G593S8Y2,55.0,,,,,Amazon,IT,2026-07-23T06:46:44Z,B0G593S8Y2,,,,,
LG,"LG OLED evo AI 83 Pollici, Serie C5 2025 Smart TV 4K - OLED83C54LA",https://www.amazon.it/dp/B0F44FFV4W,83.0,,,,,Amazon,IT,2026-07-23T06:46:44Z,B0F44FFV4W,,,,,
LG,"LG UHD 50'', Serie UT73 2024, Smart TV 4K, 50UT73006LA, Processore α5 Gen7, 20W, 3 HDMI, HDR10 Pro, Filmmaker Mode, Game O...",https://www.amazon.it/dp/B00HEB2GZA,50.0,,,,,Amazon,IT,2026-07-23T06:46:44Z,B00HEB2GZA,,,,,
LG,LG Electronics 32LM630BPLA Smart TV LED da 32 pollici HD Ready con Freeview Play - Colore nero ceramico modello 2019,https://www.amazon.it/dp/B07PRM2L3Q,32.0,,,,,Amazon,IT,2026-07-23T06:46:44Z,B07PRM2L3Q,,,,,
LG,"TV LED 49"" LG 4K 49UJ620V SMART TV UHD Nero",https://www.amazon.it/dp/B0761V3WCG,49.0,,,,,Amazon,IT,2026-07-23T06:46:44Z,B0761V3WCG,,,,,
LG,"LG 32LK510BPLD HD Black LED TV - LED TVs (80 cm / 32""), 1366 x 768 pixels, HD, LED, DVB-C,DVB-S2,DVB-T2, Nero",https://www.amazon.it/dp/B07CKWJJRY,32.0,,,,,Amazon,IT,2026-07-23T06:46:44Z,B07CKWJJRY,,,,,
LG,LG 24TN510S-PZ.API 24'',https://www.amazon.it/dp/B08H5DVJ32,24.0,,,,,Amazon,IT,2026-07-23T06:46:44Z,B08H5DVJ32,,,,,
Toshiba,"Toshiba Smart TV 24"" HD Ready 24WK3C63DA, TV 24 Pollici con Alexa Integrata, Compatibile con Alexa e Google Assistant, Dig...",https://www.amazon.it/dp/B08RDX2Z12,24.0,,,,,Amazon,IT,2026-07-23T06:46:44Z,B08RDX2Z12,,,,,
Xiaomi,"XIAOMI TV A Pro 32, 32 pollici (81 cm), QLED, Smart TV, Google TV, Triple Tuner DVB-C/S/S2/T/T2,Dolby Audio, DTS Virtual:...",https://www.amazon.it/dp/B0FSRZPYZV,32.0,122.13,122.13,EUR,122.13,Amazon,IT,2026-07-23T06:46:44Z,B0FSRZPYZV,,,,,
Philips,"PHILIPS Ambilight TV 32PQS6901/12 32 Inch FHD QLED Smart TV | Pixel Precise Ultra HD, Titan OS, Dolby Audio",https://www.amazon.it/dp/B0H347QPS6,32.0,245.08,245.08,EUR,245.08,Amazon,IT,2026-07-23T06:46:44Z,B0H347QPS6,,,,,
LG,LG 50QNED70B6C - Smart Tv 50 Pollici 4K QNED DVB-T2 HEVC/H.265 Wifi Nero Classe Energetica F,https://www.amazon.it/dp/B0H36SHKPF,50.0,,,,,Amazon,IT,2026-07-23T06:46:44Z,B0H36SHKPF,,,,,
LG,"LG 32LM6370PLA Smart TV 32"" Full HD, TV LED Serie LM63 con Dolby Audio, Dolby Digital, Processore Quad Core, Wi-Fi, Audio ...",https://www.amazon.it/dp/B08Z4BD8X9,32.0,,,,,Amazon,IT,2026-07-23T06:46:44Z,B08Z4BD8X9,,,,,
LG,"LG UHD 75'', Serie UR75, Smart TV 4K, 75UR75006LK, Processore α5 Gen6, HDR10 Pro, Filmmaker Mode, Game Optimizer, Wi-Fi, w...",https://www.amazon.it/dp/B0DGXSYPJV,75.0,,,,,Amazon,IT,2026-07-23T06:46:44Z,B0DGXSYPJV,,,,,
LG,"LG UHD 50UR78006LK 127 cm (50"") 4K Ultra HD Smart TV Wi-Fi Nero",https://www.amazon.it/dp/B0BWWJV2K1,50.0,,,,,Amazon,IT,2026-07-23T06:46:44Z,B0BWWJV2K1,,,,,
Samsung,Samsung QE48S95HAE - Smart TV 48 Pollici 4K 3840 x 2160 Pixel OLED DVB-T2 Wifi Nero Classe Energetica F,https://www.amazon.it/dp/B0H4LS36XM,48.0,,,,,Amazon,IT,2026-07-23T06:46:44Z,B0H4LS36XM,,,,,
LG,"LG OLED evo AI 42 Pollici, Serie C6 2026 Smart TV 4K - OLED42C64LA",https://www.amazon.it/dp/B0GWMY3R9W,42.0,,,,,Amazon,IT,2026-07-23T06:46:44Z,B0GWMY3R9W,,,,,
TCL,"TCL 55C8L 55” SQD-Mini LED TV, 4K HDR 3000 nits and 1,008 dimming zones, Google TV, Dolby Vision & Atmos, Audio by Bang & Olufsen, 144Hz, Apple AirPlay 2 & Alexa",https://www.amazon.it/dp/B0GTZS35X6,55.0,,,,,Amazon,IT,2026-07-23T06:46:44Z,B0GTZS35X6,,,,,
Hisense,"Hisense Smart TV MiniLED 144Hz 50"" 4K 50E8S, Dolby Atmos 2.1 By Devialet, Dolby Vision IQ, HDR10+, Native 144Hz Game Mode, VIDAA OS con 1000+ APP, Alexa built-in, lativù 4K, Wifi, Bluetooth",https://www.amazon.it/dp/B0GQDSSGNB,50.0,,,,,Amazon,IT,2026-07-23T06:46:44Z,B0GQDSSGNB,,,,,
Sony,Sony BRAVIA 5 - XR|Mini LED| Processore AI XR | Acoustic Multi-Audio | Dolby Vision/Atmos | IMAX Enhanced | Google TV (2025)|Google Cast | Apple AirPlay 2| Eco Dashboard 2 |Menu di gioco 2-55pollici,https://www.amazon.it/dp/B0F4KYR4RT,55.0,,,,,Amazon,IT,2026-07-23T06:46:44Z,B0F4KYR4RT,,,,,
Samsung,"Samsung Smart TV 48"" QE48S95HATXZT OLED 4K Glare Free, HDR 10+, Motion Xcelerator 165Hz, Dolby Atmos, FreeSync Premium Pro, Voice Control with AI(VAC), Alexa Built-in, PACCHETTO INTRATTENIMENTO, 2026",https://www.amazon.it/dp/B0GWN5HTR3,48.0,,,,,Amazon,IT,2026-07-23T06:46:44Z,B0GWN5HTR3,,,,,
LG,"LG OLED evo AI 48 Pollici, Serie C6 2026 Smart TV 4K - OLED48C64LA",https://www.amazon.it/dp/B0GWNBTJVT,48.0,,,,,Amazon,IT,2026-07-23T06:46:44Z,B0GWNBTJVT,,,,,
TCL,"TCL 65C8L 65” SQD-Mini LED TV, 4K HDR 5000 nits and 2,040 dimming zones, Google TV, Dolby Vision & Atmos, Audio by Bang & Olufsen, 144Hz, Apple AirPlay 2 & Alexa",https://www.amazon.it/dp/B0GTZLF677,65.0,,,,,Amazon,IT,2026-07-23T06:46:44Z,B0GTZLF677,,,,,
Hisense,"Hisense Smart TV MiniLED 144Hz 55"" 4K 55E8S, Dolby Atmos 2.1 By Devialet, Dolby Vision IQ, HDR10+, Native 144Hz Game Mode, VIDAA OS con 1000+ APP, Alexa built-in, lativù 4K, Wifi, Bluetooth",https://www.amazon.it/dp/B0GQDXNH3L,55.0,,,,,Amazon,IT,2026-07-23T06:46:44Z,B0GQDXNH3L,,,,,
Sony,Sony BRAVIA 5 XR Mini LED 65 Pollici | Processore AI XR | Acoustic Multi-Audio | Dolby Vision/Atmos | IMAX Enhanced | Google TV | Google Cast | Apple AirPlay 2| Eco Dashboard 2 | 65XR52,https://www.amazon.it/dp/B0F4L1887W,65.0,,,,,Amazon,IT,2026-07-23T06:46:44Z,B0F4L1887W,,,,,
Samsung,"Samsung Smart TV 55"" QE55S95HATXZT OLED 4K Glare Free, HDR 10+, Motion Xcelerator 165Hz, Dolby Atmos, FreeSync Premium Pro, Voice Control with AI(VAC), Alexa Built-in, PACCHETTO INTRATTENIMENTO, 2026",https://www.amazon.it/dp/B0GWN8TMSL,55.0,,,,,Amazon,IT,2026-07-23T06:46:44Z,B0GWN8TMSL,,,,,
LG,"LG OLED evo AI 55 Pollici, Serie C6 2026 Smart TV 4K - OLED55C64LA",https://www.amazon.it/dp/B0GWN8FYTQ,55.0,,,,,Amazon,IT,2026-07-23T06:46:44Z,B0GWN8FYTQ,,,,,
TCL,"TCL 75C8L 75” SQD-Mini LED TV, 4K HDR 5500 nits and 2,584 dimming zones, Google TV, Dolby Vision & Atmos, Audio by Bang & Olufsen, 144Hz, Apple AirPlay 2 & Alexa",https://www.amazon.it/dp/B0GTZSYZLM,75.0,,,,,Amazon,IT,2026-07-23T06:46:44Z,B0GTZSYZLM,,,,,
Hisense,"Hisense Smart TV MiniLED 144Hz 65"" 4K 65E8S, Dolby Atmos 2.1 By Devialet, Dolby Vision IQ, HDR10+, Native 144Hz Game Mode, VIDAA OS con 1000+ APP, Alexa built-in, lativù 4K, Wifi, Bluetooth",https://www.amazon.it/dp/B0GQF24H9M,65.0,,,,,Amazon,IT,2026-07-23T06:46:44Z,B0GQF24H9M,,,,,
Sony,Sony BRAVIA 5 XR Mini LED 75 Pollici | Processore AI XR | Acoustic Multi-Audio | Dolby Vision/Atmos | IMAX Enhanced | Google TV | Google Cast | Apple AirPlay 2| Eco Dashboard 2 | 75XR55,https://www.amazon.it/dp/B0F4L4JSYM,75.0,,,,,Amazon,IT,2026-07-23T06:46:44Z,B0F4L4JSYM,,,,,
Samsung,"Samsung Smart TV 65"" QE65S95HATXZT OLED 4K Glare Free, HDR 10+, Motion Xcelerator 165Hz, Dolby Atmos, FreeSync Premium Pro, Voice Control with AI(VAC), Alexa Built-in, PACCHETTO INTRATTENIMENTO, 2026",https://www.amazon.it/dp/B0GWN8HDRP,65.0,,,,,Amazon,IT,2026-07-23T06:46:44Z,B0GWN8HDRP,,,,,
LG,"LG OLED evo AI 65 Pollici, Serie C6 2026 Smart TV 4K - OLED65C64LA",https://www.amazon.it/dp/B0GWN36S8N,65.0,,,,,Amazon,IT,2026-07-23T06:46:44Z,B0GWN36S8N,,,,,
TCL,"TCL 85C8L 85” SQD-Mini LED TV, 4K HDR 6000 nits and 3,200 dimming zones, Google TV, Dolby Vision & Atmos, Audio by Bang & Olufsen, 144Hz, Apple AirPlay 2 & Alexa",https://www.amazon.it/dp/B0GTZRP159,85.0,,,,,Amazon,IT,2026-07-23T06:46:44Z,B0GTZRP159,,,,,
Hisense,"Hisense Smart TV MiniLED 144Hz 75"" 4K 75E8S, Dolby Atmos 2.1 By Devialet, Dolby Vision IQ, HDR10+, Native 144Hz Game Mode, VIDAA OS con 1000+ APP, Alexa built-in, lativù 4K, Wifi, Bluetooth",https://www.amazon.it/dp/B0GQCXP6VM,75.0,,,,,Amazon,IT,2026-07-23T06:46:44Z,B0GQCXP6VM,,,,,
Sony,Sony BRAVIA 5 XR Mini LED 85 Pollici | Processore AI XR | Acoustic Multi-Audio | Dolby Vision/Atmos | IMAX Enhanced | Google TV | Google Cast | Apple AirPlay 2| Eco Dashboard 2 | 85XR55,https://www.amazon.it/dp/B0F4KZW14B,85.0,,,,,Amazon,IT,2026-07-23T06:46:44Z,B0F4KZW14B,,,,,
Samsung,"Samsung Smart TV 77"" QE77S95HATXZT OLED 4K Glare Free, HDR 10+, Motion Xcelerator 165Hz, Dolby Atmos, FreeSync Premium Pro, Voice Control with AI(VAC), Alexa Built-in, PACCHETTO INTRATTENIMENTO, 2026",https://www.amazon.it/dp/B0GWN676D1,77.0,,,,,Amazon,IT,2026-07-23T06:46:44Z,B0GWN676D1,,,,,
LG,"LG OLED evo AI 77 Pollici, Serie C6 2026 Smart TV 4K - OLED77C64LA",https://www.amazon.it/dp/B0GWMVM78J,77.0,,,,,Amazon,IT,2026-07-23T06:46:44Z,B0GWMVM78J,,,,,
TCL,"TCL 98C8L 98” SQD-Mini LED TV, 4K HDR 6000 nits and 4,032 dimming zones, Google TV, Dolby Vision & Atmos, Audio by Bang & Olufsen, 144Hz, Apple AirPlay 2 & Alexa",https://www.amazon.it/dp/B0GTZQ77RW,98.0,,,,,Amazon,IT,2026-07-23T06:46:44Z,B0GTZQ77RW,,,,,
Hisense,"Hisense Smart TV MiniLED 144Hz 85"" 4K 85E8S, Dolby Atmos 2.1 By Devialet, Dolby Vision IQ, HDR10+, Native 144Hz Game Mode, VIDAA OS con 1000+ APP, Alexa built-in, lativù 4K, Wifi, Bluetooth",https://www.amazon.it/dp/B0GQDDL8D7,85.0,,,,,Amazon,IT,2026-07-23T06:46:44Z,B0GQDDL8D7,,,,,
Sony,Sony BRAVIA 5 - XR|Mini LED| Processore AI XR | Acoustic Multi-Audio | Dolby Vision/Atmos | IMAX Enhanced | Google TV (2025) |Google Cast| Apple AirPlay 2|Eco Dashboard 2|Menu di gioco 2-98pollici,https://www.amazon.it/dp/B0F7R8NY37,98.0,,,,,Amazon,IT,2026-07-23T06:46:44Z,B0F7R8NY37,,,,,
Samsung,Samsung QE43QN70HAUXZT - Smart TV 43 Pollici 4K Neo QLED Bluetooth DVB-T2 HbbTV 2.0.4 Nero Classe Energetico F,https://www.amazon.it/dp/B0H838M9K6,43.0,,,,,Amazon,IT,2026-07-23T06:46:44Z,B0H838M9K6,,,,,
LG,"LG OLED evo AI 83 Pollici, Serie C6 2026 Smart TV 4K - OLED83C66LB",https://www.amazon.it/dp/B0GWMZ8X4W,83.0,,,,,Amazon,IT,2026-07-23T06:46:44Z,B0GWMZ8X4W,,,,,
TCL,"TCL 75X11L 75” SQD-Mini LED TV, 4K HDR 9000 nits and 10520 dimming zones, Smart TV Powered by Google TV (Dolby Vision IQ & Atmos, Audio by Bang & Olufsen, 144Hz)",https://www.amazon.it/dp/B0GV3VXQB8,75.0,,,,,Amazon,IT,2026-07-23T06:46:44Z,B0GV3VXQB8,,,,,
Hisense,"Hisense Smart TV QLED 43"" 4K 43A7S, 60Hz, Audio Dolby Atmos, VIDAA OS con 1000+ APP, Dolby Vision IQ, HDR 10+, Game Mode Plus, BT, Wifi, Alexa Built-in, AirPlay2, lativù 4K",https://www.amazon.it/dp/B0GSBG2DXL,43.0,,,,,Amazon,IT,2026-07-23T06:46:44Z,B0GSBG2DXL,,,,,
