brand_raw,raw_text,url,size_hint_inch,price_hint_eur,price_local,currency,price_eur,platform,country,scraped_at,asin,elkjop_sku,model_year,filter_year,source_brand,fx_rate_date
TCL,"TCL 65T6C 65"" QLED TV 4K HDR, Fire TV (Dolby Vision e Atmos, HDR10+, Premi e Chiedi ad Alexa)",https://www.amazon.it/dp/B0FC5V51WB,65.0,,,,,Amazon,IT,2026-07-10T03:32:35Z,B0FC5V51WB,,,,,
TCL,"TCL 98Q6C 98"" QD-Mini LED SMART TV, 4K HDR Premium 1000nits, con tecnologia Google TV (Dolby Vision IQ e Atmos, sistema au...",https://www.amazon.it/dp/B0DXQ3G6CL,98.0,,,,,Amazon,IT,2026-07-10T03:32:35Z,B0DXQ3G6CL,,,,,
TCL,"TCL 65Q6C 65"" QD-Mini LED SMART TV, 4K HDR Premium 1000nits, con tecnologia Google TV (Dolby Vision IQ e Atmos, sistema au...",https://www.amazon.it/dp/B0FQNYBYF1,65.0,,,,,Amazon,IT,2026-07-10T03:32:35Z,B0FQNYBYF1,,,,,
TCL,"TCL 32S5L - Tv 32 Pollici Smart Tv Full HD DVB-T2 H.264, H.265 Nero Classe Energetica F",https://www.amazon.it/dp/B0H2JF9P45,32.0,,,,,Amazon,IT,2026-07-10T03:32:35Z,B0H2JF9P45,,,,,
TCL,"TCL 85T6C 85"" QLED TV 4K HDR, Fire TV (Dolby Vision e Atmos, HDR10+, Premi e Chiedi ad Alexa)",https://www.amazon.it/dp/B0FC5P7QFK,85.0,,,,,Amazon,IT,2026-07-10T03:32:35Z,B0FC5P7QFK,,,,,
TCL,"TCL 55T6C 55"" QLED TV 4K HDR, FireTV (SmartTV con Dolby Vision e Atmos, HDR10+, Premi e Chiedi ad Alexa)",https://www.amazon.it/dp/B0FC61MRTV,55.0,,,,,Amazon,IT,2026-07-10T03:32:35Z,B0FC61MRTV,,,,,
TCL,"TCL 75P6K TV LED Direct da 75"", TV HDR 4K, Smart TV con tecnologia Google TV (Dolby Audio, Motion Clarity, compatibile con...",https://www.amazon.it/dp/B0F74QS3PJ,75.0,,,,,Amazon,IT,2026-07-10T03:32:35Z,B0F74QS3PJ,,,,,
TCL,"TCL 75C7K 75"" QD-Mini LED TV, 4K HDR Premium 3000, Smart Google TV, 144Hz Motion Clarity Pro (Dolby Vision IQ & Atmos, Cry...",https://www.amazon.it/dp/B0F5BP3VXC,75.0,,,,,Amazon,IT,2026-07-10T03:32:35Z,B0F5BP3VXC,,,,,
TCL,"TCL 75T6C 75"" QLED TV 4K HDR, Fire TV (Smart tv con Dolby Vision e Atmos, HDR10+, Premi e Chiedi ad Alexa)",https://www.amazon.it/dp/B0FQP2GDZ8,75.0,,,,,Amazon,IT,2026-07-10T03:32:35Z,B0FQP2GDZ8,,,,,
TCL,"Bundle of TCL 98Q7C 98” QLED TV 4K QD-Mini LED, HDR Premium 2000, Google TV + TCL Sound Bar S55H Nero 40W",https://www.amazon.it/dp/B0FC5DXGS7,98.0,,,,,Amazon,IT,2026-07-10T03:32:35Z,B0FC5DXGS7,,,,,
TCL,"TCL S54 Series 32S5400A TV 81,3 cm (32"") HD Smart TV WiFi Nero",https://www.amazon.it/dp/B0CL9YSFJK,32.0,,,,,Amazon,IT,2026-07-10T03:32:35Z,B0CL9YSFJK,,,,,
TCL,"TCL 50CF630, 50"" (126 cm) Fire TV QLED (4K Ultra HD, HDR 10+, Dolby Vision & Atmos, Smart TV, Game Master, Motion Clarity ...",https://www.amazon.it/dp/B0BBGW3RJV,50.0,,,,,Amazon,IT,2026-07-10T03:32:35Z,B0BBGW3RJV,,,,,
TCL,"TCL 85C6K 85"" QD-Mini LED TV, 4K HDR Premium 1000nits, Smart TV con tecnologia Google TV (Dolby Vision IQ e Atmos, sistema...",https://www.amazon.it/dp/B0FPPZHM5L,85.0,,,,,Amazon,IT,2026-07-10T03:32:35Z,B0FPPZHM5L,,,,,
TCL,"TCL 65P6L - Tv 65 Pollici Smart Tv 4K LCD DVB-T2 H.264, H.265 Nero Classe Energetica E",https://www.amazon.it/dp/B0H2JKM82C,65.0,,,,,Amazon,IT,2026-07-10T03:32:35Z,B0H2JKM82C,,,,,
TCL,"TCL 65C69KS - 65 Pollici, Smart TV, 4K, Wi-Fi, QD-Mini LED, DVB-T2, H.264, H.265, Classe energetica E",https://www.amazon.it/dp/B0FSS5LMNS,65.0,,,,,Amazon,IT,2026-07-10T03:32:35Z,B0FSS5LMNS,,,,,
TCL,"TCL 75P6L - Smart TV 75 Pollici 4K LCD DVB-T2 H.264, H.265 Nero Classe Energetica E",https://www.amazon.it/dp/B0H2JJKZS1,75.0,,,,,Amazon,IT,2026-07-10T03:32:35Z,B0H2JJKZS1,,,,,
Hisense,"Hisense 43"" QLED UHD 43E78HQ, Smart TV VIDAA 5.0, HDR Dolby Vision, VA, Controlli vocali Alexa, Tuner DVB-T2/S2 HEVC 10, l...",https://www.amazon.it/dp/B0B12RV1RK,43.0,,,,,Amazon,IT,2026-07-10T03:32:35Z,B0B12RV1RK,,,,,
TCL,"2 gambe per TV con viti, piedini di ricambio universali per TV a schermo piatto da 40 pollici, compatibili con TV TCL Rok...",https://www.amazon.it/dp/B0GCFPZVCD,40.0,21.87,21.87,EUR,21.87,Amazon,IT,2026-07-10T03:32:35Z,B0GCFPZVCD,,,,,
TCL,"HYRAM 6 V. PORTATO Retroilluminazione Strip 5 Lampada for TCL 32S5300 32S6500 32S6400 Mi 32 ""TV LCD L32M5-AZ TCL32D05-ZC22...",https://www.amazon.it/dp/B0CJ6XLTTW,32.0,,,,,Amazon,IT,2026-07-10T03:32:35Z,B0CJ6XLTTW,,,,,
TCL,"Wodsty Piede da tavolo di ricambio per Smart TV TCL 28-65"", base solida nera in ABS, materiale di fissaggio incluso, per m...",https://www.amazon.it/dp/B0H7LCFHJD,65.0,,,,,Amazon,IT,2026-07-10T03:32:35Z,B0H7LCFHJD,,,,,
TCL,"Gettimore Base per TV TCL da 28"" a 65"", montaggio da tavolo in ABS compatibile con 43S446 50S421 55S425 32S325, coppia nera",https://www.amazon.it/dp/B0H82YT3MY,28.0,,,,,Amazon,IT,2026-07-10T03:32:35Z,B0H82YT3MY,,,,,
LG,"Base universale per TV LG da 49 a 65 pollici, gambe di ricambio con viti, antiscivolo, stabili e durevoli, per TV LG, faci...",https://www.amazon.it/dp/B0H1N4GGDQ,65.0,53.19,53.19,EUR,53.19,Amazon,IT,2026-07-10T03:32:35Z,B0H1N4GGDQ,,,,,
TCL,rflaueo 2 piedini universali regolabili e robusti per TV a schermo piatto TCL Roku da 32 40 49 50 55 pollici (U256-1),https://www.amazon.it/dp/B0DPMKW6GX,55.0,19.14,19.14,EUR,19.14,Amazon,IT,2026-07-10T03:32:35Z,B0DPMKW6GX,,,,,
TCL,"PureBowlic Base per TV TCL da 28-65 pollici, facile da installare, piedini di ricambio per kit di viti, staffa di montaggi...",https://www.amazon.it/dp/B0H6NFZPNW,65.0,,,,,Amazon,IT,2026-07-10T03:32:35Z,B0H6NFZPNW,,,,,
TCL,"Glomc Base di ricambio per Tcl per Smart TV da 28 a 65 pollici, gambe in ABS con kit di viti, installazione semplice, mont...",https://www.amazon.it/dp/B0GZB2B358,65.0,,,,,Amazon,IT,2026-07-10T03:32:35Z,B0GZB2B358,,,,,
TCL,"Gettimore Piedini universali per TV TCL Smart TV da 28-65 pollici, base in ABS resistente, compatibile con modelli 43S446 ...",https://www.amazon.it/dp/B0H83GVV9C,65.0,,,,,Amazon,IT,2026-07-10T03:32:35Z,B0H83GVV9C,,,,,
Hisense,"Hisense Smart TV 32"" HD Ready 32E4ST, 60Hz, DTS Virtual X, VIDAA OS con 1000+ APP, Game Mode, Wifi, AirPlay2, Works with A...",https://www.amazon.it/dp/B0GM1HFTNL,32.0,130.33,130.33,EUR,130.33,Amazon,IT,2026-07-10T03:32:35Z,B0GM1HFTNL,,,,,
Hisense,"Hisense Smart TV QLED 32"" Full HD Dèco TV 32S5Q, 60Hz, Audio Dolby Atmos, HDR10, VIDAA OS con 1000+ APP, Wifi, Game Mode, ...",https://www.amazon.it/dp/B0FSLMYL4W,32.0,163.11,163.11,EUR,163.11,Amazon,IT,2026-07-10T03:32:35Z,B0FSLMYL4W,,,,,
Hisense,"Hisense Smart TV QLED 32"" FHD 32E5ST, 60Hz, Audio Dolby Atmos, VIDAA OS con 1000+ APP, HDR10, Game Mode, Works with Alexa,...",https://www.amazon.it/dp/B0GM1T3HF5,32.0,179.51,179.51,EUR,179.51,Amazon,IT,2026-07-10T03:32:35Z,B0GM1T3HF5,,,,,
Hisense,"Hisense TV 100"" QLED 4K 144Hz 100E7Q PRO, Smart TV VIDAA U8, Dolby Vision IQ, HDR 10+ Adaptive, 144hz Game Mode PRO, Dolby...",https://www.amazon.it/dp/B0F1N92VWF,100.0,,,,,Amazon,IT,2026-07-10T03:32:35Z,B0F1N92VWF,,,,,
Hisense,"Hisense Smart TV MiniLED 55"" 4K TV 55U7SE, Dolby Atmos 2.1 By Devialet, Dolby Vision IQ, HDR10+, Native 144Hz Game Mode, V...",https://www.amazon.it/dp/B0GKPVQ86Z,55.0,,,,,Amazon,IT,2026-07-10T03:32:35Z,B0GKPVQ86Z,,,,,
Hisense,"Hisense 43A79Q - TV 43 Pollici, Smart TV, QLED 4K, HEVC, DVB-T2, Classe energetica E",https://www.amazon.it/dp/B0FJMSFYQY,43.0,424.52,424.52,EUR,424.52,Amazon,IT,2026-07-10T03:32:35Z,B0FJMSFYQY,,,,,
Hisense,"Hisense 65E79Q - Smart TV 65 Pollici, DVB-T2 HEVC, QLED, colore Nero, Classe energetica G",https://www.amazon.it/dp/B0FJMR5XCG,65.0,,,,,Amazon,IT,2026-07-10T03:32:35Z,B0FJMR5XCG,,,,,
Hisense,"Hisense Smart TV MiniLED 144Hz 55"" 4K TV 55U79SE, Dolby Atmos 2.1 By Devialet, Dolby Vision IQ, HDR10+, Native 144Hz Game ...",https://www.amazon.it/dp/B0GM1RLZ5R,55.0,,,,,Amazon,IT,2026-07-10T03:32:35Z,B0GM1RLZ5R,,,,,
Hisense,Hisense 43Q7S PRO - Smart TV 43 Pollici 4K QLED DVB-T2 HEVC/H.265 Wifi Nero Classe Energetico F,https://www.amazon.it/dp/B0H835JPZM,43.0,,,,,Amazon,IT,2026-07-10T03:32:35Z,B0H835JPZM,,,,,
Hisense,Hisense 55Q8S - TV 55 Pollici Smart TV 4K DVB-T2 ULED Wifi Nero Classe E,https://www.amazon.it/dp/B0H835F766,55.0,,,,,Amazon,IT,2026-07-10T03:32:35Z,B0H835F766,,,,,
Hisense,Hisense 50Q7S - TV 50 Pollici Smart TV 4K QLED DVB-T2 Wifi HEVC/H.265 Nero Classe Energetica E,https://www.amazon.it/dp/B0H83625QD,50.0,,,,,Amazon,IT,2026-07-10T03:32:35Z,B0H83625QD,,,,,
Hisense,Hisense 50U79SE - TV 50 Pollici Smart TV 4K Ultra HD ULED Mini LED DVB-T2 HEVC Nero Classe Energetica E,https://www.amazon.it/dp/B0H8386P53,50.0,,,,,Amazon,IT,2026-07-10T03:32:35Z,B0H8386P53,,,,,
Hisense,"Hisense 55"" ULED Mini-LED 4K 2023 55U62KQ, Smart TV VIDAA U6, Dolby Vision, HDR 10 + 4K HS2100 Soundbar 2.1, 240W, Subwoof...",https://www.amazon.it/dp/B0CRZHC29R,55.0,,,,,Amazon,IT,2026-07-10T03:32:35Z,B0CRZHC29R,,,,,
Hisense,"Hisense 43A69K - TV Smart 43 Pollici, 4K, DVB-T2, H.265, Nero",https://www.amazon.it/dp/B0CHBCWQZ6,43.0,499.0,499.0,EUR,499.0,Amazon,IT,2026-07-10T03:32:35Z,B0CHBCWQZ6,,,,,
Hisense,Hisense 43A69S - Smart TV 43 Pollici LED 4K DVB-T2 HEVC/H.265 Wifi Nero Classe Energetico E,https://www.amazon.it/dp/B0H83CB2LF,43.0,,,,,Amazon,IT,2026-07-10T03:32:35Z,B0H83CB2LF,,,,,
Xiaomi,"XIAOMI TV F 55, 55 pollici (140 cm), 4K UHD, Smart TV, Fire TV, HDR10, MEMC, 60Hz con modalità Game Boost a 120 Hz, contro...",https://www.amazon.it/dp/B0FCY8TGFF,55.0,480.9,480.9,EUR,480.9,Amazon,IT,2026-07-10T03:32:35Z,B0FCY8TGFF,,,,,
Hisense,"Hisense TV 65"" Mini-LED 165Hz 4K 2025 65U8Q, Octagonal Stand, Dolby Atmos Multi-Channel Surround 4.1.2, Smart TV VIDAA U9 ...",https://www.amazon.it/dp/B0F1WBGQBM,65.0,,,,,Amazon,IT,2026-07-10T03:32:35Z,B0F1WBGQBM,,,,,
Hisense,"Hisense Smart TV QLED 50"" 4K 50E7Q PRO, Smart TV VIDAA U8, Dolby Vision IQ, HDR 10+ Adaptive, 144hz Game Mode PRO, Dolby A...",https://www.amazon.it/dp/B0FFH8CWBK,50.0,,,,,Amazon,IT,2026-07-10T03:32:35Z,B0FFH8CWBK,,,,,
Hisense,"Hisense Smart TV QLED 43"" 4K 43E7Q PRO, Smart TV VIDAA, Dolby Vision IQ, HDR 10+ Adaptive, 144hz Game Mode PRO, Dolby Atmo...",https://www.amazon.it/dp/B0FFH953XW,43.0,,,,,Amazon,IT,2026-07-10T03:32:35Z,B0FFH953XW,,,,,
Hisense,"Hisense 40A59S - TV 40 Pollici, Smart TV 4K Full HD QLED DVB-T2 Nero Classe Energetica E",https://www.amazon.it/dp/B0H1N6FDBV,40.0,,,,,Amazon,IT,2026-07-10T03:32:35Z,B0H1N6FDBV,,,,,
Hisense,"Hisense TV 32"" HD Ready 2025 32E41QT, Smart TV VIDAA U8, Airplay2, Game Mode, Works with Alexa, Tuner DVB-T2/S2 HEVC 10, l...",https://www.amazon.it/dp/B0F2PF8YK7,32.0,,,,,Amazon,IT,2026-07-10T03:32:35Z,B0F2PF8YK7,,,,,
Hisense,"Hisense 55A86Q55 - TV 55 Pollici, Smart TV, DVB-T2, HEVC, 4K, ULED, Nero, Classe energetica G",https://www.amazon.it/dp/B0G1ZDM9JQ,55.0,,,,,Amazon,IT,2026-07-10T03:32:35Z,B0G1ZDM9JQ,,,,,
Hisense,"Hisense 43E79NQ - Smart TV 43 Pollici (108 cm), QLED, 4K, DVB-T2 HEVC",https://www.amazon.it/dp/B0DJT3L51S,43.0,,,,,Amazon,IT,2026-07-10T03:32:35Z,B0DJT3L51S,,,,,
Hisense,"Hisense 65"" ULED Mini-LED 4K 2023 65U62KQ, Smart TV VIDAA U6, Dolby Vision, HDR 10+ 4K HS2100 Soundbar 2.1, 240W, Subwoofe...",https://www.amazon.it/dp/B0CRZHB7KF,65.0,,,,,Amazon,IT,2026-07-10T03:32:35Z,B0CRZHB7KF,,,,,
TCL,"TCL 55P7K 55” QLED 4K HDR TV, Google TV, Smart TV (Dolby Vision & Atmos, Game Master, Motion clarity)",https://www.amazon.it/dp/B0F99Z7M9M,55.0,,,,,Amazon,IT,2026-07-10T03:32:35Z,B0F99Z7M9M,,,,,
TCL,"TCL 65T69C 65” QLED 60HZ 4K HDR, Google TV, Smart TV(Dolby Vision & Atmos, Motion clarity, compatibile con Google Assistan...",https://www.amazon.it/dp/B0F8QDCBCM,65.0,,,,,Amazon,IT,2026-07-10T03:32:35Z,B0F8QDCBCM,,,,,
Panasonic,"Panasonic Premium TV-43W85BEZC, Serie W85B, 43 Pollici, Smart TV QLED 4K Ultra HD, 120Hz, Fire TV, Dolby Vision e Atmos, M...",https://www.amazon.it/dp/B0H2MSSSCS,43.0,,,,,Amazon,IT,2026-07-10T03:32:35Z,B0H2MSSSCS,,,,,
Hisense,"2 piedini di ricambio per TV Hisense, in ABS, senza trapano, per Smart TV LED Hisense da 32 pollici, 40 pollici e 43 polli...",https://www.amazon.it/dp/B0H28WQLD5,32.0,13.41,13.41,EUR,13.41,Amazon,IT,2026-07-10T03:32:35Z,B0H28WQLD5,,,,,
Hisense,"Accessori For Scheda T-CON TV 4K Da 70 Pollici, Compatibile Con Philips, Compatibile Con Hisense, Compatibile Con Xiaomi, ...",https://www.amazon.it/dp/B0H7XFV1BY,70.0,,,,,Amazon,IT,2026-07-10T03:32:35Z,B0H7XFV1BY,,,,,
Samsung,"KELUNIS HD Clear Anti Luce Blu 32-75 Pollici Proteggi Schermo TV per Sharp Sony Samsung Hisense LG,52"" (1161 * 661)",https://www.amazon.it/dp/B09M6RL7S3,75.0,109.11,109.11,EUR,109.11,Amazon,IT,2026-07-10T03:32:35Z,B09M6RL7S3,,,,,
Sony,"Sony BRAVIA KD-32W800 - Smart TV 32 pollici, HD Ready LED, HDR, Android TV, KD32W800PAEP [Classe di efficienza energetica F]",https://www.amazon.it/dp/B0BNW6941F,32.0,225.41,225.41,EUR,225.41,Amazon,IT,2026-07-10T03:32:35Z,B0BNW6941F,,,,,
Sony,"Sony BRAVIA 8 OLED 55 Pollici 4K HDR, Google Smart TV (2024) BRAVIA Theatre Bar 8",https://www.amazon.it/dp/B0D428GVB1,55.0,,,,,Amazon,IT,2026-07-10T03:32:35Z,B0D428GVB1,,,,,
Panasonic,"Panasonic TB-32S45AEZC, Serie S45 32 pollici Smart TV LED Full HD, TiVo, Controllo Vocale Google e Alexa, Game Mode, Media...",https://www.amazon.it/dp/B0H2MTPSGX,32.0,236.89,236.89,EUR,236.89,Amazon,IT,2026-07-10T03:32:35Z,B0H2MTPSGX,,,,,
Panasonic,"Panasonic TB-32S40AEZC, Serie S40 32 pollici Smart TV LED HD, TiVo, Controllo Vocale Google e Alexa, Game Mode, Media Play...",https://www.amazon.it/dp/B0H2MPMR8R,32.0,213.95,213.95,EUR,213.95,Amazon,IT,2026-07-10T03:32:35Z,B0H2MPMR8R,,,,,
Sony,Sony XR-75X95K – 75 Pollici- BRAVIA XR - Mini LED – 4K Ultra HD – High Dynamic Range (HDR) – Smart TV (Google TV) – Black ...,https://www.amazon.it/dp/B09ZPV3HLD,75.0,,,,,Amazon,IT,2026-07-10T03:32:35Z,B09ZPV3HLD,,,,,
Sony,"SONY FW-75BZ40L affichage de messages Panneau plat de signalisation numérique 190,5 cm (75"") LCD Wifi 700 cd/m² 4K Ult",https://www.amazon.it/dp/B0C9YPPB7J,75.0,,,,,Amazon,IT,2026-07-10T03:32:35Z,B0C9YPPB7J,,,,,
Sony,"SONY FW-75BZ35L affichage de messages Panneau plat de signalisation numérique 190,5 cm (75"") LCD Wifi 550 cd/m² 4K Ult",https://www.amazon.it/dp/B0C9YP1N7N,75.0,,,,,Amazon,IT,2026-07-10T03:32:35Z,B0C9YP1N7N,,,,,
Sony,"SONY FW-50EZ20L affichage de messages Panneau plat de signalisation numérique 127 cm (50"") LED Wifi 350 cd/m² 4K",https://www.amazon.it/dp/B0CXL3XFHN,50.0,,,,,Amazon,IT,2026-07-10T03:32:35Z,B0CXL3XFHN,,,,,
Sony,Sony Su-Wl450 -Staffa Per Il Montaggio a Parete Tv Sony da 32 a 85 Pollici,https://www.amazon.it/dp/B00IZEIZB4,85.0,40.98,40.98,EUR,40.98,Amazon,IT,2026-07-10T03:32:35Z,B00IZEIZB4,,,,,
Sony,BAVALU Retroilluminazione TV LED for SONY 40 pollici KLV-40R470A KLV-40R450A KDL-40R473A SVG400A81 REV3 121114 S400H1LCD-1...,https://www.amazon.it/dp/B0C3996TZS,40.0,29.54,29.54,EUR,29.54,Amazon,IT,2026-07-10T03:32:35Z,B0C3996TZS,,,,,
Sony,BAVALU 10 Pezzi/Lotto for Sony Utilizzare 40 Pollici TV RETROILLUMINAZIONE for LED Bar SUG400A81_REV3_121114 for Sony KDL-...,https://www.amazon.it/dp/B0BRNKVGNN,40.0,202.67,202.67,EUR,202.67,Amazon,IT,2026-07-10T03:32:35Z,B0BRNKVGNN,,,,,
Sony,"Accessorio For Scheda Logica TV 120HZ 4K Da 55 Pollici, Compatibile Con Sony, 18Y-SHU11A2H2A4V0.0 KD-55X9000F 18Y SHU11A2H...",https://www.amazon.it/dp/B0H7XGWXFK,55.0,,,,,Amazon,IT,2026-07-10T03:32:35Z,B0H7XGWXFK,,,,,
Samsung,"Samsung Crystal UHD 4K Smart TV 85'' UE85U7000FUXZT, Crystal 4K Processor, HDR, Smart Experience, OTS Lite & Adaptive Soun...",https://www.amazon.it/dp/B0F4STR391,85.0,,,,,Amazon,IT,2026-07-10T03:32:35Z,B0F4STR391,,,,,
Samsung,"Samsung UE55RU7172 TV 55"" 4K UHD Smart TV BLUETOOT LAN DLNA DVT2 DVBS2 HDR10+",https://www.amazon.it/dp/B07S8WVHQC,55.0,,,,,Amazon,IT,2026-07-10T03:32:35Z,B07S8WVHQC,,,,,
LG,"LG Mini RGB 55 pollici Serie MRGB87 55MRGB87B6B, Smart TV 4K, RGB Primary Color Pro, DualColor 100% DCI-P3/Adobe RGB, Dolb...",https://www.amazon.it/dp/B0GWMW2FLR,55.0,,,,,Amazon,IT,2026-07-10T03:32:35Z,B0GWMW2FLR,,,,,
LG,"LG OLED65C55 - TV 65 Pollici, 4K, Smart TV, OLED, DVB-T2, Wi-Fi, HEVC/H.265, Classe energetica F",https://www.amazon.it/dp/B0FFH3T1S6,65.0,,,,,Amazon,IT,2026-07-10T03:32:35Z,B0FFH3T1S6,,,,,
LG,"Cello Smart TV 32 pollici: TV LED senza cornice e intuitiva – Con LG WebOS, Netflix integrato, Apple+, Bluetooth, Prime Vi...",https://www.amazon.it/dp/B0CF9VT914,32.0,188.52,188.52,EUR,188.52,Amazon,IT,2026-07-10T03:32:35Z,B0CF9VT914,,,,,
TCL,"TCL 65P6K TV LED Direct da 65"", TV HDR 4K, Smart TV con tecnologia Google TV (Dolby Audio, Motion Clarity, compatibile con...",https://www.amazon.it/dp/B0F74855ZF,65.0,,,,,Amazon,IT,2026-07-10T03:32:35Z,B0F74855ZF,,,,,
TCL,"TCL 55Q6C 55"" QD-Mini LED SMART TV, 4K HDR Premium 1000nits, con tecnologia Google TV (Dolby Vision IQ e Atmos, sistema au...",https://www.amazon.it/dp/B0DX185Q23,55.0,,,,,Amazon,IT,2026-07-10T03:32:35Z,B0DX185Q23,,,,,
TCL,"TCL 50T69C 50” QLED 60HZ, 4K HDR, Google TV, Smart TV((Dolby Vision & Atmos, Motion clarity, compatibile con Google Assist...",https://www.amazon.it/dp/B0F8QDY84D,50.0,,,,,Amazon,IT,2026-07-10T03:32:35Z,B0F8QDY84D,,,,,
Samsung,"KELUNIS HD Clear Anti Luce Blu 32-75 Pollici Proteggi Schermo TV per Sharp Sony Samsung Hisense LG,43""(942 * 529)",https://www.amazon.it/dp/B09M6RHHNX,75.0,81.96,81.96,EUR,81.96,Amazon,IT,2026-07-10T03:32:35Z,B09M6RHHNX,,,,,
Sony,"Scheda T-CON, compatibile con Sony, scheda logica TV KD-75X7800F da 75 pollici 18Y-S75HU11A2H2A6AV0.2(LMY750)",https://www.amazon.it/dp/B0FMKLWCFX,75.0,,,,,Amazon,IT,2026-07-10T03:32:35Z,B0FMKLWCFX,,,,,
Sony,"Scheda T-con 6870C-0738A, compatibile con Sony, TV 43'' 49'' 55'' Scheda logica V17_43UHD_TM120_1.0 Accessori(49 inch with...",https://www.amazon.it/dp/B0FMPC86QG,43.0,,,,,Amazon,IT,2026-07-10T03:32:35Z,B0FMPC86QG,,,,,
Panasonic,"Panasonic TV-32S50AEZC, Serie S50 32 pollici Smart TV LED HD, Fire TV, HD Colour Engine, HDR, Alexa Voice Control, Game Mo...",https://www.amazon.it/dp/B0H2MTB4V6,32.0,,,,,Amazon,IT,2026-07-10T03:32:35Z,B0H2MTB4V6,,,,,
Sony,"Scheda logica T650HVN12.3 CTRL BD 65T37-C04 TV 65 pollici, compatibile con Sony, KDL-65W850C Prodotto Scheda T-con Scheda ...",https://www.amazon.it/dp/B0FMKKS1NC,65.0,,,,,Amazon,IT,2026-07-10T03:32:35Z,B0FMKKS1NC,,,,,
Sony,Retroilluminazione a LED 10pcs 5leds for Sony 40'' 2013SONY40A 2013SONY40B 3228 05 REV1.0 KDL-40R455 KDL-40W600B KDL-40W59...,https://www.amazon.it/dp/B0C3XL8LTR,40.0,27.9,27.9,EUR,27.9,Amazon,IT,2026-07-10T03:32:35Z,B0C3XL8LTR,,,,,
Sony,BAVALU 10 Pezzi/Lotto for Sony Utilizzare 40 Pollici TV RETROILLUMINAZIONE for LED Bar SUG400A81_REV3_121114 for Sony KDL-...,https://www.amazon.it/dp/B0BRNMFBCJ,40.0,111.03,111.03,EUR,111.03,Amazon,IT,2026-07-10T03:32:35Z,B0BRNMFBCJ,,,,,
Sony,BAVALU 10 Pezzi/Lotto for Sony Utilizzare 40 Pollici TV RETROILLUMINAZIONE for LED Bar SUG400A81_REV3_121114 for Sony KDL-...,https://www.amazon.it/dp/B0BRNLH8YQ,40.0,73.14,73.14,EUR,73.14,Amazon,IT,2026-07-10T03:32:35Z,B0BRNLH8YQ,,,,,
Sony,BAVALU 10 pezzi/lotto for SONY Utilizzare 40 Pollici TV RETROILLUMINAZIONE for LED BAR SUG400A81_REV3_121114 for SONY KDL-...,https://www.amazon.it/dp/B0BY9DPRP2,40.0,28.5,28.5,EUR,28.5,Amazon,IT,2026-07-10T03:32:35Z,B0BY9DPRP2,,,,,
Sony,BAVALU Retroilluminazione a LED 10pcs 5leds for Sony 40'' 2013SONY40A 2013SONY40B 3228 05 REV1.0 KDL-40R455 KDL-40W600B KD...,https://www.amazon.it/dp/B0C4HMSBQK,40.0,31.97,31.97,EUR,31.97,Amazon,IT,2026-07-10T03:32:35Z,B0C4HMSBQK,,,,,
TCL,"TCL 98C7K 98"" QD-Mini LED TV, 4K HDR Premium 3000, Smart Google TV, 144Hz Motion Clarity Pro (Dolby Vision IQ & Atmos, Cry...",https://www.amazon.it/dp/B0F5BL77MF,98.0,,,,,Amazon,IT,2026-07-10T03:32:35Z,B0F5BL77MF,,,,,
TCL,"TCL 50Q7C 50” QLED TV 4K QD-Mini LED, HDR Premium 2000, Google TV (Dolby Vision IQ & Atmos, Pannello HVA, Refresh Rate 144...",https://www.amazon.it/dp/B0F38D74ZD,50.0,,,,,Amazon,IT,2026-07-10T03:32:35Z,B0F38D74ZD,,,,,
Xiaomi,"XIAOMI TV S Mini LED 55 pollici (140 cm), QLED Mini LED Televisore, 4K UHD, Smart TV con Google TV, HDR10+, Tuner DVB-C/S/...",https://www.amazon.it/dp/B0GJ3Y5H7W,55.0,,,,,Amazon,IT,2026-07-10T03:32:35Z,B0GJ3Y5H7W,,,,,
TCL,"TCL 55T8C TV QLED 4K HDR Ultra HD da 55"", QLED TV con tecnologia Google TV (Dolby Vision e Atmos, Motion Clarity Pro a 144...",https://www.amazon.it/dp/B0DV9JP49P,55.0,,,,,Amazon,IT,2026-07-10T03:32:35Z,B0DV9JP49P,,,,,
TCL,"TCL 65P7K 65”QLED 4K HDR TV, Google TV, Smart TV(Dolby Vision & Atmos, Game Master, Motion clarity)",https://www.amazon.it/dp/B0FH78VT5V,65.0,,,,,Amazon,IT,2026-07-10T03:32:35Z,B0FH78VT5V,,,,,
TCL,"TCL 75P7K 75” QLED 4K HDR TV, Google TV, Smart TV (Dolby Vision & Atmos, Game Master, Motion clarity)",https://www.amazon.it/dp/B0F9FNDBN7,75.0,,,,,Amazon,IT,2026-07-10T03:32:35Z,B0F9FNDBN7,,,,,
TCL,"TCL 85P8K QLED 4K HDR Ultra HD 85"" QLED TV with Google TV Technology (Dolby Vision and Atmos, Motion Clarity Pro 144Hz, Fr...",https://www.amazon.it/dp/B0F7RVYVDT,85.0,,,,,Amazon,IT,2026-07-10T03:32:35Z,B0F7RVYVDT,,,,,
TCL,"TCL 75Q6C 75"" QD-Mini LED SMART TV, 4K HDR Premium 1000nits, con tecnologia Google TV (Dolby Vision IQ e Atmos, sistema au...",https://www.amazon.it/dp/B0DXQ48PD9,75.0,,,,,Amazon,IT,2026-07-10T03:32:35Z,B0DXQ48PD9,,,,,
Samsung,"Samsung Smart TV 55'' UE55U7000FUXZT Crystal UHD 4K, Crystal 4K Processor, Per Intrattenimento e Sport, HDR, Motion Xcelerator, Smart Experience, OTS Lite & Adaptive Sound, Metal Stream Design, 2025",https://www.amazon.it/dp/B0F4TCSYQK,55.0,,,,,Amazon,IT,2026-07-10T03:32:35Z,B0F4TCSYQK,,,,,
Samsung,"Samsung Smart TV 75'' UE75U7000FUXZT Crystal UHD 4K, Crystal 4K Processor, Per Intrattenimento e Sport, HDR, Motion Xcelerator, Smart Experience, OTS Lite & Adaptive Sound, Metal Stream Design, 2025",https://www.amazon.it/dp/B0F4T85B1Y,75.0,,,,,Amazon,IT,2026-07-10T03:32:35Z,B0F4T85B1Y,,,,,
LG,"Cello C1924WSH Smart TV da 19"", WebOS, Bluetooth, Audio Pitch Perfect, ideale per Cucina, Camera da Letto e Piccoli Spazi",https://www.amazon.it/dp/B0D31XSMBS,19.0,,,,,Amazon,IT,2026-07-10T03:32:35Z,B0D31XSMBS,,,,,
LG,"Cello C2224WSH Smart TV senza cornice da 22 pollici, alimentazione di rete, LG WebOS, Bluetooth, altoparlanti Pitch Perfect, ideale per cucina, camera da letto o stanze di piccole dimensioni",https://www.amazon.it/dp/B0D31Y8LTL,22.0,,,,,Amazon,IT,2026-07-10T03:32:35Z,B0D31Y8LTL,,,,,
LG,"Cello Smart TV LED Frameless da 43 pollici, webOS ultraveloce, Netflix, Prime Video, Apple TV, Disney Plus, Bluetooth, 3 porte HDMI e porta USB. [2025]",https://www.amazon.it/dp/B0CF9SWMZ3,43.0,,,,,Amazon,IT,2026-07-10T03:32:35Z,B0CF9SWMZ3,,,,,
LG,"Cello Smart TV 50"" LG WebOS HD Ready Televisore con triplo sintonizzatore S2 T2 FreeSat Bluetooth Disney+ Netflix Apple TV+ Prime Video Made in Europe",https://www.amazon.it/dp/B0CKW6LW49,50.0,,,,,Amazon,IT,2026-07-10T03:32:35Z,B0CKW6LW49,,,,,
LG,"Cello C2424WSH 24"" pollici SMART TV frameless Triplo sintonizzatore (DVB-C/-S2/-T2) Bluetooth WebOS di LG Altoparlante Pitch Perfect Disney+ Netflix Made in Europe",https://www.amazon.it/dp/B0D31VRSGJ,24.0,,,,,Amazon,IT,2026-07-10T03:32:35Z,B0D31VRSGJ,,,,,
LG,"Cello TV LED C1624F da 16 pollici con lettore DVD integrato e altoparlanti Pitch Perfect. Schermo piccolo per cucine, appartamenti e spazi compatti. Alimentazione a rete 240 V.",https://www.amazon.it/dp/B0CVFXBX3R,16.0,149.41,149.41,EUR,149.41,Amazon,IT,2026-07-10T03:32:35Z,B0CVFXBX3R,,,,,
LG,"Cello C1924F TV LED da 19"" con Lettore DVD Integrato, Triple Tuner, Audio Pitch Perfect, ideale per Cucina e Piccoli Spazi",https://www.amazon.it/dp/B0D31ZYDYR,19.0,147.53,147.53,EUR,147.53,Amazon,IT,2026-07-10T03:32:35Z,B0D31ZYDYR,,,,,
LG,"Cello TV 32 Pollici LED HD Ready con Lettore DVD Integrato – Triplo Sintonizzatore DVB-T2/S2/C, Registrazione USB, 3 HDMI, Non Smart TV, Design Compatto",https://www.amazon.it/dp/B08DYG3ZK8,32.0,180.32,180.32,EUR,180.32,Amazon,IT,2026-07-10T03:32:35Z,B08DYG3ZK8,,,,,
LG,"Cello C2425WSF Smart TV/DVD Full HD da 24"", WebOS, Bluetooth, Triple Tuner, Audio Pitch Perfect, ideale per Cucina e Camera",https://www.amazon.it/dp/B0F1Z47LGX,24.0,180.32,180.32,EUR,180.32,Amazon,IT,2026-07-10T03:32:35Z,B0F1Z47LGX,,,,,
Hisense,"Hisense TV 55"" Mini-LED 165Hz 4K 2025 55U8Q, Octagonal Stand, Dolby Atmos Multi-Channel Surround 4.1.2, Smart TV VIDAA U9 con 1000+APP, Dolby Vision IQ, HDR 10+, 165Hz Game Mode Ultra, Alexa Built-in",https://www.amazon.it/dp/B0F1WHZW4G,55.0,,,,,Amazon,IT,2026-07-10T03:32:35Z,B0F1WHZW4G,,,,,
Hisense,"Hisense TV 75"" Mini-LED 165Hz 4K 2025 75U8Q, Octagonal Stand, Dolby Atmos Multi-Channel Surround 4.1.2, Smart TV VIDAA U9 con 1000+APP, Dolby Vision IQ, HDR 10+, 165Hz Game Mode Ultra, Alexa Built-in,",https://www.amazon.it/dp/B0F1W3TRZT,75.0,,,,,Amazon,IT,2026-07-10T03:32:35Z,B0F1W3TRZT,,,,,
Hisense,"Hisense TV 85"" Mini-LED 165Hz 4K 2025 85U8Q, Octagonal Stand, Dolby Atmos Multi-Channel Surround 4.1.2, Smart TV VIDAA U9 con 1000+APP, Dolby Vision IQ, HDR 10+, 165Hz Game Mode Ultra, Alexa Built-in",https://www.amazon.it/dp/B0F1W5Z9FW,85.0,,,,,Amazon,IT,2026-07-10T03:32:35Z,B0F1W5Z9FW,,,,,
Sony,Sony BRAVIA 8 OLED 65 Pollici 4K HDR Google Smart TV (2024) BRAVIA Theatre Bar 8,https://www.amazon.it/dp/B0D3HW97NV,65.0,,,,,Amazon,IT,2026-07-10T03:32:35Z,B0D3HW97NV,,,,,
Xiaomi,"XIAOMI TV F 43, 43 pollici (109 cm), 4K UHD, Smart TV, Fire OS8, Triple Tuner DVB-C/S/S2/T/T2,HDR10, MEMC, Controllo Vocale Alexa, 2GB+32GB, Compatibile con Apple AirPlay",https://www.amazon.it/dp/B0F44MCCL3,43.0,,,,,Amazon,IT,2026-07-10T03:32:35Z,B0F44MCCL3,,,,,
Xiaomi,"XIAOMI TV F 50, 50 pollici (127 cm), 4K UHD, Smart TV, Fire TV, Triple Tuner DVB-C/S/S2/T/T2,HDR10, MEMC, Modalità Game Boost 120Hz, Controllo Vocale Alexa, 2GB+32GB, Compatibile con AirPlay",https://www.amazon.it/dp/B0F45BXJ1C,50.0,,,,,Amazon,IT,2026-07-10T03:32:35Z,B0F45BXJ1C,,,,,
Xiaomi,"XIAOMI TV F 55, 55 pollici (140 cm),4K UHD,Smart TV,Fire TV, Triple Tuner DVB-C/S/S2/T/T2,HDR10, MEMC, Modalità Game Boost 120Hz, Controllo Vocale Alexa, 2GB+32GB, Compatibile con Apple AirPlay",https://www.amazon.it/dp/B0F457G5QG,55.0,,,,,Amazon,IT,2026-07-10T03:32:35Z,B0F457G5QG,,,,,
