brand_raw,raw_text,url,size_hint_inch,price_hint_eur,price_local,currency,price_eur,platform,country,scraped_at,asin,elkjop_sku,model_year,filter_year,source_brand,fx_rate_date
Samsung,"Samsung HD Smart TV 32'' UE32H5000FKXZT HD, Hyper Real Processor, HDR & Pur Color, Smart Experience, OTS Lite & Adaptive S...",https://www.amazon.it/dp/B0DF6NHYS6,32.0,155.15,155.15,EUR,155.15,Amazon,IT,2026-07-10T03:32:35Z,B0DF6NHYS6,,,,,
Samsung,"Samsung Full HD Smart TV 27'' UE27F6000FUXZT, Hyper Real Processor, HDR & Pur Color, Smart Experience, OTS Lite & Adaptive...",https://www.amazon.it/dp/B0F7LLQRKX,27.0,150.0,150.0,EUR,150.0,Amazon,IT,2026-07-10T03:32:35Z,B0F7LLQRKX,,,,,
Samsung,"Samsung Full HD Smart TV 32'' UE32F6000FUXZT FHD, Hyper Real Processor, HDR & Pur Color, Smart Experience, OTS Lite & Adap...",https://www.amazon.it/dp/B0F7LK6NJ8,32.0,163.11,163.11,EUR,163.11,Amazon,IT,2026-07-10T03:32:35Z,B0F7LK6NJ8,,,,,
Samsung,"Samsung Crystal UHD 4K Smart TV 65'' UE65U7000FUXZT, Crystal 4K Processor, HDR, Smart Experience, OTS Lite & Adaptive Soun...",https://www.amazon.it/dp/B0F4T91QVZ,65.0,,,,,Amazon,IT,2026-07-10T03:32:35Z,B0F4T91QVZ,,,,,
Samsung,"Samsung Smart TV 50'' UE50U7000FUXZT Crystal UHD 4K, Crystal 4K Processor, Per Intrattenimento e Sport, HDR, Motion Xceler...",https://www.amazon.it/dp/B0F4T26PSR,50.0,,,,,Amazon,IT,2026-07-10T03:32:35Z,B0F4T26PSR,,,,,
Samsung,"Samsung Crystal UHD 4K Smart TV 43'' UE43U7000FUXZT, Crystal 4K Processor, HDR, Smart Experience, OTS Lite & Adaptive Soun...",https://www.amazon.it/dp/B0F4T2KFZM,43.0,,,,,Amazon,IT,2026-07-10T03:32:35Z,B0F4T2KFZM,,,,,
Samsung,"Samsung Full HD Smart TV 24'' UE24F6000FUXZT, Hyper Real Processor, HDR & Pur Color, Smart Experience, OTS Lite & Adaptive...",https://www.amazon.it/dp/B0F7LM4MHT,24.0,146.72,146.72,EUR,146.72,Amazon,IT,2026-07-10T03:32:35Z,B0F7LM4MHT,,,,,
Samsung,"Samsung Smart TV 32"" QE32Q5FAAUXZT QLED, Full HD, Real QLED, Quantum HDR, Contrast Enhancer, OTS Lite, Adaptive Sound, Gam...",https://www.amazon.it/dp/B0GWN3FQZ4,32.0,,,,,Amazon,IT,2026-07-10T03:32:35Z,B0GWN3FQZ4,,,,,
Samsung,"Samsung Lifestyle TV QE32LS03CBUXZT The Frame QLED Full HD, Smart TV 32"" Matte Display, Art Mode, OTS Lite, Integrato con ...",https://www.amazon.it/dp/B0BWFPKGMZ,32.0,241.79,241.79,EUR,241.79,Amazon,IT,2026-07-10T03:32:35Z,B0BWFPKGMZ,,,,,
Samsung,"SAMSUNG UE43U8072FUXXH 109,2 cm (43"") 4K Ultra HD Smart TV Wi-Fi Nero [Versione Ungherese]",https://www.amazon.it/dp/B0FLDQF3Y7,43.0,,,,,Amazon,IT,2026-07-10T03:32:35Z,B0FLDQF3Y7,,,,,
Samsung,"Samsung Smart TV 50"" UE50DU8070UXZT, Crystal UHD 4K, 4K Upscaling, Airslim Design, DVBT-2, Q-Symphony & Adaptive Sound, In...",https://www.amazon.it/dp/B0D2DV5CV6,50.0,,,,,Amazon,IT,2026-07-10T03:32:35Z,B0D2DV5CV6,,,,,
Samsung,"Samsung TV UE32T5372CDXZT Full HD, Smart TV 32"" HDR, Purcolor, WiFi, Slim Design, Integrato con Bixby e Alexa compatibile ...",https://www.amazon.it/dp/B0BWFP79TV,32.0,187.7,187.7,EUR,187.7,Amazon,IT,2026-07-10T03:32:35Z,B0BWFP79TV,,,,,
Xiaomi,"XIAOMI TV F 32, 32 pollici (81 cm), HD, Smart TV, Fire TV,Triple Tuner DVB-C/S/S2/T/T2, Dolby Audio, DTS Virtual:X, DTS-H...",https://www.amazon.it/dp/B0F4548TCQ,32.0,113.93,113.93,EUR,113.93,Amazon,IT,2026-07-10T03:32:35Z,B0F4548TCQ,,,,,
Samsung,"Samsung UE75U8092FUXXH - TV 75 Pollici, Smart TV, 4K, LED, DVB-T2, Nero, Classe energetica G",https://www.amazon.it/dp/B0G1YTQHQC,75.0,,,,,Amazon,IT,2026-07-10T03:32:35Z,B0G1YTQHQC,,,,,
Xiaomi,"XIAOMI TV F Pro 32, 32 pollici (81 cm), QLED, Smart TV, Fire TV, Triple Tuner DVB-C/S/S2/T/T2,Dolby Audio, DTS Virtual:X, ...",https://www.amazon.it/dp/B0F457M449,32.0,130.33,130.33,EUR,130.33,Amazon,IT,2026-07-10T03:32:35Z,B0F457M449,,,,,
Samsung,"Samsung TV UE50CU8070UXZT Crystal UHD 4K, Smart TV 50"" Processore Crystal 4K, HDR, Adaptive Sound, AirSlim Design, Integra...",https://www.amazon.it/dp/B0BWFPKKCX,50.0,,,,,Amazon,IT,2026-07-10T03:32:35Z,B0BWFPKKCX,,,,,
Samsung,"Samsung TV QE65QN800DTXZT Neo QLED 8K Mini LED, Smart TV 65"" Processore NQ8 AI Gen3, Infinity One, DVBT-2, Q-Symphony & Do...",https://www.amazon.it/dp/B0CZPB53H9,65.0,,,,,Amazon,IT,2026-07-10T03:32:35Z,B0CZPB53H9,,,,,
Samsung,"Samsung TV N4300 Smart Tv 24”, Hd, Wi-Fi, 2020, Nero",https://www.amazon.it/dp/B086R1XMKR,24.0,,,,,Amazon,IT,2026-07-10T03:32:35Z,B086R1XMKR,,,,,
TCL,"TCL 65V6C LED SMART TV Direct da 65"", HDR 4K, con tecnologia Google TV (Dolby Audio, Motion Clarity, compatibile con Googl...",https://www.amazon.it/dp/B0DV9GHKQ6,65.0,,,,,Amazon,IT,2026-07-10T03:32:35Z,B0DV9GHKQ6,,,,,
Samsung,"Samsung TV QE43Q60CAUXZT QLED 4K, Smart TV 43"" Processore Quantum 4K Lite, 100% volume colore con Quantum Dot, OTS Lite, I...",https://www.amazon.it/dp/B0BWFQNKDD,43.0,,,,,Amazon,IT,2026-07-10T03:32:35Z,B0BWFQNKDD,,,,,
Samsung,"Cello C2226TZH TV LED Smart da 22"" senza cornice con Tizen OS di Samsung, Gaming Hub, altoparlanti Pitch Perfect, ideale p...",https://www.amazon.it/dp/B0GHRK4X1B,22.0,159.84,159.84,EUR,159.84,Amazon,IT,2026-07-10T03:32:35Z,B0GHRK4X1B,,,,,
Samsung,"Samsung QE43Q7FAAU - TV 43 Pollici, Smart TV DVB-T2, 3840 x 2160 Pixel 4K, Classe energetica G [Versione Ungherese]",https://www.amazon.it/dp/B0FM3ZTMKS,43.0,,,,,Amazon,IT,2026-07-10T03:32:35Z,B0FM3ZTMKS,,,,,
Panasonic,"Panasonic TB-24S40AEZC, Serie S40 24 pollici Smart TV LED HD, TiVo, Controllo Vocale Google e Alexa, Game Mode, Media Play...",https://www.amazon.it/dp/B0H2MQLH8S,24.0,195.9,195.9,EUR,195.9,Amazon,IT,2026-07-10T03:32:35Z,B0H2MQLH8S,,,,,
Samsung,"Cello C2426TZH TV LED Smart da 24"" senza cornice con Tizen OS di Samsung, Bluetooth, Gaming Hub, altoparlanti Pitch Perfec...",https://www.amazon.it/dp/B0GHRKNV5R,24.0,159.84,159.84,EUR,159.84,Amazon,IT,2026-07-10T03:32:35Z,B0GHRKNV5R,,,,,
Hisense,"Hisense TV 32"" QLED Full HD 2025 32E53QT, Smart TV VIDAA U8, HDR10, Airplay2, Game Mode, Dolby Atmos, Works with Alexa, Tu...",https://www.amazon.it/dp/B0F1VV9V34,32.0,163.11,163.11,EUR,163.11,Amazon,IT,2026-07-10T03:32:35Z,B0F1VV9V34,,,,,
Samsung,"Samsung Smart TV 43"" UE43DU7170UXZT, Crystal 4K UHD, 4K Upscaling, Slim Look, DVBT-2, Q-Symphony & OTS Lite, Integrato con...",https://www.amazon.it/dp/B0D2DS47KW,43.0,,,,,Amazon,IT,2026-07-10T03:32:35Z,B0D2DS47KW,,,,,
Samsung,"Samsung TV QE50Q60CAUXZT QLED 4K, Smart TV 50"" Processore Quantum 4K Lite, 100% volume colore con Quantum Dot, OTS Lite, I...",https://www.amazon.it/dp/B0BWFQNKDC,50.0,,,,,Amazon,IT,2026-07-10T03:32:35Z,B0BWFQNKDC,,,,,
Samsung,Samsung HG43U700FEUXZT - Hotel Tv 43 Pollici 4K Led DVB-T2 Nero Classe Energetica F,https://www.amazon.it/dp/B0H33CNR7P,43.0,,,,,Amazon,IT,2026-07-10T03:32:35Z,B0H33CNR7P,,,,,
Samsung,"Samsung TV QE43Q60DAUXZT QLED 4K, Smart TV 43"" Quantum processor Lite 4K, AirSlim, DVBT-2, Q-Symphony & OTS Lite, Integrat...",https://www.amazon.it/dp/B0D17WSTWS,43.0,,,,,Amazon,IT,2026-07-10T03:32:35Z,B0D17WSTWS,,,,,
Samsung,Samsung UE50M70HAUXZT - TV 50 Pollici Smart TV 4K DVB-T2 LED Nero Classe Energetica F,https://www.amazon.it/dp/B0H4LZ5VCD,50.0,,,,,Amazon,IT,2026-07-10T03:32:35Z,B0H4LZ5VCD,,,,,
TCL,"TCL TV 32V4C - 32"" HD Smart QLED Direct LED con Android TV e HDR - Compatibile con Google Cast e Google Home, Design Delgado",https://www.amazon.it/dp/B0F54B34TH,32.0,130.33,130.33,EUR,130.33,Amazon,IT,2026-07-10T03:32:35Z,B0F54B34TH,,,,,
Samsung,"Samsung QE50Q7FAAUXZT Televisione 50"" Smart TV QLED 4K DVB-T2 HEVC MAIN 10",https://www.amazon.it/dp/B0FLYNMKQ7,50.0,,,,,Amazon,IT,2026-07-10T03:32:35Z,B0FLYNMKQ7,,,,,
Panasonic,"Panasonic TB-40S45AEZC, Serie S45 40 pollici Smart TV LED Full HD, TiVo, Controllo Vocale Google e Alexa, Game Mode, Media...",https://www.amazon.it/dp/B0H2MVR2WW,40.0,273.77,273.77,EUR,273.77,Amazon,IT,2026-07-10T03:32:35Z,B0H2MVR2WW,,,,,
Samsung,"Samsung TV UE43AU7170UXZT, Smart TV 43"" Serie AU7100, Modello AU7170, Crystal UHD 4K, Compatibile con Alexa, Grey, 2021, D...",https://www.amazon.it/dp/B092W6CLTZ,43.0,,,,,Amazon,IT,2026-07-10T03:32:35Z,B092W6CLTZ,,,,,
Samsung,"Samsung Lifestyle TV QE32LS03BBUXZT The Frame QLED Full HD, Smart TV 32"" Matte Display, Art Mode, OTS Lite, Integrato con ...",https://www.amazon.it/dp/B0BNFNWBBC,32.0,,,,,Amazon,IT,2026-07-10T03:32:35Z,B0BNFNWBBC,,,,,
Panasonic,"Panasonic TV-24S50AEZC, Serie S50 24 pollici Smart TV LED HD, Fire TV, HD Colour Engine, HDR, Alexa Voice Control, Game Mo...",https://www.amazon.it/dp/B0H2MPDR7G,24.0,204.1,204.1,EUR,204.1,Amazon,IT,2026-07-10T03:32:35Z,B0H2MPDR7G,,,,,
Samsung,"Samsung TV UE32T4300AEXZT HD, Smart TV 32"" HDR, Purcolor, WiFi, Slim Design, Integrato con Bixby e Alexa compatibile con G...",https://www.amazon.it/dp/B0BWFLLW74,32.0,,,,,Amazon,IT,2026-07-10T03:32:35Z,B0BWFLLW74,,,,,
Samsung,"Samsung UE43RU7170U Smart TV 4k Ultra HD 43"" Wi-Fi DVB-T2CS2, Serie RU7170, 3840 x 2160 Pixels, HDR 10+, Nero, 2019, [Clas...",https://www.amazon.it/dp/B07QKDJVNG,43.0,,,,,Amazon,IT,2026-07-10T03:32:35Z,B07QKDJVNG,,,,,
Samsung,"Samsung TV Crystal UHD 4K UE43AU7090UXZT Smart TV 43"", Modello 2022 AU7090 Wi-Fi Black 2022",https://www.amazon.it/dp/B0BMVNJ7Z1,43.0,,,,,Amazon,IT,2026-07-10T03:32:35Z,B0BMVNJ7Z1,,,,,
TCL,"TCL 32SF560 – 32-inch, Full HD Smart QLED Direct LED TV with Fire TV & HDR, Metallic Design, Frameless",https://www.amazon.it/dp/B0F9PVTQL2,32.0,163.11,163.11,EUR,163.11,Amazon,IT,2026-07-10T03:32:35Z,B0F9PVTQL2,,,,,
Samsung,"Cello CTRAV-27TZ TV Traveller Smart 12V da 27"" con Tizen OS di Samsung, ricezione satellitare, Gaming Hub, altoparlanti Pi...",https://www.amazon.it/dp/B0GHR9GHZL,27.0,237.7,237.7,EUR,237.7,Amazon,IT,2026-07-10T03:32:35Z,B0GHR9GHZL,,,,,
Samsung,"Samsung TV UE55DU7170UXZT LED 4K, Smart TV 55"" Crystal Processor 4K, Slim Look, DVBT-2, Q-Symphony & OTS Lite, Integrato c...",https://www.amazon.it/dp/B0D17TTDJ5,55.0,,,,,Amazon,IT,2026-07-10T03:32:35Z,B0D17TTDJ5,,,,,
Samsung,"TV Samsung The Frame 32"" LS03C Full HD TQ32LS03CBUXXC [Versione Francese, Spagnola, Portoghese]",https://www.amazon.it/dp/B0BPYW45KV,32.0,,,,,Amazon,IT,2026-07-10T03:32:35Z,B0BPYW45KV,,,,,
Samsung,"Samsung TV UE55CU8570UXZT Crystal UHD 4K, Smart TV 55"" Dynamic Crystal color, HDR, OTS Lite, AirSlim Design, Integrato con...",https://www.amazon.it/dp/B0BWFMHYW3,55.0,,,,,Amazon,IT,2026-07-10T03:32:35Z,B0BWFMHYW3,,,,,
Samsung,"SAMSUNG TELEVISOR UE55AU7172U 55"" CRYSTAL UHD 4K WIFI SMART GRIS HDMI USB",https://www.amazon.it/dp/B0992PVBG9,55.0,,,,,Amazon,IT,2026-07-10T03:32:35Z,B0992PVBG9,,,,,
Samsung,"Samsung UE32N5370AUXZT TV 32"" Full HD DVB-C/T2/S2, Serie N5370, 1920 x 1080 Pixels, Nero, (2018)",https://www.amazon.it/dp/B07P5TM2LR,32.0,,,,,Amazon,IT,2026-07-10T03:32:35Z,B07P5TM2LR,,,,,
Panasonic,"Panasonic TB-32S40AEZ, Serie S40 32 pollici Smart TV LED HD, 2024, TiVo, Controllo Vocale Google e Alexa, Game Mode, Media...",https://www.amazon.it/dp/B0DBRDBPB9,32.0,185.3,185.3,EUR,185.3,Amazon,IT,2026-07-10T03:32:35Z,B0DBRDBPB9,,,,,
Samsung,"Samsung TV TU7090 Smart TV 43”, Crystal UHD 4K, Wi-Fi, Black, 2020, compatibile con Alexa",https://www.amazon.it/dp/B08K952TVT,43.0,,,,,Amazon,IT,2026-07-10T03:32:35Z,B08K952TVT,,,,,
Samsung,"Samsung TV UE43TU8070UXZT Smart TV 43"" Serie TU8070, Crystal UHD 4K, Wi-Fi, 2020, con Alexa integrata, Nero",https://www.amazon.it/dp/B087KBDLBP,43.0,,,,,Amazon,IT,2026-07-10T03:32:35Z,B087KBDLBP,,,,,
Samsung,"Samsung Business TV Serie BEF-H da 65"", UHD 3840x2160 con Funzionalità HDR10+, Tizen, HDMI, USB, Bluetooth, WiFi, Accesso ...",https://www.amazon.it/dp/B0GC8LQWZ6,65.0,,,,,Amazon,IT,2026-07-10T03:32:35Z,B0GC8LQWZ6,,,,,
Panasonic,"Panasonic TV-32S55AEZC, Serie S55 32 pollici Smart TV LED Full HD, Fire TV, HD Colour Engine, HDR, Alexa Voice Control, Ga...",https://www.amazon.it/dp/B0H2MK9V3P,32.0,222.45,222.45,EUR,222.45,Amazon,IT,2026-07-10T03:32:35Z,B0H2MK9V3P,,,,,
Samsung,"Cello CTRAV-22TZF Smart TV LED 22"" 12V con lettore DVD, Tizen OS di Samsung, Gaming Hub, altoparlanti Pitch Perfect, Bluet...",https://www.amazon.it/dp/B0GHR92VTB,22.0,229.5,229.5,EUR,229.5,Amazon,IT,2026-07-10T03:32:35Z,B0GHR92VTB,,,,,
Samsung,Smart TV Samsung QN90D 43' 4K Ultra HD LED HDR Neo QLED,https://www.amazon.it/dp/B0CRZFZ36C,43.0,,,,,Amazon,IT,2026-07-10T03:32:35Z,B0CRZFZ36C,,,,,
Samsung,Samsung UE55U7000HUXZT - TV 55 Pollici Smart TV LED 4K DVB-T2 Wifi Classe F,https://www.amazon.it/dp/B0H83CQ8NS,55.0,,,,,Amazon,IT,2026-07-10T03:32:35Z,B0H83CQ8NS,,,,,
Samsung,"Cello CTRAV-24TZ Smart TV LED 24"" 12V per camper e campeggio, Tizen OS di Samsung, Gaming Hub, altoparlanti Pitch Perfect,...",https://www.amazon.it/dp/B0GHRXQKN4,24.0,213.11,213.11,EUR,213.11,Amazon,IT,2026-07-10T03:32:35Z,B0GHRXQKN4,,,,,
Samsung,Samsung QE50QN70HAUXZT - TV 50 Pollici Smart TV 4K Neo QLED DVB-T2 HbbTV 2.0.4 Bluetooth Nero Classe Energetica E,https://www.amazon.it/dp/B0H838LZR4,50.0,,,,,Amazon,IT,2026-07-10T03:32:35Z,B0H838LZR4,,,,,
Samsung,"Samsung TV UE50AU7170UXZT, Smart TV 50"" Serie AU7100, Modello AU7170, Crystal UHD 4K, Compatibile con Alexa, Grey, 2021, D...",https://www.amazon.it/dp/B092W4TNR8,50.0,,,,,Amazon,IT,2026-07-10T03:32:35Z,B092W4TNR8,,,,,
Samsung,"Samsung Crystal UHD UE55CU7190UXZT, Smart TV 55"" Serie CU7000, Crystal UHD 4K, BLACK , 2023, DVB-T2",https://www.amazon.it/dp/B0BWFL6J12,55.0,,,,,Amazon,IT,2026-07-10T03:32:35Z,B0BWFL6J12,,,,,
Samsung,"Samsung TV QE43LS03RAUXZT The Frame 2019 Cornice TV, 4K 43"", Nero",https://www.amazon.it/dp/B07TD8ZS8N,43.0,,,,,Amazon,IT,2026-07-10T03:32:35Z,B07TD8ZS8N,,,,,
Samsung,Samsung QE43QN70HAUXZT - Smart TV 43 Pollici 4K Neo QLED Bluetooth DVB-T2 HbbTV 2.0.4 Nero Classe Energetico F,https://www.amazon.it/dp/B0H838M9K6,43.0,,,,,Amazon,IT,2026-07-10T03:32:35Z,B0H838M9K6,,,,,
Samsung,"Samsung TV UE32N4000AK HD 32'', Serie N4000, 2018, Nero",https://www.amazon.it/dp/B07HBMBRJ1,32.0,,,,,Amazon,IT,2026-07-10T03:32:35Z,B07HBMBRJ1,,,,,
Samsung,"Samsung UE65NU7090UXZT Smart TV UHD, DVB-T2CS2, LED Seria 7 con Sistema HDR powered by HDR10, Display da 65 Pollici, Risol...",https://www.amazon.it/dp/B07JQ9PPR9,65.0,,,,,Amazon,IT,2026-07-10T03:32:35Z,B07JQ9PPR9,,,,,
Samsung,"Samsung TV QLED QE55Q60AAUXZT, Smart TV 55"" Serie Q60A, Modello Base, QLED 4K UHD, Alexa integrato, 2021, DVB-T2 [Efficien...",https://www.amazon.it/dp/B08XZQZPC2,55.0,,,,,Amazon,IT,2026-07-10T03:32:35Z,B08XZQZPC2,,,,,
Samsung,Samsung QE75QN70HAUXZT - Tv 75 Pollici Smart Tv 4K Neo QLed Wifi DVB-T2 Nero Classe Energetica E,https://www.amazon.it/dp/B0H339ZNCK,75.0,,,,,Amazon,IT,2026-07-10T03:32:35Z,B0H339ZNCK,,,,,
Samsung,"TV 32"" LED SAMSUNG UE32T4002 HD HDR PQI 200",https://www.amazon.it/dp/B08LD9676W,32.0,,,,,Amazon,IT,2026-07-10T03:32:35Z,B08LD9676W,,,,,
Samsung,Samsung UE65M80HAUXZT - Tv 65 Pollici Smart Tv 4K Led DVB-T2 Wifi Nero Classe Energetica F,https://www.amazon.it/dp/B0H335WK7T,65.0,,,,,Amazon,IT,2026-07-10T03:32:35Z,B0H335WK7T,,,,,
Samsung,"Cello C2426TZF TV/DVD Smart 24"" senza cornice con Tizen OS di Samsung, Gaming Hub, altoparlanti Pitch Perfect, Bluetooth, ...",https://www.amazon.it/dp/B0GHRDR5K2,24.0,172.12,172.12,EUR,172.12,Amazon,IT,2026-07-10T03:32:35Z,B0GHRDR5K2,,,,,
Samsung,Samsung UE75M70HAUXZT - Tv 75 Pollici Smart Tv 4K Led Wifi DVB-T2 Nero Classe Energetica F,https://www.amazon.it/dp/B0H337V79S,75.0,,,,,Amazon,IT,2026-07-10T03:32:35Z,B0H337V79S,,,,,
Samsung,Samsung UE50U7000HUXZT - Smart TV 50 Pollici LED 4K DVB-T2 Wifi HbbTV CI+ Nero Classe Energetica F,https://www.amazon.it/dp/B0H4MHLLFK,50.0,,,,,Amazon,IT,2026-07-10T03:32:35Z,B0H4MHLLFK,,,,,
Samsung,"Samsung TV QE55Q70CATXZT QLED 4K, Smart TV 55"" Processore Quantum 4K, Dual LED, OTS Lite, AirSlim Design, Integrato con Bi...",https://www.amazon.it/dp/B0BWFNCHDX,55.0,,,,,Amazon,IT,2026-07-10T03:32:35Z,B0BWFNCHDX,,,,,
Samsung,"Samsung 32HT5300 Professional Hotel TV 32""",https://www.amazon.it/dp/B0C18ZG8P8,32.0,262.78,262.78,EUR,262.78,Amazon,IT,2026-07-10T03:32:35Z,B0C18ZG8P8,,,,,
Samsung,"Samsung QE55Q60RATXZT Serie Q60R (2019) QLED Smart TV 55"", Ultra HD 4K, Wi-Fi, Nero",https://www.amazon.it/dp/B07PZXZNLJ,55.0,890.0,890.0,EUR,890.0,Amazon,IT,2026-07-10T03:32:35Z,B07PZXZNLJ,,,,,
Samsung,Smart TV Samsung TQ55LS03BGUXXC 55' 4K Ultra HD,https://www.amazon.it/dp/B0BS43N9ZS,55.0,,,,,Amazon,IT,2026-07-10T03:32:35Z,B0BS43N9ZS,,,,,
Samsung,"Cello C1626TZH Smart TV 16"" con Tizen OS di Samsung, Bluetooth e audio Pitch Perfect, triplo sintonizzatore, TV compatta i...",https://www.amazon.it/dp/B0GJLL18JJ,16.0,163.93,163.93,EUR,163.93,Amazon,IT,2026-07-10T03:32:35Z,B0GJLL18JJ,,,,,
Samsung,"Samsung QE50LS03TAUXZT Smart TV 50"" The Frame, QLED 4K, Ultra HD, Cornice personalizzabile, Art Mode, Processore Quantum 4...",https://www.amazon.it/dp/B0872D83PX,50.0,,,,,Amazon,IT,2026-07-10T03:32:35Z,B0872D83PX,,,,,
Samsung,"Samsung Business TV Serie BEA-H da 50'', UHD 3840x2160 con funzionalità HDR, HDMI, USB, Bluetooth, WiFi, Web Browser, Acce...",https://www.amazon.it/dp/B08VH753W7,50.0,,,,,Amazon,IT,2026-07-10T03:32:35Z,B08VH753W7,,,,,
Samsung,"Samsung UE75TU8072xSmart TV 75 Pollici, 4K (3840x2160 Pixel), DVB-T2, Internet TV",https://www.amazon.it/dp/B089XWMMT6,75.0,,,,,Amazon,IT,2026-07-10T03:32:35Z,B089XWMMT6,,,,,
Samsung,"Samsung TV UE65AU7170UXZT, Smart TV 65"" Serie AU7100, Modello AU7170, Crystal UHD 4K, Compatibile con Alexa, Grey, 2021, D...",https://www.amazon.it/dp/B092W64XKW,65.0,,,,,Amazon,IT,2026-07-10T03:32:35Z,B092W64XKW,,,,,
Samsung,"SAMSUNG UE65TU7172 65"" SMART LED ULTRA HD 4K Televisore HDR DVB-T2 WiFi Nero",https://www.amazon.it/dp/B08BG1BHYT,65.0,,,,,Amazon,IT,2026-07-10T03:32:35Z,B08BG1BHYT,,,,,
Samsung,Samsung TV UHD 55 pollici UE55CU7172U,https://www.amazon.it/dp/B0C279HDSX,55.0,,,,,Amazon,IT,2026-07-10T03:32:35Z,B0C279HDSX,,,,,
Samsung,"Samsung TV Crystal UHD UE55BU8570UXZT, Smart TV 55"" Serie BU8570, Crystal UHD 4K, Alexa e Google Assistant integrati, Blac...",https://www.amazon.it/dp/B09XN6MHWS,55.0,,,,,Amazon,IT,2026-07-10T03:32:35Z,B09XN6MHWS,,,,,
Samsung,Samsung UE50U8000HUXZT - Smart TV 50 Pollici 4K LED DVB-T2 Wifi HbbTV 2.0.4 Nero Classe Energetica F,https://www.amazon.it/dp/B0H4MKFQW3,50.0,,,,,Amazon,IT,2026-07-10T03:32:35Z,B0H4MKFQW3,,,,,
Samsung,"Cello CTRAV-32TZ TV LED Smart da 32"" senza cornice 12V con Tizen OS di Samsung, Gaming Hub, altoparlanti Pitch Perfect, HD...",https://www.amazon.it/dp/B0GHRHWZ1S,32.0,245.89,245.89,EUR,245.89,Amazon,IT,2026-07-10T03:32:35Z,B0GHRHWZ1S,,,,,
Samsung,"Samsung TV UE43AU8070UXZT, Smart TV 43"" Serie AU8000, Modello AU8070, Crystal UHD 4K, Alexa integrato, Nero, 2021, DVB-T2...",https://www.amazon.it/dp/B08XZQ3BSY,43.0,,,,,Amazon,IT,2026-07-10T03:32:35Z,B08XZQ3BSY,,,,,
Samsung,"Samsung The Frame QE43LS03RAU 109,2 cm (43"") 4K Ultra HD Smart TV Wi-Fi, DVB-T2, Nero",https://www.amazon.it/dp/B07NHMWRQF,43.0,,,,,Amazon,IT,2026-07-10T03:32:35Z,B07NHMWRQF,,,,,
Samsung,Samsung QE48S95HAE - Smart TV 48 Pollici 4K 3840 x 2160 Pixel OLED DVB-T2 Wifi Nero Classe Energetica F,https://www.amazon.it/dp/B0H4LS36XM,48.0,,,,,Amazon,IT,2026-07-10T03:32:35Z,B0H4LS36XM,,,,,
Samsung,"Samsung TV QE43Q60TAUXZT Serie Q60T QLED Smart TV 43"", con Alexa integrata, Ultra HD 4K, Wi-Fi, Black, 2020",https://www.amazon.it/dp/B086B2WHXD,43.0,,,,,Amazon,IT,2026-07-10T03:32:35Z,B086B2WHXD,,,,,
Samsung,"Cello CTRAV-32TZF Smart TV LED 32"" 12V con lettore DVD, Tizen OS di Samsung, Gaming Hub, altoparlanti Pitch Perfect, Bluet...",https://www.amazon.it/dp/B0GHRDVM33,32.0,262.29,262.29,EUR,262.29,Amazon,IT,2026-07-10T03:32:35Z,B0GHRDVM33,,,,,
Samsung,Samsung UE75M80HAUXZT -Tv 75 Pollici Smart Tv 4K Mini Led Wifi DVB-T2 Nero Classe Energetica F,https://www.amazon.it/dp/B0H338C5DT,75.0,,,,,Amazon,IT,2026-07-10T03:32:35Z,B0H338C5DT,,,,,
Samsung,Samsung UE55M80HAUXZT - Smart TV 55 Pollici LED 4K DVB-T2 Wifi HbbTV CI+ Nero Classe Energetica E,https://www.amazon.it/dp/B0H4MQYTM3,55.0,,,,,Amazon,IT,2026-07-10T03:32:35Z,B0H4MQYTM3,,,,,
Samsung,"SAMSUNG UE50NU7092 TV 50"" LED UHD 4K SMART DVB-T2/S2-50NU7092",https://www.amazon.it/dp/B07H87XFRR,50.0,,,,,Amazon,IT,2026-07-10T03:32:35Z,B07H87XFRR,,,,,
Samsung,"Cello CTRAV-16TZ Smart TV 16"" 12V per camper, camion e barca, Tizen OS di Samsung, Bluetooth, audio Pitch Perfect, Gaming ...",https://www.amazon.it/dp/B0GJLKVJLP,16.0,188.52,188.52,EUR,188.52,Amazon,IT,2026-07-10T03:32:35Z,B0GJLKVJLP,,,,,
Samsung,"TV SAMSUNG LED 43"" 43TU7072 SMART 4K EU",https://www.amazon.it/dp/B08BZSW31P,43.0,,,,,Amazon,IT,2026-07-10T03:32:35Z,B08BZSW31P,,,,,
Samsung,"Samsung TV UE55TU7190UXZT Smart TV 55"" Serie TU7190, Crystal UHD 4K, Wi-Fi, 2020, Argento, compatibile con Alexa",https://www.amazon.it/dp/B087KB7WQL,55.0,,,,,Amazon,IT,2026-07-10T03:32:35Z,B087KB7WQL,,,,,
Samsung,"Samsung TV Crystal UHD UE43BU8070UXZT, Smart TV 43"" Serie BU8070, Crystal UHD 4K, Alexa e Google Assistant integrati, Blac...",https://www.amazon.it/dp/B09XN5TR6Z,43.0,,,,,Amazon,IT,2026-07-10T03:32:35Z,B09XN5TR6Z,,,,,
Samsung,"Samsung TV UE55AU7170UXZT, Smart TV 55"" Serie AU7100, Modello AU7170, Crystal UHD 4K, Compatibile con Alexa, Grey, 2021, D...",https://www.amazon.it/dp/B092W66YFM,55.0,,,,,Amazon,IT,2026-07-10T03:32:35Z,B092W66YFM,,,,,
Samsung,"Samsung UE65NU7170U 65"" 4K Ultra HD Smart TV Wi-Fi Nero",https://www.amazon.it/dp/B07CSPBWQC,65.0,,,,,Amazon,IT,2026-07-10T03:32:35Z,B07CSPBWQC,,,,,
Samsung,"Samsung T4000 Tv 32”, Hd, Nero, 2020, ‎71.9 x 16.6 x 46.4 cm, 4 Kg",https://www.amazon.it/dp/B08CXFQ7KC,32.0,,,,,Amazon,IT,2026-07-10T03:32:35Z,B08CXFQ7KC,,,,,
Samsung,"Cello Ctrav-27TZF TV/DVD Smart 27"" 12V con Tizen OS di Samsung, altoparlanti Pitch Perfect, Bluetooth, HDMI, USB, prodotto...",https://www.amazon.it/dp/B0GHRL8T34,27.0,245.89,245.89,EUR,245.89,Amazon,IT,2026-07-10T03:32:35Z,B0GHRL8T34,,,,,
Samsung,"SAMSUNG TV LED 43"" UE43TU7122 Ultra HD 4K Smart TV WiFi DVB-T2",https://www.amazon.it/dp/B08F6XKC4V,43.0,,,,,Amazon,IT,2026-07-10T03:32:35Z,B08F6XKC4V,,,,,
Samsung,"Samsung Telewizor UE32N5302 LED 32"" F",https://www.amazon.it/dp/B07SNQ3WJ5,32.0,,,,,Amazon,IT,2026-07-10T03:32:35Z,B07SNQ3WJ5,,,,,
Samsung,"Samsung TU7070 Smart TV 50”, Crystal UHD 4K, Wi-Fi, 2020, Nero",https://www.amazon.it/dp/B088C3C21F,50.0,,,,,Amazon,IT,2026-07-10T03:32:35Z,B088C3C21F,,,,,
Samsung,"SAMSUNG TV LED 32"" UE32N5372 Full HD Smart TV Europa Black",https://www.amazon.it/dp/B0849KVXW2,32.0,,,,,Amazon,IT,2026-07-10T03:32:35Z,B0849KVXW2,,,,,
Samsung,"SAMSUNG Display LFD 32"" LED QM32R-T 32 1920x1080 Full HD con MagicInfo",https://www.amazon.it/dp/B08GG2YR84,32.0,,,,,Amazon,IT,2026-07-10T03:32:35Z,B08GG2YR84,,,,,
Samsung,"Cornice TV compatibile con Samsung The Frame TV, adatta per televisori a parete (Verona Gold 75 mm, 55 pollici)",https://www.amazon.it/dp/B0GQ68K3C8,55.0,338.45,338.45,EUR,338.45,Amazon,IT,2026-07-10T03:32:35Z,B0GQ68K3C8,,,,,
Samsung,SAMSUNG UE75CU7172UXXH 75inch UHD LED,https://www.amazon.it/dp/B0C277QJ1G,75.0,,,,,Amazon,IT,2026-07-10T03:32:35Z,B0C277QJ1G,,,,,
Samsung,"Samsung TV TU7090 Smart TV 55”, Crystal UHD 4K, Wi-Fi, Black, 2020, compatibile con Alexa",https://www.amazon.it/dp/B08K96825N,55.0,,,,,Amazon,IT,2026-07-10T03:32:35Z,B08K96825N,,,,,
LG,"LG 55UK6200PLA Smart Tv Uhd 4K da 55"", Active Hdr, Hdr10 Pro e Hlg",https://www.amazon.it/dp/B07GFH8T77,55.0,,,,,Amazon,IT,2026-07-10T03:32:35Z,B07GFH8T77,,,,,
LG,"LG 32LK500BPLA 32"" HD Black LED TV - LED TVs (80 cm / 32""), 1366 x 768 pixels, HD, LED, DVB-C,DVB-S2,DVB-T2, Nero",https://www.amazon.it/dp/B07DW8B83S,32.0,,,,,Amazon,IT,2026-07-10T03:32:35Z,B07DW8B83S,,,,,
Samsung,"Cello CTRAV-24TZF Smart TV LED 24"" 12V con lettore DVD per camper e campeggio, Tizen OS di Samsung, Gaming Hub, altoparlan...",https://www.amazon.it/dp/B0GHRPLHJ9,24.0,229.5,229.5,EUR,229.5,Amazon,IT,2026-07-10T03:32:35Z,B0GHRPLHJ9,,,,,
Samsung,SAMSUNG Cornice 2021-22 The Frame 43'' Marrone,https://www.amazon.it/dp/B096BK8T1Z,43.0,,,,,Amazon,IT,2026-07-10T03:32:35Z,B096BK8T1Z,,,,,
Samsung,"Cello CTRAV-19TZ Smart TV 19"" 12V per camper e campeggio, Tizen OS di Samsung, Gaming Hub, altoparlanti Pitch Perfect, Blu...",https://www.amazon.it/dp/B0GJLKGZ8C,19.0,196.71,196.71,EUR,196.71,Amazon,IT,2026-07-10T03:32:35Z,B0GJLKGZ8C,,,,,
Hisense,"Hisense 50"" QLED 4K 2023 50E77KQ, Smart TV VIDAA U6, Dolby Vision, HDR 10+, Game Mode PRO Plus, Alexa Built-in, VIDAA Voic...",https://www.amazon.it/dp/B0C5N4NWFM,50.0,,,,,Amazon,IT,2026-07-10T03:32:35Z,B0C5N4NWFM,,,,,
Xiaomi,"XIAOMI TV F 32, 32 pollici (81 cm), HD, Smart TV, Fire TV, Dolby Audio, DTS Virtual:X, DTS-HD, Alexa Voice Control, funzio...",https://www.amazon.it/dp/B0FCXRJ6V5,32.0,,,,,Amazon,IT,2026-07-10T03:32:35Z,B0FCXRJ6V5,,,,,
Samsung,"Cello C1926TZH Smart TV 19"" con Tizen OS di Samsung, Gaming Hub, altoparlanti Pitch Perfect, Bluetooth, triplo sintonizzat...",https://www.amazon.it/dp/B0GJLXCQPN,19.0,155.73,155.73,EUR,155.73,Amazon,IT,2026-07-10T03:32:35Z,B0GJLXCQPN,,,,,
Samsung,"Deco - Cornici per TV in lega prismatica – Lunetta argento tedesca compatibile solo con Samsung The Frame TV (32"", adatta ...",https://www.amazon.it/dp/B09D3XM522,32.0,198.9,198.9,EUR,198.9,Amazon,IT,2026-07-10T03:32:35Z,B09D3XM522,,,,,
Samsung,"Accessori For Schede Madri TV Da 40, 43, 48 E 55 Pollici, Compatibili Con Samsung, BN94-09536B BN97-10716A BN97-10371A BN4...",https://www.amazon.it/dp/B0H7XCWSVJ,55.0,,,,,Amazon,IT,2026-07-10T03:32:35Z,B0H7XCWSVJ,,,,,
Samsung,"46 Accessori For Scheda Logica TV LCD Da 55 Pollici, Compatibili Con Samsung, BN41-01789A BN41-01789 BN41-01789A BN41-0178...",https://www.amazon.it/dp/B0H7XPNJT7,55.0,,,,,Amazon,IT,2026-07-10T03:32:35Z,B0H7XPNJT7,,,,,
Samsung,"Scheda madre TV, 75 pollici, compatibile for Samsung UA75H6400AJ LH75EDEPLGC, scheda di alimentazione",https://www.amazon.it/dp/B0H7R6KYWR,75.0,,,,,Amazon,IT,2026-07-10T03:32:35Z,B0H7R6KYWR,,,,,
Samsung,"Neomounts Samsung FL50-515WH1 - Trolley pieghevole da 55-65"", girevole, installazione rapida",https://www.amazon.it/dp/B0GZHHWQF7,65.0,,,,,Amazon,IT,2026-07-10T03:32:35Z,B0GZHHWQF7,,,,,
